city,postalCode,id,adType,propertyType,reference,description,title,publicationDate,modificationDate,newProperty,accountType,isBienIciExclusive,agencyFeeUrl,surfaceArea,roomsQuantity,bedroomsQuantity,bathroomsQuantity,hasCellar,showerRoomsQuantity,toiletQuantity,hasIntercom,hasPool,hasFirePlace,floorQuantity,parkingPlacesQuantity,hasElevator,floor,energyPerformanceDiagnosticDate,energyValue,greenhouseGazValue,minEnergyConsumption,maxEnergyConsumption,energyClassification,greenhouseGazClassification,isInCondominium,annualCondominiumFees,condominiumPartsQuantity,isExclusiveSaleMandate,feesChargedTo,priceWithoutFees,photos,price,useJuly2021EnergyPerformanceDiagnostic,adCreatedByPro,heating,departmentCode,addressKnown,displayDistrictName,pricePerSquareMeter,postalCodeForSearchFilters,descriptionTextLength,priceHasDecreased,transactionType,adTypeFR,with3dModel,endOfPromotedAsExclusive,opticalFiberStatus,nothingBehindForm,highlightMailContact,displayInsuranceEstimation,phoneDisplays,blurInfo.type,blurInfo.radius,blurInfo.bbox,blurInfo.position.lat,blurInfo.position.lon,blurInfo.centroid.lat,blurInfo.centroid.lon,chargingStations.providers,district.id_polygone,district.id_type,district.name,district.libelle,district.cp,district.code_insee,district.id,district.insee_code,district.postal_code,district.type_id,status.onTheMarket,status.closedByUser,status.autoImported,status.isLeading,status.highlighted,status.is3dHighlighted,userRelativeData.importAccountId,userRelativeData.accountIds,userRelativeData.searchAccountIds,userRelativeData.isAdmin,userRelativeData.isAdModifier,userRelativeData.canSetAsFeatured,userRelativeData.canSeeExactPosition,userRelativeData.canSeeAddress,userRelativeData.canSeeStats,userRelativeData.canOpenAdDetail,userRelativeData.canSeeRealDates,userRelativeData.canSeePublicationCertificateHtml,userRelativeData.canSeePublicationCertificatePdf
Limoges,87000,ag060811-498827369,buy,flat,830031935415,"Quartier Garibaldi -Théodore Bac - Appartement de type 6 avec grands balcons au quatrième et dernier étage d'une belle résidence de standing avec ascenseur - Vous serez séduits par sa vue imprenable  - ses volumes et sa luminosité ainsi que sa proximité à pied de toutes les commodités - Il comprend une entrée, salon séjour , cuisine équipée , wc indépendant , trois chambres dont une avec salle d'eau et wc , un bureau avec dressing ou rangement .En sous-sol: deux garages fermés et une cave - Très bon état - A VOIR SANS ATTENDRE  Nombre de lots de la copropriété: 41, Montant moyen de la quote-part annuelle de charges (budget prévisionnel) (CHG DE COPRO EAU ASC MEN) : 2133€ soit 177€ par mois. Les honoraires sont à la charge du vendeur.
Les informations sur les risques auxquels ce bien est exposé sont disponibles sur le site Géorisques : www.georisques.gouv.fr.

Contactez Stéphanie CHISSADON Entrepreneur Individuel, Agent commercial OptimHome (RSAC N°507 528 495 Greffe de LIMOGES) <span class=""importDescriptionDecorator"" data-type=""phone"">06 85 02 76 46</span> (réf. 596549 )",VUE IMPRENABLE POUR CET APPARTEMENT DE TYPE 6 AU DERNIER ETAGE AVEC ASCENSEUR - BALCON - 2 GGES ET CAVE,2025-11-15T01:14:02.215Z,2025-11-15T11:37:42.474Z,False,mandatary,False,http://assets.digitregroup.io/optimhome/optimhome_baremes_agence_B2025-A.pdf,130,6,3,1,True,1,2,True,False,False,5,2,True,4,2025-11-13,193,6,1934,2616,D,B,True,2133,41,True,seller,295000,"[{'url_photo': 'https://photos.ubiflow.net/60811/498827369/photos/1.jpg?INSOON_EB_5512801818_20251115110151', 'photo': 'ag060811-498827369_photos.ubiflow.net_60811_498827369_photos_1.jpg_INSOON_EB_5512801818_20251115110151', 'url': 'https://file.bienici.com/photo/ag060811-498827369_photos.ubiflow.net_60811_498827369_photos_1.jpg_INSOON_EB_5512801818_20251115110151'}, {'url_photo': 'https://photos.ubiflow.net/60811/498827369/photos/2.jpg?INSOON_EB_5512801818_20251115113500', 'photo': 'ag060811-498827369_photos.ubiflow.net_60811_498827369_photos_2.jpg_INSOON_EB_5512801818_20251115113500', 'url': 'https://file.bienici.com/photo/ag060811-498827369_photos.ubiflow.net_60811_498827369_photos_2.jpg_INSOON_EB_5512801818_20251115113500'}, {'url_photo': 'https://photos.ubiflow.net/60811/498827369/photos/3.jpg?INSOON_EB_5512801818_20251115113500', 'photo': 'ag060811-498827369_photos.ubiflow.net_60811_498827369_photos_3.jpg_INSOON_EB_5512801818_20251115113500', 'url': 'https://file.bienici.com/photo/ag060811-498827369_photos.ubiflow.net_60811_498827369_photos_3.jpg_INSOON_EB_5512801818_20251115113500'}, {'url_photo': 'https://photos.ubiflow.net/60811/498827369/photos/4.jpg?INSOON_EB_5512801818_20251115113500', 'photo': 'ag060811-498827369_photos.ubiflow.net_60811_498827369_photos_4.jpg_INSOON_EB_5512801818_20251115113500', 'url': 'https://file.bienici.com/photo/ag060811-498827369_photos.ubiflow.net_60811_498827369_photos_4.jpg_INSOON_EB_5512801818_20251115113500'}, {'url_photo': 'https://photos.ubiflow.net/60811/498827369/photos/5.jpg?INSOON_EB_5512801818_20251115113500', 'photo': 'ag060811-498827369_photos.ubiflow.net_60811_498827369_photos_5.jpg_INSOON_EB_5512801818_20251115113500', 'url': 'https://file.bienici.com/photo/ag060811-498827369_photos.ubiflow.net_60811_498827369_photos_5.jpg_INSOON_EB_5512801818_20251115113500'}, {'url_photo': 'https://photos.ubiflow.net/60811/498827369/photos/6.jpg?INSOON_EB_5512801818_20251115003259', 'photo': 'ag060811-498827369_photos.ubiflow.net_60811_498827369_photos_6.jpg_INSOON_EB_5512801818_20251115003259', 'url': 'https://file.bienici.com/photo/ag060811-498827369_photos.ubiflow.net_60811_498827369_photos_6.jpg_INSOON_EB_5512801818_20251115003259'}, {'url_photo': 'https://photos.ubiflow.net/60811/498827369/photos/7.jpg?INSOON_EB_5512801818_20251115110151', 'photo': 'ag060811-498827369_photos.ubiflow.net_60811_498827369_photos_7.jpg_INSOON_EB_5512801818_20251115110151', 'url': 'https://file.bienici.com/photo/ag060811-498827369_photos.ubiflow.net_60811_498827369_photos_7.jpg_INSOON_EB_5512801818_20251115110151'}, {'url_photo': 'https://photos.ubiflow.net/60811/498827369/photos/8.jpg?INSOON_EB_5512801818_20251115110151', 'photo': 'ag060811-498827369_photos.ubiflow.net_60811_498827369_photos_8.jpg_INSOON_EB_5512801818_20251115110151', 'url': 'https://file.bienici.com/photo/ag060811-498827369_photos.ubiflow.net_60811_498827369_photos_8.jpg_INSOON_EB_5512801818_20251115110151'}, {'url_photo': 'https://photos.ubiflow.net/60811/498827369/photos/9.jpg?INSOON_EB_5512801818_20251115003259', 'photo': 'ag060811-498827369_photos.ubiflow.net_60811_498827369_photos_9.jpg_INSOON_EB_5512801818_20251115003259', 'url': 'https://file.bienici.com/photo/ag060811-498827369_photos.ubiflow.net_60811_498827369_photos_9.jpg_INSOON_EB_5512801818_20251115003259'}, {'url_photo': 'https://photos.ubiflow.net/60811/498827369/photos/10.jpg?INSOON_EB_5512801818_20251115110151', 'photo': 'ag060811-498827369_photos.ubiflow.net_60811_498827369_photos_10.jpg_INSOON_EB_5512801818_20251115110151', 'url': 'https://file.bienici.com/photo/ag060811-498827369_photos.ubiflow.net_60811_498827369_photos_10.jpg_INSOON_EB_5512801818_20251115110151'}, {'url_photo': 'https://photos.ubiflow.net/60811/498827369/photos/11.jpg?INSOON_EB_5512801818_20251115110151', 'photo': 'ag060811-498827369_photos.ubiflow.net_60811_498827369_photos_11.jpg_INSOON_EB_5512801818_20251115110151', 'url': 'https://file.bienici.com/photo/ag060811-498827369_photos.ubiflow.net_60811_498827369_photos_11.jpg_INSOON_EB_5512801818_20251115110151'}, {'url_photo': 'https://photos.ubiflow.net/60811/498827369/photos/12.jpg?INSOON_EB_5512801818_20251115110151', 'photo': 'ag060811-498827369_photos.ubiflow.net_60811_498827369_photos_12.jpg_INSOON_EB_5512801818_20251115110151', 'url': 'https://file.bienici.com/photo/ag060811-498827369_photos.ubiflow.net_60811_498827369_photos_12.jpg_INSOON_EB_5512801818_20251115110151'}, {'url_photo': 'https://photos.ubiflow.net/60811/498827369/photos/13.jpg?INSOON_EB_5512801818_20251115110151', 'photo': 'ag060811-498827369_photos.ubiflow.net_60811_498827369_photos_13.jpg_INSOON_EB_5512801818_20251115110151', 'url': 'https://file.bienici.com/photo/ag060811-498827369_photos.ubiflow.net_60811_498827369_photos_13.jpg_INSOON_EB_5512801818_20251115110151'}, {'url_photo': 'https://photos.ubiflow.net/60811/498827369/photos/14.jpg?INSOON_EB_5512801818_20251115110151', 'photo': 'ag060811-498827369_photos.ubiflow.net_60811_498827369_photos_14.jpg_INSOON_EB_5512801818_20251115110151', 'url': 'https://file.bienici.com/photo/ag060811-498827369_photos.ubiflow.net_60811_498827369_photos_14.jpg_INSOON_EB_5512801818_20251115110151'}, {'url_photo': 'https://photos.ubiflow.net/60811/498827369/photos/15.jpg?INSOON_EB_5512801818_20251115110151', 'photo': 'ag060811-498827369_photos.ubiflow.net_60811_498827369_photos_15.jpg_INSOON_EB_5512801818_20251115110151', 'url': 'https://file.bienici.com/photo/ag060811-498827369_photos.ubiflow.net_60811_498827369_photos_15.jpg_INSOON_EB_5512801818_20251115110151'}, {'url_photo': 'https://photos.ubiflow.net/60811/498827369/photos/16.jpg?INSOON_EB_5512801818_20251115110151', 'photo': 'ag060811-498827369_photos.ubiflow.net_60811_498827369_photos_16.jpg_INSOON_EB_5512801818_20251115110151', 'url': 'https://file.bienici.com/photo/ag060811-498827369_photos.ubiflow.net_60811_498827369_photos_16.jpg_INSOON_EB_5512801818_20251115110151'}, {'url_photo': 'https://photos.ubiflow.net/60811/498827369/photos/17.jpg?INSOON_EB_5512801818_20251115110151', 'photo': 'ag060811-498827369_photos.ubiflow.net_60811_498827369_photos_17.jpg_INSOON_EB_5512801818_20251115110151', 'url': 'https://file.bienici.com/photo/ag060811-498827369_photos.ubiflow.net_60811_498827369_photos_17.jpg_INSOON_EB_5512801818_20251115110151'}, {'url_photo': 'https://photos.ubiflow.net/60811/498827369/photos/18.jpg?INSOON_EB_5512801818_20251115110151', 'photo': 'ag060811-498827369_photos.ubiflow.net_60811_498827369_photos_18.jpg_INSOON_EB_5512801818_20251115110151', 'url': 'https://file.bienici.com/photo/ag060811-498827369_photos.ubiflow.net_60811_498827369_photos_18.jpg_INSOON_EB_5512801818_20251115110151'}]",295000,True,True,électricité,87,True,True,2269.230769230769,87000,1025,False,buy,vente,False,0,deploye,False,False,True,[],disk,50,"[1.2595833074303835, 45.83777048281695, 1.2608727254801444, 45.83866880062713]",45.83821964172204,1.260228016455264,45.83821964172204,1.260228016455264,[],101083,1,Limoges - Centre-ville - Hôtel de Ville - Emailleurs,Centre-ville - Hôtel de Ville - Emailleurs,87000,87085,101083,87085,87000,1,True,False,True,False,False,False,558bbfd06fbf04e50075bbce,['ubiflow-easybusiness-ag060811-980'],"['ubiflow-easybusiness-ag060811-980', 'ubiflow-easybusiness-ag060811', '5f3bacb2b46a5f00b5b5fc6d', 'contract-type-mandatary', '558bbfd06fbf04e50075bbce']",False,False,False,False,False,False,True,False,False,False
Limoges,87100,True,citya-immobilier-1265-TAPP956782,buy,flat,TAPP956782,"À vendre : Appartement T3 de 61 m² avec garage à Limoges, idéalement situé au 3ème étage. - À VENDRE : Charmant appartement T3 situé dans la belle ville de Limoges, au cœur d'un quartier paisible et convivial. Ce bien, construit en 1964, offre une surface habitable de 61 m², idéal pour une petite famille ou un couple à la recherche de confort et de praticité.

Dès votre entrée, vous serez séduit par la luminosité de cet appartement, grâce à ses grandes fenêtres qui laissent entrer la lumière naturelle. Le salon, d'une superficie de 15,86 m², est un espace chaleureux où vous pourrez vous détendre après une longue journée. La disposition des pièces est pensée pour optimiser l'espace et favoriser la convivialité.

L'appartement comprend deux chambres spacieuses, parfaites pour accueillir vos nuits paisibles. La salle de bain est fonctionnelle et bien agencée, offrant tout le nécessaire pour votre quotidien. De plus, vous bénéficierez d'un garage, un atout précieux dans cette ville, vous permettant de stationner votre véhicule en toute sécurité.

Le chauffage collectif au gaz, avec des radiateurs, assure un confort optimal tout au long de l'année. Situé au dernier étage d'un immeuble de trois étages, cet appartement vous garantit tranquillité et intimité. 

Enfin, cet appartement est situé dans une résidence bien entretenue, offrant un cadre de vie agréable et sécurisé. Ne manquez pas cette opportunité de devenir propriétaire d'un bien qui allie confort, praticité et emplacement de choix à Limoges. Venez le découvrir sans tarder !.  Le bien est soumis au statut de la copropriété , la copropriété comporte 140 lots , la quote-part budget prévisionnel (dépenses courantes) est de 2 700,00 euros/an. 
 Honoraires à la charge du vendeur. 
Vous pouvez consulter les barèmes d'honoraires à l'adresse suivante : <span class=""importDescriptionDecorator"" data-url=""https://www.citya.com/agences-immobilieres/limoges-87085/170"" data-type=""agencyFeeUrl"">https://www.citya.com/agences-immobilieres/limoges-87085/170</span> . Montant estimé des dépenses annuelles d'énergie pour un usage standard : entre 1 294 et 1 750 euros. Prix moyens des énergies indexés en 2021. Les informations sur les risques auxquels ce bien est exposé sont disponibles sur le site Géorisques : https://www.georisques.gouv.fr",2025-11-06T19:07:57.155Z,2025-11-07T04:07:21.349Z,False,1964,"[{'url': 'https://player.previsite.net/video/0FAD3EB6CE9B3F3445438B2BC631FB78', 'previewImageUrl': 'https://player.previsite.net/image/0FAD3EB6CE9B3F3445438B2BC631FB78.jpg', 'type': 'video', 'highlighted': True, 'accepted': True, 'https': True, 'size': 'responsive', 'mobileSupport': True, 'id': 'citya-immobilier-1265-TAPP956782_virtualTour_0'}]",agency,True,citya-immobilier-1265_LOGO_media.arche.fr_entities_logos_default_170.png,Citya Durivaud,E,E,261,57,2025-10-24,1294.0,1750.0,2021-01-01,99000,True,https://www.citya.com/agences-immobilieres/limoges-87085/170,seller,2700.0,140.0,3.0,4.0,3,2,1,0,0,0,0,1,61.6,False,False,"[{'url_photo': 'http://cityabox-web.ics.infoclip.fr/icsbox/cit_CITYA_LIMOGES_tic/transaction/photo/exclusivite-filigrane-18187855_limoges_05112025_10-13648229504080906513.jpg', 'photo': 'citya-immobilier-1265-TAPP956782_cityabox-web.ics.infoclip.fr_icsbox_cit_CITYA_LIMOGES_tic_transaction_photo_exclusivite-filigrane-18187855_limoges_05112025_10-13648229504080906513.jpg', 'url': 'https://file.bienici.com/photo/citya-immobilier-1265-TAPP956782_cityabox-web.ics.infoclip.fr_icsbox_cit_CITYA_LIMOGES_tic_transaction_photo_exclusivite-filigrane-18187855_limoges_05112025_10-13648229504080906513.jpg'}, {'url_photo': 'http://cityabox-web.ics.infoclip.fr/icsbox/cit_CITYA_LIMOGES_tic/transaction/photo/filigrane-18187855_limoges_05112025_1-7261352710744761937.jpg', 'photo': 'citya-immobilier-1265-TAPP956782_cityabox-web.ics.infoclip.fr_icsbox_cit_CITYA_LIMOGES_tic_transaction_photo_filigrane-18187855_limoges_05112025_1-7261352710744761937.jpg', 'url': 'https://file.bienici.com/photo/citya-immobilier-1265-TAPP956782_cityabox-web.ics.infoclip.fr_icsbox_cit_CITYA_LIMOGES_tic_transaction_photo_filigrane-18187855_limoges_05112025_1-7261352710744761937.jpg'}, {'url_photo': 'http://cityabox-web.ics.infoclip.fr/icsbox/cit_CITYA_LIMOGES_tic/transaction/photo/filigrane-18187855_limoges_05112025_3-12401774585650331464.jpg', 'photo': 'citya-immobilier-1265-TAPP956782_cityabox-web.ics.infoclip.fr_icsbox_cit_CITYA_LIMOGES_tic_transaction_photo_filigrane-18187855_limoges_05112025_3-12401774585650331464.jpg', 'url': 'https://file.bienici.com/photo/citya-immobilier-1265-TAPP956782_cityabox-web.ics.infoclip.fr_icsbox_cit_CITYA_LIMOGES_tic_transaction_photo_filigrane-18187855_limoges_05112025_3-12401774585650331464.jpg'}, {'url_photo': 'http://cityabox-web.ics.infoclip.fr/icsbox/cit_CITYA_LIMOGES_tic/transaction/photo/filigrane-18187855_limoges_05112025_6-7276254545290324484.jpg', 'photo': 'citya-immobilier-1265-TAPP956782_cityabox-web.ics.infoclip.fr_icsbox_cit_CITYA_LIMOGES_tic_transaction_photo_filigrane-18187855_limoges_05112025_6-7276254545290324484.jpg', 'url': 'https://file.bienici.com/photo/citya-immobilier-1265-TAPP956782_cityabox-web.ics.infoclip.fr_icsbox_cit_CITYA_LIMOGES_tic_transaction_photo_filigrane-18187855_limoges_05112025_6-7276254545290324484.jpg'}, {'url_photo': 'http://cityabox-web.ics.infoclip.fr/icsbox/cit_CITYA_LIMOGES_tic/transaction/photo/filigrane-18187855_limoges_05112025_4-14631394804569383462.jpg', 'photo': 'citya-immobilier-1265-TAPP956782_cityabox-web.ics.infoclip.fr_icsbox_cit_CITYA_LIMOGES_tic_transaction_photo_filigrane-18187855_limoges_05112025_4-14631394804569383462.jpg', 'url': 'https://file.bienici.com/photo/citya-immobilier-1265-TAPP956782_cityabox-web.ics.infoclip.fr_icsbox_cit_CITYA_LIMOGES_tic_transaction_photo_filigrane-18187855_limoges_05112025_4-14631394804569383462.jpg'}, {'url_photo': 'http://cityabox-web.ics.infoclip.fr/icsbox/cit_CITYA_LIMOGES_tic/transaction/photo/filigrane-18187855_limoges_05112025_8-11337460190166788518.jpg', 'photo': 'citya-immobilier-1265-TAPP956782_cityabox-web.ics.infoclip.fr_icsbox_cit_CITYA_LIMOGES_tic_transaction_photo_filigrane-18187855_limoges_05112025_8-11337460190166788518.jpg', 'url': 'https://file.bienici.com/photo/citya-immobilier-1265-TAPP956782_cityabox-web.ics.infoclip.fr_icsbox_cit_CITYA_LIMOGES_tic_transaction_photo_filigrane-18187855_limoges_05112025_8-11337460190166788518.jpg'}, {'url_photo': 'http://cityabox-web.ics.infoclip.fr/icsbox/cit_CITYA_LIMOGES_tic/transaction/photo/filigrane-18187855_limoges_05112025_12-16538278609138748371.jpg', 'photo': 'citya-immobilier-1265-TAPP956782_cityabox-web.ics.infoclip.fr_icsbox_cit_CITYA_LIMOGES_tic_transaction_photo_filigrane-18187855_limoges_05112025_12-16538278609138748371.jpg', 'url': 'https://file.bienici.com/photo/citya-immobilier-1265-TAPP956782_cityabox-web.ics.infoclip.fr_icsbox_cit_CITYA_LIMOGES_tic_transaction_photo_filigrane-18187855_limoges_05112025_12-16538278609138748371.jpg'}, {'url_photo': 'http://cityabox-web.ics.infoclip.fr/icsbox/cit_CITYA_LIMOGES_tic/transaction/photo/filigrane-18187855_limoges_05112025_9-4424644135111686013.jpg', 'photo': 'citya-immobilier-1265-TAPP956782_cityabox-web.ics.infoclip.fr_icsbox_cit_CITYA_LIMOGES_tic_transaction_photo_filigrane-18187855_limoges_05112025_9-4424644135111686013.jpg', 'url': 'https://file.bienici.com/photo/citya-immobilier-1265-TAPP956782_cityabox-web.ics.infoclip.fr_icsbox_cit_CITYA_LIMOGES_tic_transaction_photo_filigrane-18187855_limoges_05112025_9-4424644135111686013.jpg'}, {'url_photo': 'http://cityabox-web.ics.infoclip.fr/icsbox/cit_CITYA_LIMOGES_tic/transaction/photo/filigrane-18187855_limoges_05112025_2-10504468079061819421.jpg', 'photo': 'citya-immobilier-1265-TAPP956782_cityabox-web.ics.infoclip.fr_icsbox_cit_CITYA_LIMOGES_tic_transaction_photo_filigrane-18187855_limoges_05112025_2-10504468079061819421.jpg', 'url': 'https://file.bienici.com/photo/citya-immobilier-1265-TAPP956782_cityabox-web.ics.infoclip.fr_icsbox_cit_CITYA_LIMOGES_tic_transaction_photo_filigrane-18187855_limoges_05112025_2-10504468079061819421.jpg'}, {'url_photo': 'http://cityabox-web.ics.infoclip.fr/icsbox/cit_CITYA_LIMOGES_tic/transaction/photo/filigrane-18187855_limoges_05112025_7-1042795532558371595.jpg', 'photo': 'citya-immobilier-1265-TAPP956782_cityabox-web.ics.infoclip.fr_icsbox_cit_CITYA_LIMOGES_tic_transaction_photo_filigrane-18187855_limoges_05112025_7-1042795532558371595.jpg', 'url': 'https://file.bienici.com/photo/citya-immobilier-1265-TAPP956782_cityabox-web.ics.infoclip.fr_icsbox_cit_CITYA_LIMOGES_tic_transaction_photo_filigrane-18187855_limoges_05112025_7-1042795532558371595.jpg'}, {'url_photo': 'http://cityabox-web.ics.infoclip.fr/icsbox/cit_CITYA_LIMOGES_tic/transaction/photo/filigrane-18187855_limoges_05112025_5-11318417902962254543.jpg', 'photo': 'citya-immobilier-1265-TAPP956782_cityabox-web.ics.infoclip.fr_icsbox_cit_CITYA_LIMOGES_tic_transaction_photo_filigrane-18187855_limoges_05112025_5-11318417902962254543.jpg', 'url': 'https://file.bienici.com/photo/citya-immobilier-1265-TAPP956782_cityabox-web.ics.infoclip.fr_icsbox_cit_CITYA_LIMOGES_tic_transaction_photo_filigrane-18187855_limoges_05112025_5-11318417902962254543.jpg'}, {'url_photo': 'http://cityabox-web.ics.infoclip.fr/icsbox/cit_CITYA_LIMOGES_tic/transaction/photo/90-filigrane-douche-5470801832829495245.jpg', 'photo': 'citya-immobilier-1265-TAPP956782_cityabox-web.ics.infoclip.fr_icsbox_cit_CITYA_LIMOGES_tic_transaction_photo_90-filigrane-douche-5470801832829495245.jpg', 'url': 'https://file.bienici.com/photo/citya-immobilier-1265-TAPP956782_cityabox-web.ics.infoclip.fr_icsbox_cit_CITYA_LIMOGES_tic_transaction_photo_90-filigrane-douche-5470801832829495245.jpg'}, {'url_photo': 'http://cityabox-web.ics.infoclip.fr/icsbox/cit_CITYA_LIMOGES_tic/transaction/photo/90-filigrane-wc-4577259722528161151.jpg', 'photo': 'citya-immobilier-1265-TAPP956782_cityabox-web.ics.infoclip.fr_icsbox_cit_CITYA_LIMOGES_tic_transaction_photo_90-filigrane-wc-4577259722528161151.jpg', 'url': 'https://file.bienici.com/photo/citya-immobilier-1265-TAPP956782_cityabox-web.ics.infoclip.fr_icsbox_cit_CITYA_LIMOGES_tic_transaction_photo_90-filigrane-wc-4577259722528161151.jpg'}, {'url_photo': 'http://cityabox-web.ics.infoclip.fr/icsbox/cit_CITYA_LIMOGES_tic/transaction/photo/90-filigrane-chambre_3-7076605875581468607.jpg', 'photo': 'citya-immobilier-1265-TAPP956782_cityabox-web.ics.infoclip.fr_icsbox_cit_CITYA_LIMOGES_tic_transaction_photo_90-filigrane-chambre_3-7076605875581468607.jpg', 'url': 'https://file.bienici.com/photo/citya-immobilier-1265-TAPP956782_cityabox-web.ics.infoclip.fr_icsbox_cit_CITYA_LIMOGES_tic_transaction_photo_90-filigrane-chambre_3-7076605875581468607.jpg'}, {'url_photo': 'http://cityabox-web.ics.infoclip.fr/icsbox/cit_CITYA_LIMOGES_tic/transaction/photo/filigrane-18187855_limoges_05112025_11-9586491192775147120.jpg', 'photo': 'citya-immobilier-1265-TAPP956782_cityabox-web.ics.infoclip.fr_icsbox_cit_CITYA_LIMOGES_tic_transaction_photo_filigrane-18187855_limoges_05112025_11-9586491192775147120.jpg', 'url': 'https://file.bienici.com/photo/citya-immobilier-1265-TAPP956782_cityabox-web.ics.infoclip.fr_icsbox_cit_CITYA_LIMOGES_tic_transaction_photo_filigrane-18187855_limoges_05112025_11-9586491192775147120.jpg'}]",True,True,True,Radiateur Gaz Collectif,True,87,True,True,1607.142857142857,87100,2167,,False,buy,vente,False,0,False,False,citya-durivaud,False,[],disk,50,"[1.2674485616254392, 45.830877599146376, 1.2687378185819538, 45.831775916956204]",45.83132675805129,1.2680931901036965,45.83132675805129,1.2680931901036965,[],101080,1,Limoges - Bénédictins - Montplaisir,Bénédictins - Montplaisir,87100,87085,101080,87085,87100,1,True,False,True,False,False,False,568f8aedf30b669900ad1745,['citya-immobilier-1265'],"['citya-immobilier-1265', '568f8aedf30b669900ad1745', '58f00452872c49009bfbcc22', 'unis', '620527791f6c8b00bb025158', 'contract-type-agency-efficiency-package', 'contract-type-agency-performance-package', 'contract-type-agency-package']",False,False,False,False,False,False,True,False,False,False,,,,,,,,,,,,
