id,creationDate,city,district,zipCode,distributionType,propertyType,price,surface,nbroom,nbbedroom,description
25CGDULD57TJ,2025-07-18T20:19:00Z,Fay-sur-Lignon,,43430,BUY,HOUSE,230000,145.0,9,6,"iad France - Penelope Berjon vous propose: Au Fay-sur-Lignon (43430), à deux minutes à pied du centre du village, découvrez cette maison individuelle moderne. Au calme, à deux pas des sentiers de ran..."
25CMYEFHHZF1,2025-03-11T11:28:00Z,Lapte,,43200,BUY,HOUSE,150000,198.0,10,8,"iad France - Benoît Chamblas vous propose: ? Maison à Lapte – 200 m² habitables | Jardin | Annexe | Terrain | Garage Découvrez cette grande maison de caractère d'environ 200 m², située à Lapte, dans ..."
25BCZTJ15Z6S,2025-08-29T09:27:00Z,Retournac,,43130,BUY,APARTMENT,55000,59.0,3,,"Réf 402539 - Dans une copropriété de 9 logements situés au 31 rue de l'hôtel de Ville à Retournac, appartement en duplex de type T3 de 61,45 m² au 2ème étage. Double vitrage, chauffage collectif Fiou..."
25HBUYY3SCBY,2025-10-09T14:09:00Z,Pradelles,,43420,BUY,HOUSE,74990,72.0,3,2,"Maison de village d'environ 72 m² habitables située au cœur de Pradelles (43). Elle comprend : Au sous-sol : Une grande cave/chaufferie. Au rez-de-chaussée : Une cuisine ouverte sur le séjour, une sa..."
247Z89M159A2,2024-10-06T08:44:00Z,Blavozy,,43700,BUY,PROJECT,228285,,4,3,"Nous vous proposons cette maison neuve, baptisée Eolia, un modèle d'habitation qui conjugue élégance et fonctionnalité sur une surface de 89 m². Conçue en forme de L, cette maison se distingue par so..."
253KZLV8BENP,2025-07-03T12:19:00Z,Le Puy-en-Velay,Guitard-Roche Arnaud,43000,BUY,APARTMENT,83000,73.0,3,,"Réf 401109 - Dans une résidence sécurisée et un environnement calme, située avenue du Docteur Durand sur les hauteurs du Puy, appartement de type T3 de 73.97 m² au rez de chaussée. Logement vendu ave..."
2524FB5G3MWB,2025-08-20T04:05:00Z,Costaros,,43490,BUY,HOUSE,30000,101.87,5,3,"D'une superficie habitable de 101 m², cette maison à rénover offre un joli cadre de vie. Etablie sur 2 niveaux, elle se compose au rez-de-chaussée d'un séjour, d'une cuisine, d'une salle d'eau et d'u..."
25S444FR8H5H,2025-11-12T08:17:00Z,Yssingeaux,Sud,43200,BUY,PROJECT,218600,,5,4,"Nous vous proposons cette maison neuve, baptisée Focus 91, une demeure qui réinvente l'art de vivre en famille. Avec ses 91 m² judicieusement répartis, cette maison est l'incarnation parfaite du célè..."
25QRCU5Z5RLB,2025-09-17T21:56:00Z,Ste Sigolene,,43600,BUY,APARTMENT,118000,70.0,4,3,Alti-Immo a le plaisir de vous proposer ce jolie T4 en duplex d'environ 70 m² au 3 ème étages dans une résidence securisée situé en plein centre de Sainte-Sigolène. Ce bien est composé d'une pièces d...
25YLTVWGW6S6,2025-10-29T01:10:00Z,Pradelles,,43420,BUY,HOUSE,359000,576.0,19,16,"Murs d'hôtel restaurant 2 ** sur Pradelles, Idéalement situé sur le chemin de robert Louis Stevenson, et au coeur d' une région très frequentée par les randonneurs, motards et amateurs d'activités de..."
25T3C1YC4SZN,2025-09-29T13:02:00Z,Pont-Salomon,,43330,BUY,HOUSE,349000,140.0,6,4,"Grosse opportunité à saisir pour cette maison individuelle de plain-pied, sans vis-à-vis, édifiée en 2000, idéalement située dans un hameau à la campagne, donc au calme, mais à quelques minutes de la..."
25M9K64BCGUP,2025-10-09T18:34:00Z,Vorey,,43800,BUY,HOUSE,120000,91.0,4,2,"iad France - Laetitia Jouve vous propose: En exclusivité, au cOEur de Vorey-sur-Arzon - Un IMMEUBLE DE RAPPORT CLÉS EN MAIN ! Situé en plein centre, à proximité immédiate des commerces, à 800 m de la..."
257HELMTUURY,2025-06-17T15:21:00Z,Chadrac,,43770,BUY,HOUSE,198500,101.0,6,4,"Idéalement placée sur le plateau de Chadrac. Maison de type F5 composée: Au RDC: Une belle entrée, une chambre avec placard de 11 m², une cuisine fermée équipée et aménagée de 9.6 m², un salon SAM de..."
25UTWWKAPFV1,2025-09-23T10:45:00Z,Pont-Salomon,,43330,BUY,HOUSE,220000,87.0,4,3,"iad France - Benoît Chamblas vous propose: ? Maison Moderne à Pont-Salomon – 87 m² avec Jardin & Garage Construite en 2017, cette maison individuelle vous offre confort et tranquillité dans un secteu..."
251GDWDJATA5,2025-08-11T19:22:00Z,Fontannes,,43100,BUY,HOUSE,139000,164.0,6,4,"Je vous présente cette belle maison familiale de 164 m² située à Fontannes (43100), à seulement 10 minutes de Brioude. Bâtie sur un terrain clos de 855 m² dans un cadre calme et verdoyant, elle offre..."
24FDLQ7MVLEE,2024-11-08T14:47:00Z,Yssingeaux,Sud,43200,BUY,APARTMENT,164000,51.5,2,,"La résidence SWEET LIFE à Yssingeaux vous propose des appartements spacieux, lumineux et fonctionnels dans un environnement où chaque détail a été pensé pour garantir un bien-être quotidien. Sweet Li..."
24N8CLQQMI8F,2024-11-08T14:47:00Z,Yssingeaux,Sud,43200,BUY,APARTMENT,239000,74.9,2,,"La résidence SWEET LIFE à Yssingeaux vous propose des appartements spacieux, lumineux et fonctionnels dans un environnement où chaque détail a été pensé pour garantir un bien-être quotidien. Sweet Li..."
25PH5IR1IQY1,2025-11-01T18:31:00Z,Saint Etienne Lardeyrol,,43260,BUY,HOUSE,234900,140.0,5,4,"À vendre sur la commune de Saint-Étienne-Lardeyrol, située à seulement quelques minutes du Puy-en-Velay, ancien corps de ferme en pierres de 140 m² habitables, entièrement rénové . Implantée sur un t..."
25X2H54FM57D,2025-11-28T16:49:00Z,Chadrac,,43770,BUY,HOUSE,352000,160.0,7,4,"Belle maison de 160 m² située sur le secteur très recherché de Chadrac, à proximité immédiate des commerces et commodités. Édifiée sur un terrain clos et arboré de plus de 2000 m², cette propriété sa..."
25KPYAVTEAKY,2025-11-17T09:52:00Z,Saint Just Malmont,,43240,BUY,APARTMENT,159000,88.0,3,2,"ST JUST MALMONT Route de Jonzieux Dans un ensemble immobilier en cours de réhabilitation, appartement de type F3 de 88m² offrant une cuisine ouverte sur un séjour cathédrale, 2 chambres, une salle d'..."
25E3RM7DLZ2X,2025-04-10T15:18:00Z,Vernassal,,43270,BUY,HOUSE,329000,294.0,12,8,"Venez découvrir idéalement situé dans un petit village proche du puy en Velay avec écoles ,épicerie et gare desservant le puy en Velay , pour les activités Base de loisir, karting, bowling à dix minu..."
25AKFJDIQDEG,2025-09-26T15:23:00Z,Cayres,,43510,BUY,HOUSE,300000,200.0,7,5,"Maison Forte du 10e Siècle – Cayres (10 min du Puy-en-Velay) Un bijou historique niché dans un écrin de verdure Offrez-vous une part d'histoire avec cette maison forte médiévale, édifiée au 10 siècle..."
25ZZDY4CELSY,2025-11-12T16:15:00Z,Saint Germain Laprade,,43700,BUY,HOUSE,548000,234.0,8,6,Magnifique maison de 2022 de plain-pied de 234 m² habitable sur une parcelle de 897 m² composée de : 1 très grande pièce a vivre de 65 m² avec cuisine ouverte entièrement équipée 4 chambres 1 suite p...
25LQIWUGHELT,2025-06-09T09:43:00Z,Dunières,,43220,BUY,HOUSE,139000,49.0,2,,"Dunières, Hyper centre. Maison de ville 49 m2 habitable avec un terrain constructible de 522 m2 et 5 places de parking privées. Maison complètement rénovée avec toiture et couverture neuve. Parcelle ..."
25MLPYB4G4W6,2025-06-19T09:15:00Z,Roche-en-Régnier,,43810,BUY,PROJECT,149600,,4,3,"Nous vous proposons cette maison neuve, baptisée Focus 75, une perle rare dans notre gamme MAISON ET JARDIN qui incarne le meilleur rapport qualité-prix. Conçue pour répondre aux attentes des plus ex..."
24KSYTLXS9FW,2024-07-19T12:28:00Z,Costaros,,43490,BUY,PROJECT,168200,,4,3,"Nous vous proposons cette maison neuve, baptisée Focus 75, une perle rare dans notre gamme MAISON ET JARDIN qui incarne le meilleur rapport qualité-prix. Conçue pour répondre aux attentes des plus ex..."
255AUYV5IAJS,2025-10-19T08:14:00Z,Borne,,43350,BUY,PROJECT,240100,,5,4,"Nous vous proposons cette maison neuve, baptisée Eolia, un modèle d'habitation qui allie élégance et fonctionnalité dans un design en L distinctif. Avec une surface habitable de 102 m², cette maison ..."
25BBHQFXY2J2,2025-10-15T08:13:00Z,Rosières,,43800,BUY,PROJECT,230100,,5,4,"Nous vous proposons cette maison neuve, baptisée Eolia, un modèle d'habitation qui allie élégance et fonctionnalité dans un design en L distinctif. Avec une surface habitable de 102 m², cette maison ..."
25FD52R2IJUF,2025-08-09T19:07:00Z,Sainte-Sigolène,Les Ecarts,43600,BUY,HOUSE,205000,93.0,5,3,iad France - Benoît Chamblas vous propose: Maison de Ville MITOYENNE avec Jardin à Sainte-Sigolène . ? Au REZ-DE-CHAUSSÉE : une grande pièce de vie avec cuisine tout équipée et salon. Accompagner d'u...
251D8CTDQ85P,2025-04-04T10:53:00Z,Sainte-Sigolène,Centre Ouest,43600,BUY,APARTMENT,99000,100.0,5,3,"Votre conseillère 43ème Avenue Immobilier, Solange ROMERA vous propose en exclusivité: Sainte-Sigolène..Au RDC d'une petite copropriété en cours de création, appartement de 100m². Actuellement compos..."
25ISLPBSYGQJ,2025-11-04T08:17:00Z,Bellevue-la-Montagne,,43350,BUY,PROJECT,141200,,4,3,"Nous vous proposons cette maison neuve, baptisée Focus 75, une perle rare dans notre gamme MAISON ET JARDIN qui incarne le meilleur rapport qualité-prix. Conçue pour répondre aux attentes des plus ex..."
255Q7LFSB5VN,2025-10-03T13:33:00Z,Siaugues Sainte Marie,,43300,BUY,HOUSE,66000,90.0,4,2,"Cette maison de village est située dans le centre de Siaugues st Romain. Le rez de chaussée se compose du salon, de la cuisine ouverte sur la véranda et la grande terrasse et d'un WC. Deux chambres e..."
25HVAN97VNA6,2025-02-04T14:30:00Z,Chanteuges,,43300,BUY,HOUSE,134000,115.0,4,3,Située entre Langeac et Chanteuges cette maison a été construite en 2010 sur une parcelle de 1017 m². La terrasse donne accès à la grande pièce à vivre avec son poêle à granulés et à la buanderie. Le...
25VAWFQBXJ41,2025-08-04T03:19:00Z,Saint Front,,43550,BUY,HOUSE,65000,137.0,2,1,"Située dans un hameau à 1100 m d'altitude sur la commune de St Front 43550, cette ancienne chaumière en pierre de pays avec son toit très pentu est caractéristique des hauts plateaux du Mézenc. D'une..."
25BEX82P613Y,2025-08-27T18:41:00Z,Monistrol sur Loire,Zone Urbaine,43120,BUY,HOUSE,198000,87.0,4,3,MAISON MONISTROL SUR LOIRE ! 87 M² HABITABLES ! 539 M² DE TERRAIN ! CENTRE MONISTROL SUR LOIRE .. C'est en plein centre-ville de Monistrol sur Loire à proximité immédiate des commerces que vous pourr...
25WSCQMS7PBI,2025-05-27T23:54:00Z,Le Monastier-sur-Gazeille,,43150,BUY,HOUSE,47000,65.0,6,3,"Maison de bourg, centre ville, sur 4 niveaux, composée d'une salle de séjour avec espace cuisine, au 1er, 1 chambre avec espace bureau, salle d'eau , WC, au second, 2 chambres, puis un grenier partie..."
25ZVYZP1VIAS,2025-03-31T09:43:00Z,Blavozy,,43700,BUY,PROJECT,205470,,4,3,"Nous vous proposons cette maison neuve, baptisée Focus 80, un modèle phare de notre gamme qui se distingue par son excellent rapport qualité/prix. Conçue pour répondre aux attentes des familles moder..."
25PZLILMLJ2W,2025-06-19T09:15:00Z,Saint-Vincent,,43800,BUY,PROJECT,164900,,4,3,"Nous vous proposons cette maison neuve, baptisée Focus 80, un modèle phare de notre gamme qui se distingue par son excellent rapport qualité/prix. Conçue pour répondre aux attentes des familles moder..."
25LU3JWGSG41,2025-10-16T09:29:00Z,Monistrol-sur-Loire,Zone Periurbaine,43120,BUY,HOUSE,360000,154.0,6,4,"Sur le territoire de Monistrol-Sur-Loire à côté de Firminy, faîtes l'acquisition d'un bien immobilier avec une villa de type F6 disposant d'une vaste pièce de vie sobre et élégante. Elle se constitue..."
254D7IVKHKR3,2025-10-09T14:09:00Z,St Haon,,43340,BUY,HOUSE,72000,73.0,3,2,"Dans les Gorges de l'Allier, proche de la rivière, cette maison de village de 73 m² habitables est idéale pour les vacances. Elle est composée en rez de chaussée d'une entrée, d'un garage et d'un coi..."
25J3UJ6A2I5E,2025-10-08T22:57:00Z,Saint-Julien-Molhesabate,,43220,BUY,HOUSE,99000,115.0,5,4,St Julien Molhesabate 43220 Maison de ville exposée sud 115 m² 4 chambres prix de vente 99 000 euros comprenant en RDC cuisine/séjour d'environ 26 m² aménagée et complétée d'un fourneau à bois donnan...
251Z1NM4DBA6,2025-05-02T09:58:00Z,Yssingeaux,Sud,43200,BUY,PROJECT,221577,,4,3,"Nous vous proposons cette maison neuve, baptisée Focus 80, un modèle phare de notre gamme qui se distingue par son excellent rapport qualité/prix. Conçue pour répondre aux attentes des familles moder..."
25DIDVC5BSQ4,2025-07-16T19:34:00Z,Tence,,43190,BUY,APARTMENT,35000,34.56,1,,"Dans un immeuble calme et entretenu, cet appartement T1 de 34,56 m² se trouve au 1er étage, côté jardin. Il est actuellement loué par un locataire sérieux en bail nu depuis 2018, avec un loyer réguli..."
252E4R4CHH64,2025-11-05T09:02:00Z,Langeac,,43300,BUY,HOUSE,129500,90.0,4,2,"Cette maison avec une agréable cour fermée et ensoleillée est située dans un secteur calme à proximité du centre de Langeac. Elle se compose au rez de chaussée, d'un séjour traversant, d'une cuisine ..."
257NEG59H3II,2025-11-05T22:59:00Z,Ste Sigolene,,43600,BUY,APARTMENT,90000,91.0,5,3,"Alti'immo a le plaisir de vous présenter cet appartement au 1er étage de plus de 90m² situé à Sainte-Sigolène, proche des commodités. Il dispose de 3 chambres, d'une cuisine semi-ouverte, d'un salon ..."
25M8XUDJRCZB,2025-04-10T15:18:00Z,Siaugues Sainte Marie,,43300,BUY,HOUSE,199500,350.0,20,12,"En exclusivité, venez découvrir sans tarder cette jolie maison située dans un village avec commerces (boulangerie/boucherie, épicerie, médecin, etc.) A 30 min du PUY EN VELAY et 15 min de LANGEAC. La..."
257EFGNZSQ5T,2025-09-27T03:20:00Z,Saint Paulien,,43350,BUY,HOUSE,247800,175.0,7,3,"SUPERBE OPPORTUNITE A proximité immédiate du centre de SAINT-PAULIEN dans un quartier paisible, venez découvrir cette belle villa de 2022. Le gros œuvre est neuf, la maison est vendue hors d'air hors..."
253A95XCNSPA,2025-10-22T19:50:00Z,Solignac-sur-Loire,,43370,BUY,HOUSE,320000,210.0,6,4,"À vendre – Spacieuse maison de 210 m². Elle offre de nombreuses possibilités sur un terrain de 2 038 m². Au rez-de-chaussée : hall d'entrée, deux chambres, salle d'eau, WC, buanderie, remise et grand..."
25PQ41ALAEDQ,2025-07-03T11:50:00Z,Saint-Paulien,,43350,BUY,HOUSE,158800,107.0,3,2,"SAINT-PAULIEN, Villa composée d'une partie habitable F3, à réhabiliter, de 107 m² habitables: hall d'entrée, cuisine, séjour avec cheminée, 2 chambres dont une avec balcon, salle de bains, WC + sous-..."
2592PWQQU2RZ,2025-09-22T13:32:00Z,Le Puy en Velay,Guitard-Roche Arnaud,43000,BUY,HOUSE,409000,160.0,6,,"Rare à la vente ! Quartier des Chalmettes, à quelques minutes du centre du Puy, ancienne maison de vigne entièrement rénovée et en parfait état. Deux agrandissements : un en 1998, l'autre en 2008. Su..."
25DLEX73H8HQ,2025-10-16T09:28:00Z,Saint-Bonnet-le-Froid,,43290,BUY,HOUSE,260000,150.0,6,4,"En exclusivité - Dans le village gourmand et gastronomique de Saint-Bonnet-le-Froid. Une splendide maison qui ne vous laissera pas indifférents. Avec ses 150 m2 , 4 chambres, 2 SDB, 2 WC, ses 800 m2 ..."
25TDWR52QRUP,2025-07-25T14:37:00Z,Vals Pres le Puy,,43750,BUY,APARTMENT,109000,84.0,4,3,"Situé dans une résidence calme et bien entretenue, cet appartement, très lumineux, offre un beau potentiel. Emplacement idéal : proche commerces, écoles et transports. D'une surface de 84 m2, il se c..."
25RT1LKVYWJ8,2025-09-22T07:52:00Z,Saint-Jean-Lachalm,,43510,BUY,HOUSE,154000,99.0,6,4,"Idéalement située à quelques minutes de Bains et à proximité du Puy-en-Velay, (lieu dit 'Conil') cette propriété représente une occasion rare, à la fois pour un projet de vie ou pour une activité tou..."
25KQP99Y2FHA,2025-08-27T18:41:00Z,Grazac,Nord,43200,BUY,HOUSE,136000,,5,2,Très jolie maison de 90 m² sur une parcelle de 660 m² ! PONT DE L'ENCEINTE .. C'est à 8 minutes seulement d'Yssingeaux et environ 6 minutes du centre de GRAZAC que vous pourrez découvrir cette maison...
25JWCKG38JHU,2025-09-05T20:23:00Z,Vernassal,,43270,BUY,HOUSE,168900,153.0,6,4,"situé dans le village de darsac, commune de vernassal belle et grande maison d environ 150 m2 composé au rez de chaussé d une grande cuisine donnant sur le petit salon. coté sud la salle à manger et ..."
25CD74VQVQKZ,2025-07-01T19:36:00Z,Saint-Etienne-du-Vigan,,43420,BUY,HOUSE,169000,100.0,6,3,"Sur la commune de St Etienne du Vigan (43420) , découvrez cette maison mitoyenne pleine de charme, récemment rénovée avec soin. D'une superficie de 100 m² sur deux niveaux, elle offre un cadre de vie..."
25Y6GPYFWKR2,2025-04-08T08:39:00Z,Coubon,,43700,BUY,PROJECT,200600,,5,4,"Nous vous proposons cette maison neuve, baptisée Focus 91, une demeure qui réinvente l'art de vivre en famille. Avec ses 91 m² judicieusement répartis, cette maison est l'incarnation parfaite du célè..."
24MRS1D9V7N4,2024-08-23T06:09:00Z,Retournac,,43130,BUY,HOUSE,49000,76.0,4,3,"MAISON A RENOVER ENTIEREMENT - AU COEUR DE RETOURNAC - 76 m² HAB . Vous cherchez une maison à rénover, n'hésitez plus à venir découvrir cette maison mitoyenne d'un côté de 76 m² habitable en plein ce..."
25QU5NL5V5A1,2025-11-10T12:31:00Z,Saint-Maurice-de-Lignon,,43200,BUY,HOUSE,165000,615.0,1,,"Ancien corps de ferme à réhabiliter, idéal projet mixte : particulier, activité, tertiaire. Le bien est composé - au rez de chaussée d'une surface de 325m2, avec jardin idéal pour une partie habitati..."
25UGPCTHXE36,2025-09-19T09:02:00Z,Costaros,,43490,BUY,PROJECT,157511,,4,3,"Nous vous proposons cette maison neuve, baptisée Focus 75, une perle rare dans notre gamme MAISON ET JARDIN qui incarne le meilleur rapport qualité-prix. Conçue pour répondre aux attentes des plus ex..."
2522XZXUNCK2,2025-11-27T07:34:00Z,Sainte Sigolene,,43600,BUY,HOUSE,199000,146.0,6,3,Fiche Id-SLG131027 : Sur 500 m² de terrain clos: Grande maison de ville et composée - 1) En rez-de-chaussée. : Hall d'entée - Studio indépendant 40 m² (rénovation à terminer) - atelier 90 m² - 2 gara...
25LHF7IYD1I7,2025-11-25T15:52:00Z,Saint-Étienne-du-Vigan,,43420,BUY,HOUSE,148937,65.0,4,3,"Thierry REDON vous propose ce bien : À vendre : Maison de charme à Saint-Étienne-du-Vigan (43420) - 148 936,17 euros Découvrez cette maison accueillante située en pleine campagne à Saint-Étienne-du-V..."
25WXFZLIN272,2025-02-22T11:01:00Z,Mazeyrat d Allier,,43300,BUY,HOUSE,39000,45.0,2,1,"Cette maison est située dans un village tranquille à proximité de Langeac. Elle se compose de cuisine, salon, chambre, salle d'eau et WC sur le même niveau. Grand sous sol à usage de garage, atelier ..."
251C4E1ZQQVR,2025-09-26T15:23:00Z,Chadrac,,43770,BUY,HOUSE,279000,154.0,7,5,"Maison de vigne de caractère de 154 m² habitables sur terrain de 2 635 m² . Située à Chadrac, ville très recherchée, offrant un environnement calme et une belle qualité de vie, cette charmante maison..."
253ALE4V1IFI,2025-09-18T18:19:00Z,Chanaleilles,,43170,BUY,HOUSE,252000,120.0,7,2,Immobilier.notaires® et l'office notarial SELAS Dominique DELHAL et Aurélie BONHOMME-ROMIEU vous proposent : Maison / villa à vendre - CHANALEILLES (43170) - - - - - - - - - - - A VENDRE MOULIN DU VI...
253JXKUE4YY6,2025-05-10T08:19:00Z,Costaros,,43490,BUY,PROJECT,179594,,5,4,"Nous vous proposons cette maison neuve, baptisée Focus 91, une demeure qui réinvente l'art de vivre en famille. Avec ses 91 m² judicieusement répartis, cette maison est l'incarnation parfaite du célè..."
25I3BWMBHGF7,2025-05-10T08:19:00Z,Costaros,,43490,BUY,PROJECT,174680,,5,4,"Nous vous proposons cette maison neuve, baptisée Focus 91, une demeure qui réinvente l'art de vivre en famille. Avec ses 91 m² judicieusement répartis, cette maison est l'incarnation parfaite du célè..."
25FSA268JN9E,2025-03-08T08:47:00Z,Blavozy,,43700,BUY,PROJECT,250065,,5,4,"Nous vous proposons cette maison neuve, baptisée Cristalia, un modèle de résidence qui allie élégance, confort et respect de l'environnement. Conçue pour répondre aux attentes des plus exigeants, Cri..."
259CXMMIY4NA,2025-10-18T08:16:00Z,Borne,,43350,BUY,PROJECT,201600,,5,4,"Nous vous proposons cette maison neuve, baptisée Focus 91, une demeure qui réinvente l'art de vivre en famille. Avec ses 91 m² judicieusement répartis, cette maison est l'incarnation parfaite du célè..."
25TQTR7GIQB1,2025-10-16T09:28:00Z,Montregard,,43290,BUY,HOUSE,350000,235.0,4,3,"En exclusivité - Haute-Loire - Dans un petit hameau de la commune de Montregard (43) Je vous propose une charmante maison de plain-pied de 120 m2, avec garage et chaufferie 35m2, construite en 2002. ..."
25YSFLN5XDVH,2025-08-25T19:45:00Z,Allegre,,43270,BUY,HOUSE,115000,95.0,4,3,"Venez découvrir cette belle maison en bordure du village d allègre, en direction de la vallée direction paulhaguet et brioude. l exposition est ideal ,sud vue dominante, en parti rénové, menuiserie p..."
25I1ULGL5YQN,2025-03-28T22:27:00Z,Brioude,Sud,43100,BUY,HOUSE,255000,170.0,10,4,"Située à Brioude (43100), cette maison de 170 m² s'épanouit dans un cadre paisible, idéalement proche des écoles, lycées, commerces et du dynamique centre-ville, offrant ainsi un équilibre entre tran..."
25MAZS3SJNGY,2025-10-09T14:10:00Z,Le Puy en Velay,,43000,BUY,APARTMENT,149000,104.0,3,2,Découvrez cet agréable appartement F3 au premier étage d'un immeuble proche du centre ville et de la grande place Michelet du Puy-en-Velay. Vous serez séduit par sa luminosité et de son quartier calm...
25DX3KUUU4MU,2025-07-05T11:50:00Z,Yssingeaux,Nord,43200,BUY,HOUSE,379000,140.0,6,5,"JB TRANSACTIONS Yssingeaux vous propose cette belle propriété datant de 2002, offrant environ 140 m² habitables sur un terrain plat constructible de 4 585 m². Son gros œuvre remarquable vous séduira ..."
25VHAU1BSENH,2025-09-25T16:43:00Z,Bas-en-Basset,,43210,BUY,HOUSE,268000,143.0,8,5,"BAS EN BASSET ! 143 M² HABITABLES ! PARCELLE DE 1990 M² ! Bas en Basset .. C'est dans un hameau paisible à environ 5 minutes de MONISTROL SUR LOIRE et 8 minutes de BAS EN BASSET, que vous pourrez déc..."
25AVA4INLC4Q,2025-08-20T16:36:00Z,Le Brignon,,43370,BUY,HOUSE,275000,194.0,5,3,"Ancien corps de ferme entièrement rénovée de 190 m² en 2006. Amoureux de la nature avec un environnement très paisible, elle est implantée sur une parcelle de 5900m2 de terrain. Elle est accessible p..."
25D5DDK77HB8,2025-07-23T11:43:00Z,Craponne-sur-Arzon,,43500,BUY,HOUSE,100000,300.0,15,1,"L'agence GOLFE DE SAINT PIERRE IMMOBILIER vous propose cette maison de village pleine de charme, idéalement située dans le centre historique de Craponne-sur-Arzon. Avec ses 300 m² habitables répartis..."
25PL9ZK9D6U7,2025-04-25T21:38:00Z,Beaux,,43200,BUY,HOUSE,219500,193.0,8,1,"Exclusivité JB TRANSACTIONS YSSINGEAUX – Ensemble immobilier à fort potentiel sur plus de 2600 m² de terrain à BEAUX Parfait pour un artisan, un investisseur ou tout porteur de projet ambitieux, ce b..."
25M8JNXWAFD4,2025-11-17T11:13:00Z,Saint Just Malmont,,43240,BUY,APARTMENT,54000,90.0,3,2,"ST JUST MALMONT ROUTE DE JONZIEUX Dans un ensemble immobilier en cours de rénovation, plateau de 90m² (59m² en Loi Carrez). Il est vendu viabilisé (avec compteur Linky, alimentation en eau et évacuat..."
2512FRPNVV61,2025-11-05T10:12:00Z,Grazac,,43200,BUY,HOUSE,198000,184.0,11,6,GRAZAC ! CORPS DE FERME + MAISON DE 30 M² ENVIRON ! 184 M² ! 18 970 M² DE TERRAIN ! Grazac .. C'est à 2 minutes en voiture du centre-ville de Grazac et 13 minutes d'Yssingeaux dans un petit hameau qu...
258YBRISTYWM,2025-05-28T17:52:00Z,Monistrol-sur-Loire,Zone Periurbaine,43120,BUY,HOUSE,480000,170.0,7,3,"Votre conseillère 43ème Avenue Immobilier, Solange ROMERA , vous propose en exclusivité: Maison en pierre rénovée avec piscine – Charme, confort et cadre idyllique! À seulement 30 minutes de Saint-Ét..."
25GY56EIY23C,2025-06-19T13:18:00Z,Saint-Maurice-de-Lignon,,43200,BUY,HOUSE,160000,96.0,4,3,"Située à Saint-Maurice-de-Lignon (43200), cette charmante maison bénéficie d'un environnement calme en campagne, parfait pour les amoureux de la nature. Proche d'une école, elle offre un cadre famili..."
25BBWBMIAPWG,2025-08-28T16:57:00Z,Saint-Hostien,,43260,BUY,HOUSE,140000,225.0,11,7,"En cours de rénovation, cette vaste maison de 234 m² environ sur 2 étages offre un fort potentiel d'aménagement et pourra révéler tout son charme après travaux. Elle se compose au rez-de-chaussée d'u..."
23PGWVNNHXGI,2023-08-31T04:31:00Z,Venteuges,,43170,BUY,HOUSE,72000,120.0,4,1,"Sur le plateau de la Margeride, à 5 km de Saugues, ancien corps de ferme en partie rénové composé de 2 bâtiments. La 1ère partie dispose au rdc d'une cuisine séparée et équipée, d'un séjour avec chem..."
25VW9EXDUZNZ,2025-09-26T15:23:00Z,Saint Vincent,,43800,BUY,HOUSE,185000,140.0,5,3,"Cette magnifique maison en pierre, imprégnée d'histoire et de caractère, est à la recherche de nouveaux propriétaires. Nichée dans un petit village proche des gorges de la Loire, elle offre un mélang..."
25WFCVU98Z2B,2025-10-27T16:23:00Z,Saint Hostien,,43260,BUY,HOUSE,199900,200.0,7,4,"Située dans un hameau calme et verdoyant, à seulement 15 minutes du Puy-en-Velay, cette belle bâtisse de caractère d'environ 200m2 en pierre offre tout le confort moderne tout en conservant son charm..."
24RYM3HK5WGH,2024-10-09T11:50:00Z,Blanzac,,43350,BUY,HOUSE,139900,72.0,4,3,"BLANZAC, à 10 min du PUY EN VELAY, du cachet et du calme pour cette maison de village en pierre composée d'une habitation F4 rénovée à la fin des années 90 cuisine, arrière cuisine, séjour, 3 chambre..."
25KZUUU4MQ2R,2025-10-09T14:09:00Z,Saugues,,43170,BUY,HOUSE,279000,215.0,9,5,"Au cœur d'un village étape sur le chemin de Saint-Jacques-de-Compostelle, superbe propriété en pierres construite en 1860. Sa surface habitable d'environ 215 m² répartie sur 3 niveaux offre le charme..."
