id,creationDate,city,district,zipCode,distributionType,propertyType,price,surface,nbroom,nbbedroom,description
24EYPCLRWUBM,2024-02-06T22:05:00Z,Monistrol-sur-Loire,Zone Periurbaine,43120,BUY,HOUSE,300000,90.0,4,3,"Monistrol/Loire, secteur recherché, Villa de 2020 offrant 90m² hab + 3 garages double. Elle se compose au 1er étage d'une cuisine meublée et équipée ouverte sur le séjour et donnant accès sur une ter..."
25S831222AJM,2025-07-18T20:14:00Z,Sainte-Florine,,43250,BUY,HOUSE,162500,160.0,10,8,"A VENDRE ** GRANDE MAISON DE CARACTÈRE A RÉNOVER ** 10 PIÈCES 160M² ** TERRAIN +1000 m² Amoureux de beaux volumes et de projets à fort potentiel, cette maison est faite pour vous ! Située dans la zon..."
248E386LYD5G,2024-09-19T16:13:00Z,Siaugues Sainte Marie,,43300,BUY,HOUSE,45000,250.0,12,8,"Ensemble immobilier composé de deux maisons mitoyennes en plein centre de Siaugues. La première se compose de cuisine, salle à manger et salle d'eau au rez de chaussée. Quatre chambres au 1er étage e..."
257JM3RR1QUC,2025-10-17T21:57:00Z,Allègre,,43270,BUY,HOUSE,47200,100.0,4,3,"ALLÈGRE, proche commerces Maison de bourg d'environ 100 m² habitables avec: Au RDC cuisine, chambre, salle d'eau, WC Au 1er étage 3 chambres, WC Dépendances de grange Possibilités d'habitation princi..."
25131FGDN2JB,2025-07-15T18:24:00Z,Vorey,,43800,BUY,HOUSE,38000,60.0,3,1,"Stéphane PIOCHEL (O6 26 2O 12 8O) vous propose : VOREY centre, Maison à rafraichir, env. 60 m² hab comprenant Cuisine ouverte Séjour, à l'étage : 2 Chambres, Salle d'Eau avecWC. - SL_1764615957"
25R2T8P4GZYD,2025-11-04T14:19:00Z,Allègre,,43270,BUY,HOUSE,59900,117.0,5,3,"Jolie Maison en pierre jointée de 117 m2, avec terrain clos dans le bourg d'Allègre. Comprenant, une grande salle à manger de 25m2, d'un salon de 12 m2 et d'une cuisine fermée de 17 m2 au rdc. A l'ét..."
259MCGQXMZ94,2025-09-15T14:32:00Z,Langeac,,43300,BUY,HOUSE,45000,100.0,2,,"A proximité du centre de Langeac, belle dépendance pouvant être aménagée en habitation. Elle se compose de 2 niveaux d'environ 50 m², avec dalle béton au rez de chaussée. Charpente et couverture réce..."
25YSDSA4348D,2025-05-21T09:32:00Z,Chaniat,,43100,BUY,HOUSE,98000,104.0,5,3,"Au coeur du Village de Chaniat sur les hauteurs de Brioude, ancien corps de ferme à rénover . Le rdc est composé d'une cuisine et séjour, au 1er étage, une chambres et salle de bain, 2 chambres suppl..."
25ET69R2LYZ4,2025-11-01T18:01:00Z,Saint Etienne Lardeyrol,,43260,BUY,HOUSE,54500,50.0,3,2,"Maison de village en pierre d'une surface estimée à 50 m² habitable sur 3 niveaux à rénover entièrement avec jardinet. Assainissement collectif, eau, électricité. Pour visiter Sandrine LAURENT"
25K5N8753Z79,2025-04-18T14:33:00Z,Pinols,,43300,BUY,HOUSE,39500,400.0,10,6,"Cet ancien hôtel construit en 1830 avait été transformé en appartements. Le rez de chaussée et le 1er étage se composent de salons, cuisines, chambres et salles d'eau. Au sous sols on trouve plusieur..."
25PV8QGZVU5U,2025-05-31T08:01:00Z,Paulhaguet,,43230,BUY,HOUSE,45000,60.0,4,2,"Cet ancien commerce situé au centre de Paulhaguet se compose d'une boutique avec cuisine, d'un sanitaire et du laboratoire avec four de boulanger au rez de chaussée. D'une pièce et d'un comble au 1er..."
258YYE5N4X3U,2025-04-29T13:17:00Z,Chaspuzac,,43320,BUY,HOUSE,75000,60.0,3,1,"Maison de 60 m2 environ, proche du Puy en Velay, de la zone industrielle de Loudes et de Chaspuzac. En partie rénovée, des modifications sont à prévoir afin de gagner en surface habitable. L'assainis..."
25MFRY7SYAKP,2025-10-22T17:56:00Z,Sainte-Sigolene,Les Ecarts,43600,BUY,HOUSE,77000,140.0,10,3,"À vendre – Maison 140 m² à rénover entièrement – Sainte-Sigolène (43600) Située dans un petit quartier résidentiel calme, à seulement 5 minutes du centre de Sainte-Sigolène, cette maison d'environ 14..."
25RB3HL1M3N8,2025-08-18T23:57:00Z,La Chaise-Dieu,,43160,BUY,APARTMENT,22900,134.0,2,1,En exlusivité pour IMMO43 Christian(EI) vous propose deux appartements en centre ville de La Chaise Dieu Il s'agit du premier et second étage d'un immeuble ancien qui est à rénover entièrement. Une p...
25G93JKMSTQR,2025-10-22T17:56:00Z,Sainte-Sigolene,Les Ecarts,43600,BUY,HOUSE,60000,75.0,5,2,"À vendre – Maison 75 m² à rénover entièrement – Sainte-Sigolène (43600) Située dans un petit quartier résidentiel calme, à seulement 5 minutes du centre de Sainte-Sigolène, cette maison d'environ 75 ..."
25EIIEY36RAS,2025-10-06T00:07:00Z,Saint-Just-Malmont,,43240,BUY,APARTMENT,63000,36.4,2,1,"Appartement T2 proche centre village. Venez découvrir cet appartement T2 d'une surface de 36,40 m² loi Carrez (46 m² au sol). Il se compose d'une agréable pièce de vie, d'une chambre, d'une salle d'e..."
246CP4JMI5E8,2024-09-09T15:18:00Z,Saint Jean de Nay,,43320,BUY,HOUSE,385000,300.0,8,1,"Aux Portes du Puy en Velay En Exclusivité BEAU CORPS DE FERME offrant 300 m² de Surface sur 3 Niveaux vendu Hors d'Eau , Hors d'Air ( Terrassement avec Assainissement - Maçonnerie - Menuiserie - Rése..."
25XENL82ELJP,2025-06-06T08:25:00Z,Retournac,,43130,BUY,HOUSE,59000,85.0,1,1,"Stéphane PIOCHEL : Tél : O6 26 2O 12 8O vous propose : CENTRE de RETOURNAC, Maison à finir d'aménager intérieurement, Gros oeuvre (toiture, dalles, façades) et Fenêtres neufs. Beau potentiel. - SL_17..."
24I28USAE8TM,2023-12-18T22:05:00Z,Saint-Julien-Chapteuil,,43260,BUY,PROJECT,230000,,5,3,ST JULIEN CHAPTEUIL Cobati entreprise vous propose cette maison de plain pied de 90 m² avec possibilité garage attenant conforme à la RE 2020. La villa FLIRT vous séduira par sa cuisine ouverte et se...
25APAIHG4LUD,2025-05-16T12:04:00Z,Sembadel,,43160,BUY,HOUSE,27000,80.0,3,1,Battisse en pierre d'environ 180 M2 sur 2 niveau Honoraires à la charge du vendeur. Non soumis au DPE. Les informations sur les risques auxquels ce bien est exposé sont disponibles sur le site Géoris...
25883AWFXBFT,2025-09-30T10:03:00Z,Langeac,,43300,BUY,HOUSE,66000,150.0,6,3,Belle opportunité d'achat pour cette maison située sur une rue commerçante de Langeac. Elle se compose d'un local commercial au rez de chaussée et d'un appartement F4 au dessus. Au 1er étage se trouv...
25GV69JP6XY6,2025-04-08T11:51:00Z,Saint-Paulien,,43350,BUY,HOUSE,139000,80.0,3,1,"Secteur SAINT-PAULIEN dans petit hameau, à 15 minutes du PUY-EN-VELAY, VENEZ DÉCOUVRIR cette Villa des années 80 avec vue dégagée et orientation SUD, à rénover (isolation, fenêtres, chauffage, assain..."
25N4MPGGLGIT,2025-03-13T14:02:00Z,Langeac,,43300,BUY,HOUSE,129500,111.0,4,,"Ancienne grange en cours de transformation en maison d'habitation situé dans un hameau à la sortie de Langeac. Nombreux travaux déjà effectués: toiture neuve isolée, tout ouvrant double vitrage bois,..."
241HZCJH3J4A,2024-04-12T11:55:00Z,Beauzac,,43590,BUY,HOUSE,259000,100.0,5,4,"Beauzac, à 5 min du centre bourg, environnement calme et verdoyant, villa neuve ( RE 2020) de 100m² hab composée au rdc : cuisine ouverte sur salle à manger/ salon et donnant accès sur le terrain, un..."
25JKDY9Y7J2L,2025-08-18T23:57:00Z,La Chaise-Dieu,,43160,BUY,APARTMENT,9900,51.0,1,,"IMMO43 vous propose un immeuble en centre ville de La Chaise Dieu Cette maison est ancienne et à rénover entièrement. Actuellement en copropriété, cette vente concerne le rez de chaussée et une parti..."
245TRA9H2JVW,2023-05-17T04:33:00Z,Chavaniac Lafayette,,43230,BUY,HOUSE,39500,140.0,5,3,"Dans le village historique de Chavaniac Lafayette,ensemble immobilier composé de 2 maisons à finir de rénover et d'un jardin de curé attenant. Possibilité de réaliser 2 logements ou une grande habita..."
25SANFGMDNRM,2025-03-25T12:49:00Z,Saint-Paulien,,43350,BUY,HOUSE,247800,180.0,5,4,"SAINT-PAULIEN centre, proche commodités, à 20 mn du PUY-EN-VELAY. VENEZ DÉCOUVRIR cette Belle villa de 2022 avec gros œuvre neuf, hors d'air hors d'eau, composée d'une partie habitable de 180 m² habi..."
25RCRCL2TUH7,2025-04-25T09:02:00Z,Fix St Geneys,,43320,BUY,HOUSE,95000,574.0,12,,"Au coeur du village de Fix St Geneys, ensemble immobilier à rénover entièrement composé de 5 parties aménageables en logements séparés disposant chacune d'un espace extérieur. Honoraires charge vende..."
253X14K3X69J,2025-10-18T22:37:00Z,Le Puy en Velay,,43000,BUY,APARTMENT,137000,73.0,3,2,"Situé au coeur du quartier historique du Puy-en-Velay, à deux pas des monuments emblématiques, des écoles et du centre ville accessible à pied, découvrez cet appartement plein de cachets et authentic..."
254GSE1B63VT,2025-06-29T18:24:00Z,Chadron,,43150,BUY,HOUSE,95000,88.0,4,2,"iad France - Aurore Souef vous propose: EXCLUSIVITÉ – Commune de Chadron (43) – Maison en pierre avec 2 chambres + jardin + vue. Située dans hameau paisible, à moins de 15 min de Solignac-sur-Loire, ..."
25UXPZAUL5B3,2025-08-11T18:22:00Z,Polignac,,43000,BUY,HOUSE,189500,170.0,7,4,iad France - Aurore Souef vous propose: EXCLUSIVITÉ – Commune de Polignac (43) – Ancienne grange rénovée 170 €m² – 3 chambres (dont 1 suite parentale) et possibilité d'en créer une 4ème. Au cOEur du ...
25FU2EN5TCWX,2025-09-04T22:28:00Z,Le Puy en Velay,,43000,BUY,HOUSE,189900,134.0,7,4,"Vous rêvez d'une maison avec jardin à la ville à rénover à votre goût ? Ne cherchez-plus ! Ne ratez pas cette belle opportunité. A deux pas des écoles, de la gare, du centre-ville et de toutes commod..."
25UUKQXLJXR7,2025-11-21T21:50:00Z,Retournac,,43130,BUY,HOUSE,149000,108.0,4,2,"Dans vos agences Alti Immo, Venez découvrir cette charmante maison plain pied d'environ 110m2 composée d'une belle et lumineuse salle à manger, d'un salon, d'une cuisine meublée et semi équipée, de d..."
25VDXJYHGVVP,2025-09-11T00:05:00Z,Saint-Julien-Chapteuil,,43260,BUY,HOUSE,429000,275.0,7,4,Romain KETTERER et Julia VERRECCHIA by CÉSAR & BRUTUS vous proposent en exclusivité : À Saint-Julien-Chapteuil – Auteyrac Elégance – Décor bucolique – 275 m² habitables – Maison de 1720 – Terrain pla...
257HTAXSPSUD,2025-10-06T12:05:00Z,Vals-Près-le-Puy,,43750,BUY,APARTMENT,219900,103.0,5,3,Romain KETTERER & Julia VERRECCHIA vous proposent en EXCLUSIVITÉ : APPARTEMENT – TERRASSE – LUMINEUX – VUE INCROYABLE – TRÈS GRAND GARAGE Découvrez ce bel appartement de 103 m² situé au 7 € étage ave...
25H2FBG24B5C,2025-06-30T08:40:00Z,"Beyssac, Saint-Jean-de-Nay",,43320,BUY,HOUSE,89000,235.0,4,3,"ANCIEN BAR / RESTAURANT AVEC LOGEMENT DE FONCTION ET DÉPENDANCE – BEYSSAC (20 MIN DU PUY-EN-VELAY) Situé au coeur du village de Beyssac, à seulement 20 minutes du Puy-en-Velay, cet ancien bar-restaur..."
25BTQF3NNNCR,2025-11-21T19:03:00Z,Aurec-sur-Loire,,43110,BUY,HOUSE,169000,96.0,5,3,iad France - Yoann Tranchand vous propose: Aurec-sur-Loire – Maison à Rénover avec Gros Potentiel ! Une opportunité rare pour créer la maison de vos rêves ou réaliser un investissement malin ! Cette ...
25W6IRPDJVXH,2025-09-03T22:33:00Z,Monistrol sur Loire,,43120,BUY,HOUSE,138000,96.0,6,4,"Alti-Immo vous propose une maison avec beaucoup de potentiel à Monistrol-sur-Loire, dans le quartier des Kersonniers. Elle offre 95 m² habitables, actuellement répartis en deux appartements indépenda..."
25BY5CTA7S7Z,2025-10-20T07:28:00Z,Ouides,,43510,BUY,HOUSE,129000,130.0,3,1,"iad France - Édouard Vauthey vous propose: Maison rénovée avec garage, terrain et vue dégagée — Commune de Ouides, proche Saint-Jean-Lachalm. À 30 minutes du Puy-en-Velay et 15 minutes du Lac du Bouc..."
25599QW7GPNP,2025-05-08T20:02:00Z,Le Puy-en-Velay,,43000,BUY,HOUSE,192600,65.0,2,2,Les informations sur les risques auxquels ce bien est exposé sont disponibles sur le site Géorisques : COMPTOIR IMMOBILIER DE FRANCE - Plus d'informations - « Les informations sur les risques auxquel...
25URZK73VSCY,2025-04-19T21:53:00Z,Vorey,,43800,BUY,HOUSE,106000,105.0,5,3,"EN EXCLUSIVITE, je vous propose cette charmante maison en pierre située sur les hauteurs de Vorey sur Arzon à seulement 5 min en voiture du centre ville et 20 min à pied par des petits chemins. Idéal..."
25BEYJYUR8XU,2025-09-01T15:17:00Z,Monistrol sur Loire,Zone Periurbaine,43120,BUY,HOUSE,139000,86.0,4,2,"Maison de plain-pied 86 m² habitables Monistrol-sur-Loire À découvrir sur la commune de Monistrol-sur-Loire, dans un secteur particulièrement calme et agréable, cette maison de plain-pied d'environ 8..."
258R7XISP94I,2025-09-19T09:05:00Z,Beaux,,43200,BUY,HOUSE,120000,73.0,3,2,"iad France - Olivier Michel vous propose: Maison de 73m² sur un Vaste Terrain de 2540m² à Beaux, lieu dit Arzilhac. Cette maison sur sous-sol complet, située dans un cadre idyllique à Beaux, offre un..."
25UCWCUXYH55,2025-07-17T19:34:00Z,Tence,,43190,BUY,APARTMENT,50000,46.02,2,1,"EXCLUSIVITE - Tence (43190) – T2 traversant 46,02 m² – 2e étage – Pièce de vie ouverte – Libre – Balnéo - Balcon – Cave – 9,94 % brut Au 2e étage d’un immeuble calme, ce T2 traversant Sud-Nord de 46,..."
25HQ7ITCG83C,2025-10-22T14:17:00Z,Le Puy-en-Velay,Guitard-Roche Arnaud,43000,BUY,APARTMENT,92000,91.0,5,,"Réf 400468 - Dans une résidence de 32 logements située sur les hauteurs du Puy, rue Maurice Barres, grand appartement T4 de 94,62 m² situé au rdc surélevé de la résidence. Logement traversant et lumi..."
25L36URB3QRL,2025-07-21T23:18:00Z,Roche en Regnier,,43810,BUY,HOUSE,50000,70.0,3,2,"En exclusivité dans vos agences Alti Immo, Venez découvrir cette charmante maison composée au rez de chaussée d'une cuisine ouverte sur salle à manger et d'un salon. Présence d'une salle d'eau WC. A ..."
25JCLJCHZBDQ,2025-10-28T05:42:00Z,Craponne-sur-Arzon,,43500,BUY,HOUSE,250000,206.0,6,4,"Christelle PRALONG du Réseau 3GIMMO vous propose, à 10min du Centre de Craponne-sur-Arzon, cette magnifique bâtisse en pierre d'une superficie habitable d'environ 206m² habitables. Elle se compose : ..."
25SJKDZVQZLJ,2025-07-07T18:39:00Z,Monistrol-sur-Loire,,43120,BUY,HOUSE,106000,106.0,5,4,"Christelle PRALONG du Réseau 3GIMMO vous propose, EN EXCLUSIVITE, à 15min du Centre de Monistrol-sur-Loire, cette maison en pierre d'environ 105m² habitables située dans un environnement calme et ent..."
253C7S7B7K1N,2025-08-25T18:48:00Z,La Séauve-sur-Semène,,43140,BUY,APARTMENT,79000,74.65,4,3,"La Séauve sur Semène 43140 **EN EXCLUSIVITE** Appartement T3 de 76m² habitables, 2 CHAMBRES (Possibilité trois) UNE TERRASSE PRIVATIVE DE 80m² au 1er étage sans ascenseur d'une résidence sécurisée PR..."
25QSAFRV7ISJ,2025-07-29T17:42:00Z,Aurec-sur-Loire,,43110,BUY,HOUSE,259000,158.0,5,4,"158 m² habitables – Terrain de 500 m² + dépendances – Vue panoramique. Découvrez le charme intemporel de cette magnifique maison en pierre, idéalement située dans un environnement calme et privilégié..."
25UZZJLHRS55,2025-07-24T16:54:00Z,Les Estables,,43150,BUY,HOUSE,189000,72.0,3,2,"Fermette de montagne. Les Estables. Au moment de sa découverte, l'espace d'un instant, vous êtes déconnectés du monde réel à la vue de cette magnifique petite maison pleine de charme et d'authenticit..."
254BTSGAZIGP,2025-07-16T20:34:00Z,Tence,,43190,BUY,APARTMENT,53000,48.77,2,1,"Exclusivité Les Clefs de l’Immo – Au sein d’un immeuble calme, découvrez ce T2 traversant de 48,77 m², lumineux, situé au 1er étage. Libre de toute occupation, il bénéficie d’un agencement fonctionne..."
25DM75BL61DT,2025-11-24T22:05:00Z,Rosières,,43800,BUY,HOUSE,140000,60.0,3,2,"Chez JB Transactions, Charmante maison de 60 m² dans un cadre verdoyant Située dans un environnement paisible et agréable, cette maison de plain-pied de 60 m² offre un cadre de vie idéal, que ce soit..."
25A6Q3FL4R3D,2025-09-25T08:01:00Z,Saint-Julien-Chapteuil,,43260,BUY,HOUSE,289900,186.0,6,3,"AUTHENTIQUE FERME RÉNOVÉE AVEC TERRAIN Amoureux de la pierre et du bois, cette ancienne ferme rénovée avec goût ne pourra que vous séduire ! Située dans un charmant hameau de la commune de Saint-Juli..."
257CUE6UYRBI,2025-09-09T13:50:00Z,Le Monastier-sur-Gazeille,,43150,BUY,HOUSE,69000,123.0,10,3,"EXCLUSIVITÉ MAISON DE VILLAGE AVEC JARDIN. Au cœur du bourg du Monastier-sur-Gazeille, village touristique étant la première étape du célèbre Chemin de Stevenson (GR70) qui représente environ 13 000 ..."
25PZIB78LQX9,2025-09-15T08:45:00Z,Aurec-sur-Loire,,43110,BUY,HOUSE,220000,124.0,4,3,"Maison de caractère – Charme & Sérénité au rendez-vous. Vous recherchez une maison alliant espace, confort et authenticité ? Cette demeure pleine de charme est faite pour vous !! Un cadre de vie idéa..."
24CMTX4R5832,2024-06-17T15:02:00Z,Saint-Front,,43550,BUY,HOUSE,117000,110.0,9,4,Charmante bâtisse en pierre de pays située dans le pittoresque hameau du Massif du Mézenc. Golfe de Saint Pierre Immobilier vous propose cette propriété au sein du village de Saint-Front avec vue imp...
25BL4YBZ2JV6,2025-06-12T03:29:00Z,Domeyrat,,43230,BUY,HOUSE,289000,250.0,7,3,"Venez découvrir idéalement situé dans un charmant village au bord de la Senouire cette magnifique bâtisse en pierre, récemment rénovée avec beaucoup de caractère. Dans la partie résidentielle, vous d..."
24625E1AI36F,2024-08-29T10:23:00Z,Saugues,,43170,BUY,HOUSE,293000,192.0,8,6,"SAUGUES - Au coeur du Gévaudan - Propriété de caractère (du 13ème et 18ème siècles) composée d'une maison principale d'une surface habitable de 192,20 m² (sur trois niveaux) et d'une dépendance à amé..."
251IYVYKPZPL,2025-05-01T23:38:00Z,Malrevers,,43800,BUY,HOUSE,97000,95.0,4,3,"Ferme à rénover Ferme ATYPIQUE, à rénover dans un lieu tranquille et agréable. Cette habitation de 95 m², par niveau, soit rdc et 1er étage, sur 2 niveaux, ainsi que son terrain de 2400 m², vous offr..."
25YIUMVCIZSL,2025-02-25T11:15:00Z,Roche-en-Régnier,,43130,BUY,HOUSE,140000,140.0,6,4,"Baisse de prix – Maison 6 pièces à Roche-en-Régnier À vendre en exclusivité, maison de 2008 (classée C), sans vis-à-vis, sur un terrain plat d'environ 1 000 m², hors lotissement, dans un environnemen..."
25AKKRL5AAFA,2025-01-05T01:00:00Z,Retournac,,43130,BUY,HOUSE,129000,139.0,6,4,"Venez découvrir cette charmante maison située tout proche des commodités et commerces dans le centre de Retournac. Cette dernière se compose au rez de chaussée d'une cuisine, d'un séjour, d'un bureau..."
244ZXWDPV3E3,2024-12-19T11:30:00Z,Monistrol sur Loire,Zone Periurbaine,43120,BUY,HOUSE,249000,160.0,7,5,"A découvrir ! Très beau corps de ferme sur une parcelle de 9 000m² dont environ 750 m² constructibles à rénover ! Situé à 10min du centre de Monistrol-sur-Loire dans un lieu calme, ce corps de ferme ..."
253X2T9NTWHI,2025-10-09T14:10:00Z,Le Puy en Velay,,43000,BUY,APARTMENT,89000,60.0,3,1,"Nous vous proposons un bien rare sur le marché : deux appartements en copropriété, situés en rez-de-chaussée et bénéficiant chacun d’une entrée totalement indépendante du reste de l’immeuble. Situés ..."
2593HM3GH94L,2025-10-27T17:32:00Z,Le Puy-en-Velay,Guitard-Roche Arnaud,43000,BUY,APARTMENT,80000,65.0,3,,"Ref 400485 - Dans une résidence de 18 logements située sur les hauteurs du Puy, rue Maurice Barres, appartement T3 de 63.67 m² situé au 2ème étage. Logement avec balcon - traversant et lumineux - exp..."
257MZI9QMRHW,2025-07-08T13:47:00Z,Tence,,43190,BUY,APARTMENT,49000,48.74,2,1,"Tence (43190) – Appartement T2 de 48,74 m² – 1er étage – Traversant – Libre – Grande pièce de vie – Chauffage collectif Situé au 1er étage d’un immeuble, cet appartement T2 traversant Nord-Sud de 48,..."
258LLR6GVM5P,2025-07-24T02:41:00Z,Bas en Basset,,43210,BUY,HOUSE,98000,103.07,4,3,BAS EN BASSET ! CORPS DE FERME ! 103.07 M² ! 680 M² DE TERRAIN ! Bas en Basset .. C'est dans un hameau sur la commune de Bas en Basset à 9 minutes du centre-ville. Que vous pourrez découvrir cet anci...
248968MWRNA8,2024-09-26T15:57:00Z,Yssingeaux,,43200,BUY,HOUSE,360000,158.0,6,2,"Dans votre agence Alti'Immo, Venez découvrir cette charmante ferme située non loin du centre bourg de la commune d'Yssingeaux. Cette dernière de plus de 150m2 habitable comprend au rez de chaussée d'..."
25DHRF367RR4,2025-07-17T20:15:00Z,Tence,,43190,BUY,APARTMENT,40000,34.61,1,1,"Tence (43190) – Grand T1 bis de 34,61 m² – 2e étage – Libre – Meublé possible – Cave – Rentabilité 9,33 % Au 2e étage centre d’un immeuble calme et entretenu, ce grand T1 bis de 34,61 m², donnant côt..."
24U8XPSI6EAR,2024-09-25T15:07:00Z,Saint Julien des Chazes,,43300,BUY,HOUSE,149000,134.0,5,3,"Au coeur d'un hameau sur les hauteurs de la vallée de l'Allier, ancien gîte entièrement rénové dans les années 90 disposant d'une belle cour ombragée et d'un jardin de plus de 1500 m². Le rdc de cett..."
25ZJDWKJ5TIZ,2025-06-26T11:49:00Z,Beaux,,43200,BUY,HOUSE,66000,75.0,2,2,"Chez JB Transactions YSSINGEAUX Maison sur Beaux – Charmante opportunité à saisir Située à moins de 10 minutes de la RN 88 et du centre d'Yssingeaux, cette maison de 75 m² vous propose : - Au rez-de-..."
257J2P9TGUTB,2025-01-03T16:15:00Z,Yssingeaux,Sud,43200,BUY,APARTMENT,135000,85.3,3,2,"EN EXCLUSIVITÉ , IDEAL INVESTISSEUR à YSSINGEAUX, Bel APPARTEMENT de 85.30 m² Habitable entièrement rénové comprenant Entrée, Séjour, Cuisine séparée équipée et Aménagée, 2 Chambres dont une de 16.30..."
25ML7LD4QW99,2025-09-12T16:25:00Z,Chadrac,,43770,BUY,HOUSE,195000,100.0,5,3,"Dans le secteur très prisé, venez découvrir cette jolie maison individuelle avec jardin de 450 m2. Secteur calme, vue dégagée. A proximité des commerces et commodités. Elle se compose : - A l'étage :..."
24YBZJN8W8BT,2024-06-06T06:31:00Z,Yssingeaux,Sud,43200,BUY,APARTMENT,147000,106.0,4,3,"SPECIAL INVESTISSEUR !! Bel appartement T4 de 109 m² au 2éme étage d'une copropriété de 3 lots, idéalement situé en plein centre-ville d' Yssingeaux proche de toutes commodités. Il comprend un SAS d'..."
25TL49QXB353,2025-05-26T15:33:00Z,Chanteuges,,43300,BUY,HOUSE,79000,147.0,4,2,Beaucoup de charme pour cette maison ancienne située entre l'abbaye et le bourg de Chanteuges. Les 4 niveaux forment un bien tout à fait atypique. La partie haute constitue un premier logement compos...
242CMCK88JAS,2022-10-16T08:20:00Z,St Pierre Eynac,,43260,BUY,HOUSE,498000,226.0,8,3,"Cette grande maison familiale de 8 pièces, sur une surface habitable de 226 m2 en parfait état, exposée plein sud, sur un terrain de 3767 m2, située sur la commune de st pierre eynac, dans un lieu- d..."
25Z94YHBZSY8,2025-05-12T15:18:00Z,Aurec sur Loire,,43110,BUY,HOUSE,109000,60.0,3,2,"Au Cœur du Village à proximité d'Aurec sur Loire, MAISON EN PIERRE de 60 m² Habitable comprenant Entrée, Pièce de Vie avec Cuisine ouverte équipée d'un Poêle à Bois, Salle d'Eau avec WC, à l'étage 2 ..."
244JVSE3SXJZ,2023-10-05T01:20:00Z,St Georges d Aurac,,43230,BUY,HOUSE,41500,85.0,3,2,"Dans la commune de Saint-Georges-D'Aurac, en pleins coeur du village, venez découvrir cette maison composée au rez de chaussée d""une cusine pouvant être ouverte sur le séjour, une salle de bain avec ..."
25S1MZGLYFLG,2025-07-04T11:52:00Z,Tiranges,,43530,BUY,HOUSE,227000,116.0,,3,"Sur la commune de Tiranges, Villa de plain-pied construite en 2000 offrant 116m² hab et le tout sur 1381m² de terrain. Elle se compose d'un hall d'entrée avec rangements, une cuisine ouverte sur le s..."
25U4E8K73PUR,2025-08-30T11:49:00Z,Yssingeaux,Sud,43200,BUY,HOUSE,323000,160.0,5,3,"Chez JB TRANSACTIONS YSSINGEAUX, Ferme en pierre avec grand terrain de 3,5 ha – À 5 min du centre d'Yssingeaux ! Localisation : En pleine nature, sans voisins, à seulement 5 min du centre d'Yssingeau..."
2548QTSILFHN,2025-08-08T22:59:00Z,Saint-Front,,43550,BUY,HOUSE,75000,110.0,6,5,"Composée de 6 pièces sur 2 niveaux à rénover, d'une écurie de 91 m² et d'une grange, cette belle propriété offre un cadre de vie calme, serein et verdoyant et bénéficie d'un raccordement au tout à l'..."
253F4SP33UBV,2025-11-01T18:02:00Z,Chaspinhac,,43700,BUY,HOUSE,120000,103.0,5,3,"Beaucoup de charme pour cette ancienne ferme en pierre, idéalement située dans un village calme et agréable, à l'abri de toute nuisance. D'une surface habitable d'environ 90 m², elle s'organise autou..."
256XSHVS7U6M,2025-05-26T21:12:00Z,Saint-Ferréol-d'Auroure,,43330,BUY,HOUSE,198000,107.0,5,3,"En exclusivité - Maison avec terrain clos et arboré à Saint-Ferréol-d'Auroure Située dans un secteur paisible, cette maison de 107 m² habitables vous est proposée en exclusivité au prix de 198 000 eu..."
25JRSQ66J1H9,2025-10-10T08:39:00Z,Le Puy-en-Velay,Guitard-Roche Arnaud,43000,BUY,APARTMENT,68000,66.42,3,3,"Appartement T3 de 66 m² à rénover À seulement 2 minutes du centre-ville du Puy-en-Velay, en bas de l'avenue Foch, découvrez cet appartement traversant de 66 m², situé au 3 € et dernier étage d'un pet..."
25A7AXTNVXC6,2025-10-09T18:19:00Z,Vals-Près-le-Puy,,43750,BUY,APARTMENT,89000,83.0,4,2,"iad France - Édouard Vauthey vous propose: Actuellement loué, au 1 €? étage, appartement F4 lumineux avec ascenseur, garage fermé et cave — Quartier résidentiel calme à Vals-près-le-Puy. Situé dans l..."
25BR2LW4VIC6,2025-10-24T16:56:00Z,Le Puy en Velay,Breuil-Carmes,43000,BUY,APARTMENT,75000,38.0,2,1,"Idéal investisseur ou premier achat. Appartement entièrement rénové en 2022 de 38 m2 avec terrasse au 7ème et dernier étage. Le bien se compose d'une entrée avec rangements, une cuisine équipée ouver..."
25TN9HNZ7KEJ,2025-09-11T20:44:00Z,Saint-Front,,43550,BUY,HOUSE,140000,180.0,2,1,"Ancienne ferme sur le plateau du Mézenc! Avec sa belle vue dégagée sur le cadre verdoyant, cette bâtisse en pierres noires typique du plateau vous accueille dans le parc des Monts d'Ardèche. La natur..."
