id,creationDate,city,district,zipCode,distributionType,propertyType,price,surface,nbroom,nbbedroom,description
25HSVMRVM7TD,2025-09-11T21:03:00Z,Cayenne,,97300,BUY,HOUSE,452600,163.0,4,3,"Charmante maison individuelle à vendre à Cayenne. Construite en 1990 et en bon état, elle offre 163 m², 3 chambres, un bureau de 11m², un séjour lumineux, une terrasse, un jardin paysager et une pisc..."
25J1ITN8FC8X,2025-05-26T16:02:00Z,Remire-Montjoly,,97354,BUY,APARTMENT,154000,45.91,2,1,"Dans une petite copropriété située sur le route de Rémire, un appartement de type T2 situé au premier étage Il comprend un séjour, une cuisine aménagée et équipée avec une plaque de cuisson, un dégag..."
24GSUKH4PJIZ,2024-11-29T19:47:00Z,Matoury,,97351,BUY,HOUSE,424000,150.0,5,4,"Découvrez cette charmante maison à vendre, nichée au cœur de la nature à Matoury, Guyane Française. Construite en 2011 et en bon état, elle offre une surface de 150 m² comprenant 4 chambres et un sal..."
25RGJXS4GCQH,2025-10-21T21:47:00Z,Remire-Montjoly,,97354,BUY,APARTMENT,159000,42.18,2,1,"Situé dans une petite copropriété, proche de toutes les commodités, un appartement de type T2 situé au rez-de-chaussée. Il comprend un séjour, une cuisine aménagée et équipée avec une plaque de cuiss..."
25SIIMSS38ZN,2025-10-13T15:46:00Z,Cayenne,,97300,BUY,APARTMENT,146700,34.27,1,,"Studio à vendre, idéal investisseur ou pied-à-terre, d'une surface de 34,27 m², construit en 2013. Situé à Cayenne, il offre une pièce de vie, une terrasse privative, parking extérieur et accès pisci..."
25UYPSV1KAQ9,2025-06-12T14:31:00Z,Cayenne,,97300,BUY,HOUSE,260000,120.0,5,4,"À Cayenne (97300) quartier de Montabo, cette maison d'environ 120 m² sur un terrain de 367 m² offre un cadre unique inscrit au registre des monuments historiques. Située à proximité des écoles, du ce..."
25UESMGF7JPC,2025-08-28T13:03:00Z,Matoury,,97351,BUY,HOUSE,365000,126.0,5,4,"En Guyane, à MATOURY, SAFTI pour présente et propose ce bien d'exception dominant la foret primaire et la faune qui y vit. Entourée de fruitiers, cette Villa aux allures de Loft, d'une conception all..."
25Z94NSN4I6Z,2025-06-11T15:18:00Z,Kourou,,97310,BUY,HOUSE,350000,150.0,4,3,"Kourou, j'ai le plaisir de vous proposer à la vente cette maison T4 de plain-pied sur 150² habitables sur un terrain de 698 m², située à proximité du port. Cette magnifique maison se compose, d'une c..."
259I5MT4HAK4,2025-11-13T19:40:00Z,Cayenne,,97300,BUY,APARTMENT,140400,59.8,2,1,"Appartement libre à vendre idéalement situé à Cayenne, proche des commodités et transports. Bel appartement de type T2 situé au premier étage, construit en 2015 et en bon état général, comprenant une..."
257W8834ISRS,2025-11-18T21:34:00Z,Roura,,97311,BUY,HOUSE,368000,211.0,9,6,"En Guyane, à Roura et ses nombreux sites naturels (Marais Kaw, Eskol, chutes Fourgassier, Favard, la réserve Trésor, la rivière Oyak et ses méandres .. mais aussi l'église du 17ème, les guides et car..."
25D2GGHNEIM4,2025-05-12T19:28:00Z,Remire-Montjoly,,97354,BUY,APARTMENT,155000,45.0,2,1,"Dans une résidence calme et sécurisée avec grand parking, venez découvrir ce spacieux appartement situé au 1er étage. Il se compose d'une cuisine ouverte sur le séjour, d'une salle d'eau avec WC, d'u..."
25EQMWEDQ435,2025-06-17T15:04:00Z,Kourou,,97310,BUY,APARTMENT,145800,65.0,3,2,"Sur la commune de Kourou, ORPI vous présente ce bel appartement de type T3 de 65 m² aux 2 ° étages. L'appartement se compose d'un séjour lumineux et ventilé, d'une cuisine, de deux chambres climatisé..."
25MSFTMYZPES,2025-05-19T15:53:00Z,Cayenne,,97300,BUY,APARTMENT,82500,25.0,1,,"Découvrez ce charmant studio à vendre, idéal pour un étudiant ou un investissement locatif. Situé au cœur de Cayenne, dans une rue paisible, cet appartement de 25 m² offre un espace de vie confortabl..."
258TXSPFUJCT,2025-10-17T18:43:00Z,Cayenne,,97300,BUY,APARTMENT,104500,27.42,1,,"Studio lumineux à vendre, idéal investisseur ou premier achat, situé au 2ème étage d'une résidence sécurisée à Cayenne. D'une surface de 27,42 m² et en bon état, ce logement fonctionnel offre une piè..."
2513E7FUUTZ3,2025-07-30T22:35:00Z,Remire-Montjoly,,97354,BUY,HOUSE,385800,93.0,5,4,"97354 – RÉMIRE-MONTJOLY – VILLA T5 NEUVE – TERRAIN PRIVATIF 400 M² – TERRASSE COUVERTE 12 M² – ABRI VOITURE – PROXIMITÉ ÉCOLES ET COMMERCES effiCity, l'agence qui estime votre bien en ligne, vous pro..."
25738RX7BXTB,2025-05-20T21:10:00Z,Cayenne,,97300,BUY,HOUSE,750000,176.0,5,4,"Découvrez cette superbe maison individuelle à vendre, située à Cayenne, offrant un cadre de vie exceptionnel. Construite en 2008, cette propriété de 176 m² est en bon état et propose un espace de vie..."
24R35TIJTKB9,2024-11-13T20:44:00Z,Mana,,97360,BUY,HOUSE,325000,250.0,6,5,"Découvrez cette charmante maison à vendre, située à Mana, offrant un cadre de vie paisible et enchanteur. Construite en 1997, cette propriété spacieuse de 250 m² comprend cinq chambres dont une suite..."
25S4Q4WHLRDD,2025-10-25T17:42:00Z,Cayenne,,97300,BUY,HOUSE,318000,131.0,6,4,"97300 - CAYENNE CENTRE VILLE - IMMEUBLE COMPOSE DE 2 LOGEMENTS T3 SICOBIN Hervé avec effiCity, l'agence qui estime votre bien en ligne, vous propose cette immeuble située a Cayenne centre ville. Cons..."
2518LWXCAJ3C,2025-10-23T16:14:00Z,Cayenne,,97300,BUY,APARTMENT,99550,21.92,1,,"Studio à vendre idéalement situé dans la Résidence Kwata à Cayenne, offrant 21,92 m² bien agencés, pièce principale lumineuse, balcon et terrasse pour profiter de l'extérieur. Disponible immédiatemen..."
25DW9IHURYIM,2025-09-23T20:24:00Z,Roura,,97311,BUY,HOUSE,268000,125.0,4,3,"En Guyane, à Roura et ses nombreux sites naturels (Marais Kaw, Eskol, chutes Fourgassier, Favard, la réserve Trésor, la rivière Oyak et ses méandres .. mais aussi l'église du 17ème, les guides et car..."
25NGEKZBZZ5S,2025-09-01T05:16:00Z,Cayenne,,97300,BUY,APARTMENT,75000,30.33,1,,"Découvrez ce charmant appartement situé au cœur de Cayenne en Guyane française. Avec une superficie de 30,33 m², cet espace est idéal pour un premier achat ou un investissement locatif. Doté d'une pi..."
25CCJ2Q2EAKF,2025-10-01T13:17:00Z,Macouria,,97355,BUY,HOUSE,291000,104.0,5,5,"En Guyane, à Macouria, au Lac Maillard, en quartier résidentiel calme et bien desservi (lycées de Montsinnery et agricole de Matiti, piste de Kart, Zoo de Macouria, CD 5 vers le bagne des Annamites, ..."
25P9TX2IY2T6,2025-06-26T23:11:00Z,Kourou,,97310,BUY,HOUSE,216000,105.0,4,3,"Sur la commune de Kourou, OPRI a le plaisir de vous proposer cette maison individuelle T4 R+1 de 105 m². Maison T4 R+1 comprenant au rez-de-chaussée, un vaste séjour, une cuisine, un cellier, un WC, ..."
25GL2BWRYVTY,2025-06-03T19:19:00Z,Kourou,,97310,BUY,APARTMENT,259900,120.0,6,4,"Venez découvrir ces 2 magnifiques appartements T3, 1 T3+ au rez de chaussée de 59m² et 1 T3 à l'étage de 61m² situés dans un quartier calme de Kourou proche de toutes les commodités. Celui du rez de ..."
25GPGLC4W6WN,2025-11-05T06:51:00Z,Matoury,,97351,BUY,HOUSE,375000,136.0,5,4,"Située dans un environnement paisible au sein du lotissement Guimanmin, à proximité immédiate de toutes les commodités (écoles, commerces, crèches, etc.), cette belle maison de plain-pied d'environ 1..."
257L22XRU8Q3,2025-09-29T13:06:00Z,Roura,,97311,BUY,HOUSE,438000,141.0,6,5,"Venez découvrir cette charmante maison traditionnelle guyanaise avec une superbe vue sur le fleuve, nichée sur une belle parcelle d'environ 830 m². Au rez-de-chaussée, vous profiterez d'une cuisine f..."
256VIMXIVDXS,2025-08-31T05:49:00Z,Remire-Montjoly,,97354,BUY,HOUSE,350000,117.0,4,3,"Située à Attila Cabassou, sur un terrain clos d'environ 713 m², cette charmante villa de plain-pied offre un cadre de vie agréable et fonctionnel, idéal pour une famille. Elle se compose d'un séjour ..."
25CGNPB7MLAN,2025-08-25T12:48:00Z,Cayenne,,97300,BUY,APARTMENT,202500,94.0,4,3,"Situé dans une résidence calme, au fond d'une impasse et à proximité immédiate de toutes commodités (commerces, hôpital, écoles…), cet appartement de type 4 en duplex se trouve au 1er et dernier étag..."
25IMKKTQ4H3U,2025-08-29T17:40:00Z,Matoury,,97351,BUY,HOUSE,381400,225.0,9,6,"97351 – MATOURY (Cogneau Larivot) – EXCEPTIONNELLE VILLA DE 9 PIÈCES (T3 + T5) – 225 m² – TERRAIN DE 1 272 m² – PROCHE DU TRIBUNAL SICOBIN Hervé avec efficity, l'agence qui estime votre bien en ligne..."
2541V7TDFJCG,2025-03-21T10:48:00Z,Cayenne,,97300,BUY,APARTMENT,257250,58.7,3,2,"Dans une résidence de haut standing située route de Montabo, découvrez ce magnifique T3 comprenant : un vaste séjour, une cuisine américaine aménagée et équipée d'une hotte électrique, deux chambres ..."
2549VTN3I7VI,2025-10-15T05:33:00Z,Remire-Montjoly,,97354,BUY,HOUSE,425000,128.0,4,3,Située dans le secteur d'Attila Cabassou sur un terrain clôturé d'environ 500 m² . Cette belle villa contemporaine récente d'environ 128m² est composée au rez de chaussée d'un joli séjour et d'une cu...
256KA1LE89Z9,2025-09-26T05:49:00Z,Remire-Montjoly,,97354,BUY,HOUSE,420000,160.0,5,3,"Rare sur le secteur : villa de plain-pied de 160 m², édifiée sur une parcelle clôturée de 1 674 m². Emplacement stratégique en bordure de la route de Rémire-Montjoly, proche plages, commerces et écol..."
25DHEL6NYSIZ,2025-06-24T20:02:00Z,Cayenne,,97300,BUY,APARTMENT,224700,66.5,3,2,"Découvrez ce superbe appartement, situé dans un quartier prisé de Cayenne. Cet appartement T3 au rez-de-chaussée offre un cadre de vie spacieux et lumineux. Profitez de deux chambres confortables, d'..."
25AU6W2RPD4D,2025-04-25T19:06:00Z,Cayenne,,97300,BUY,APARTMENT,186840,62.15,3,2,"Appartement T3 spacieux et lumineux à vendre, idéalement situé à Cayenne. Le bien comprend deux chambres confortables et un salon accueillant. Profitez de moments de détente sur la terrasse et bénéfi..."
255FVTX8RU2H,2025-10-12T12:19:00Z,Matoury,,97351,BUY,HOUSE,275000,85.0,5,2,"Charmante petite maison sécurisée et rénovée de type 3 + bureau, située dans un lotissement calme et comprenant deux chambres climatisées, deux bureaux également climatisés, une cuisine ouverte au sé..."
24JAF1K78MDG,2024-12-03T04:12:00Z,Macouria Tonate,,97355,BUY,HOUSE,656775,140.0,6,3,Michel FEVRY vous propose au quartier Morphos à Macouria une superbe propriété constituée d'une maison R+1 à rénover de type T6 structure bois avec piscine le tout construit sur une parcelle de terra...
25SE4D5KM4F6,2025-10-14T19:43:00Z,Cayenne,,97300,BUY,APARTMENT,150000,38.0,2,1,"Situé Chemin St Antoine, entre les 2 axes majeurs que sont la route de Baduel et de Montabo, je vous propose de découvrir cet appartement de 2 pièces. Proche des commerces, des écoles et des transpor..."
25HSMMYTCG4D,2025-10-24T15:12:00Z,Kourou,,97310,BUY,HOUSE,283550,101.26,5,4,"Maison À Vendre Kourou, ORPI a le plaisir de vous proposer à la vente cette maison semi-mitoyenne T5 R+1 sur 101 m² habitables sur un terrain de 470 m². Cette maison semi-mitoyenne dispose, au rez-de..."
25QW1LGI2818,2025-10-22T19:46:00Z,Macouria,,97355,BUY,HOUSE,282000,133.0,5,4,"Située dans un environnement paisible du domaine de Soula 2, à proximité immédiate de toutes commodités (écoles, commerces, crèches, etc.), cette belle maison de plain-pied d'environ 133 m² est édifi..."
252CH6HWTH6U,2025-04-10T19:42:00Z,Cayenne,,97300,BUY,APARTMENT,315000,94.76,4,3,"A Cayenne, dans une résidence récente et d'exception! Au 3ème étage avec ascenseur, un T4, spacieux avec vue imprenable sur la mer. à visiter sans tarder! parking sécurisé. Surface habitable: 85.76m²..."
25VE14GT58BN,2025-08-01T14:15:00Z,Cayenne,,97300,BUY,APARTMENT,189000,71.05,3,2,"LIBRE DE SUITE !! Laissez-vous séduire par ce charmant appartement T3, idéalement situé dans une résidence paisible de Montabo. Construit en 2014, il offre un espace de vie confortable et lumineux. V..."
25IHMN5JVQXC,2025-10-15T21:47:00Z,Cayenne,,97300,BUY,APARTMENT,151200,41.55,2,1,"À vendre — charmant T2 de 41,55 m² dans une résidence de 2016, idéalement situé au Lotissement Tome, Cayenne. Situé au dernier étage, cet appartement en bon état offre une chambre confortable, un séj..."
25QHKKBLS1WW,2025-10-13T17:31:00Z,MATOURY,,97351,BUY,HOUSE,310300,195.0,4,3,"Devenez le futur propriétaire de cette magnifique maison de type T4 de 195 m² cette maison se compose d'un séjour ouvert de donnant vue sur sa cuisine américaine, d'un cellier, de 3 chambres climatis..."
251YWS183PHK,2025-04-23T13:36:00Z,Saint-Laurent-du-Maroni,,97320,BUY,HOUSE,296000,101.7,6,4,"OPPORTUNITÉ A SAISIR - DEUX MAISONS JUMELÉES AU CŒUR DE SAINT-LAURENT DU MARONI ! Idéalement situées en plein centre-ville , découvrez ces DEUX MAISONS JUMELÉES, parfaites pour un investissement loca..."
25TRIRIL62YF,2025-11-08T08:46:00Z,Remire-Montjoly,,97354,BUY,HOUSE,440000,333.0,16,11,"En exclusivité pour vous investisseurs / Aménageurs A quelques pas de la boulangerie ""Savoureux gateaux"", vous arrivez sur votre propriété composée de deux parcelles disctinctes mais vendues ensemble..."
24QS6RRPW2FU,2024-07-22T07:58:00Z,Saint-Laurent-du-Maroni,,97320,BUY,HOUSE,405000,115.14,5,4,"Découvrez cette magnifique villa à vendre située à Saint Laurent du Maroni, Guyane. Construite en 2022, cette propriété neuve de 115,14 m² offre un cadre de vie exceptionnel avec ses 4 chambres dont ..."
256PZEVP86Q4,2025-06-22T04:01:00Z,CAYENNE,,97300,BUY,APARTMENT,205000,91.0,4,2,"Non loin du Jardin Botanique, à proximité immédiate du futur Hôtel de Police. Au 1er étage d'une résidence qui fait peau neuve, (travaux entièrement financés) cet appartement lumineux offre une belle..."
25YK62XTSETD,2025-03-21T10:48:00Z,Remire-Montjoly,,97354,BUY,APARTMENT,113400,31.11,2,1,"Appartement à vendre de 31,11 m² situé à Remire-Montjoly comprenant une pièce de vie avec coin cuisine, une chambre, une salle d'eau avec WC attenant . Avec un prix attractif de 113 400 EUR, c'est un..."
25IGMWDI5CEM,2025-09-29T20:03:00Z,Cayenne,,97300,BUY,HOUSE,454500,141.0,5,4,"Située à Cayenne (97300), cette maison bénéficie d'un emplacement privilégié sur la Route de Montabo, emplacement recherché de la ville. Implantée sur un terrain spacieux et clôturé de 1767 m², elle ..."
25XDBYRE5KTK,2025-08-25T19:43:00Z,Saint-Laurent-du-Maroni,,97320,BUY,HOUSE,380000,187.0,6,4,"Venez découvrir cet ensemble immobilier proche de toutes commodités sur une parcelle d'environ 403 m². Il se compose de 2 maisons de type 3 en duplex jumelées avec chacune un abri de voiture, un vast..."
253DVL2CL146,2025-02-20T17:34:00Z,MATOURY,,97351,BUY,HOUSE,399000,150.0,5,4,"Belle villa individuelle de plain-pied de type F5 avec piscine, offrant un spacieux séjour double lumineux, 4 chambres dont une suite parentale avec salle d'eau attenante, une salle d'eau avec WC, un..."
25NN71WWDJE9,2025-10-14T16:59:00Z,Sinnamary,,97315,BUY,APARTMENT,125280,58.0,3,2,"Duplex à vendre, idéalement situé en centre-ville de Sinnamary, proche d'une école. D'une surface de 58 m², cet appartement de 2008 offre 2 chambres, un séjour lumineux, balcon et terrasse pour profi..."
25DA456IDCQF,2025-03-18T02:29:00Z,Saint-Laurent-du-Maroni,,97320,BUY,HOUSE,330000,80.0,4,3,"À vendre : Charmante maison T4 sur 1631 m² de terrain Située dans un quartier paisible et recherché, cette magnifique maison de type T4 offre une opportunité rare sur le marché. Édifiée sur un terrai..."
25IL53R1IPGD,2025-10-29T21:38:00Z,Kourou,,97310,BUY,APARTMENT,113400,73.0,3,2,"Découvrez ce T3 avec ORPI, de 73 m² avec balcon, en bon état, situé à Kourou. Il se compose de deux chambres et d'un séjour lumineux, parfait pour un futur investissement. Emplacement pratique : à pr..."
258WIFT717WE,2025-06-27T19:43:00Z,Cayenne,,97300,BUY,APARTMENT,113400,35.03,2,1,"Dans un ensemble immobilier en copropriété, cet appartement T2 d'un bâtiment en R+1 + loggia comprend une pièce principale, une cuisine américaine, une chambre avec salle d'eau, WC, le tout à proximi..."
25CRQYSC7LSB,2025-03-21T17:31:00Z,Macouria,,97355,BUY,HOUSE,199500,85.1,4,3,"Situé dans un quartier en plein développement, venez découvrir cette superbe maison en duplex, mitoyenne de construction récente, on y trouvera au Rez-de-chaussée : -un séjour donnant sur une varangu..."
25165LGX9JMH,2025-08-04T23:41:00Z,Matoury,,97351,BUY,HOUSE,434000,140.38,5,3,Découvrez cette maison idéale située à Matoury. en Guyane française. Avec ses 3 chambres et 5 pièces au total. elle offre un espace de vie confortable pour toute la famille. Nichée dans un environnem...
2598TKYUFELY,2025-08-19T14:03:00Z,Remire-Montjoly,,97354,BUY,HOUSE,328600,82.03,4,3,"SPÉCIAL INVESTISSEUR !! Découvrez cette superbe villa à vendre sur les hauteurs du Mont-Saint-Martin à Remire-Montjoly. De construction récente, elle offre un cadre de vie exceptionnel avec ses trois..."
25FFPXJK22GU,2025-03-14T19:27:00Z,Remire-Montjoly,,97354,BUY,APARTMENT,156000,39.68,2,1,"Découvrez cet appartement à vendre à Remire-Montjoly. Construit en 2016, il dispose d'une pièce de vie avec un coin cuisine, une chambre climatisée avec placard intégrés et une salle d'eau spacieuse ..."
25SX9X98MZST,2025-06-23T19:00:00Z,Kourou,,97310,BUY,HOUSE,162000,94.0,4,3,"Kourou, ORPI à le plaisir de vous proposer à la vente cette maison mitoyenne T4 de plain-pied sur 94² habitables sur un terrain de 157 m², située à proximité de la mer. Cette maison mitoyenne des deu..."
243HWYUE5WE6,2024-09-16T08:32:00Z,Cayenne,,97300,BUY,HOUSE,367500,160.0,6,4,"Magnifique villa de 180 m² située dans un quartier résidentiel calme et sécurisé. Offrant un cadre de vie exceptionnel, cette propriété sur 1250 m² se distingue par ses vastes espaces intérieurs et e..."
25PTGZ8MK1ED,2025-06-11T15:18:00Z,Cayenne,,97300,BUY,APARTMENT,178200,56.9,3,2,"Découvrez cet appartement T3 moderne à vendre, situé dans un quartier prisé de Cayenne. En bon état, offre deux chambres confortables, un salon accueillant, et une cuisine fonctionnelle. Profitez d'u..."
25IJIPMQKRAN,2025-10-16T13:53:00Z,Sinnamary,,97315,BUY,APARTMENT,50600,23.5,1,,"Studio à vendre, idéal investisseur ou premier achat, situé en centre-ville de Sinnamary, proche d'une école. Ce logement de 23 m², construit en 2008, offre un balcon agréable et une place de parking..."
25GRYMAIWZ76,2025-10-16T13:53:00Z,Sinnamary,,97315,BUY,APARTMENT,88000,39.5,2,1,"Découvrez ce charmant duplex de 39,5 m², idéalement situé en plein centre-ville de Sinnamary, à proximité immédiate des commerces, écoles et commodités. Construit en 2008, cet appartement fonctionnel..."
25MG4Y12Y7NH,2025-06-18T15:49:00Z,Sinnamary,,97315,BUY,APARTMENT,127440,62.13,3,2,"Venez découvrir ce spacieux appartement situé sur Sinnamary. Il est composé : d'un séjour avec cuisine ouverte, de deux chambres, d'une salle d'eau, d'un WC et d'un grand balcon. Référence agence : 3..."
25XLA3UV15IN,2025-11-22T11:40:00Z,Cayenne,,97300,BUY,APARTMENT,215000,70.0,3,2,Plutôt balade sur la plage ou balade en forêt ? Les deux s'offrent à vous en moins de 10 minutes à pied avec cet appartement trois pièces de 71 m² situé dans une paisible résidence accolée au sentier...
25JY5FJ1KYZC,2025-10-07T23:58:00Z,Remire-Montjoly,,97354,BUY,HOUSE,320000,85.0,4,3,"À Rémire-Montjoly, dans le quartier calme et résidentiel du Clos d'Arletty, découvrez cette agréable maison R+1 de type T4 offrant un cadre de vie idéal pour une famille ou un projet d'investissement..."
25TDU1DDUKD5,2025-06-21T12:24:00Z,Kourou,,97310,BUY,APARTMENT,135000,64.0,2,1,"Situé au 3 -ème et dernier étage d'une résidence , cet appartement T2 spacieux et lumineux séduit par son agencement fonctionnel . Grande pièce de vie baignée de lumière et traversante . Cuisine indé..."
25YF7N5BAL8G,2025-03-13T13:28:00Z,Kourou,,97310,BUY,HOUSE,350000,115.0,3,2,"Amoureux de nature et d'espace, découvrez cette superbe propriété nichée au cœur d'un terrain de 2 hectares, offrant calme et sérénité à Kourou. La maison en bois sur pilotis d'environ 115 m², séduit..."
25WMXYJ5RNAK,2025-09-30T23:51:00Z,Remire-Montjoly,,97354,BUY,HOUSE,595000,160.0,5,4,"Splendide Villa d'architecte à vendre à Remire-Montjoly, en Guyane française. Cette propriété d'une surface habitable de 160 m² est nichée sur un vaste terrain de 1976 m², offrant un cadre de vie pai..."
257Y8HMI9DG6,2025-10-10T14:42:00Z,Cayenne,,97300,BUY,APARTMENT,118800,35.82,2,1,"Découvrez cet appartement moderne en excellent état, idéalement situé à Cayenne. Vous serez séduit par son salon lumineux, sa chambre confortable avec placard intégré, ainsi que sa salle d'eau contem..."
25E96T3PLLTJ,2025-10-09T19:53:00Z,Macouria,,97355,BUY,HOUSE,235400,95.0,5,4,"Construite en 1990, cette villa allie confort et convivialité. Son jardin verdoyant offre un véritable espace de jeux et de détente pour toute la famille, tandis que la terrasse invite à partager de ..."
251HN8UCGS9D,2025-08-25T22:41:00Z,Cayenne,,97300,BUY,APARTMENT,189000,71.8,3,2,"Venez découvrir en exclusivité, ce T3 situé à Cayenne au 2ème étage d'une résidence sécurisée avec piscine, il se compose comme suit : Un séjour, une cuisine équipée, une salle d'eau, un WC indépenda..."
24SZNBLEWXLZ,2024-10-16T16:26:00Z,Cayenne,,97300,BUY,APARTMENT,206500,94.63,4,3,"Venez découvrir ce loft de 94,63 m² à vendre à Cayenne dans le secteur de Eau Lisette. Construit en 1990, il est en bon état et offre un cadre de vie agréable avec une grande terrasse composée d'une ..."
25CAS8698AEU,2025-10-03T19:27:00Z,Cayenne,,97300,BUY,APARTMENT,145800,44.74,2,1,"Bel appartement 2 pièces de 44,74 m², idéalement situé à Cayenne, disponible immédiatement. Situé au rez-de-chaussée d'une résidence récente (2015) en zone aménagée Hibiscus, ce logement refait à neu..."
25NHT1QAQYIZ,2025-10-30T14:13:00Z,Cayenne,,97300,BUY,APARTMENT,175000,76.0,3,2,"Situé sur le chemin Saint-Antoine, dans la résidence calme et sécurisée Le Clos d'Angèle, cet agréable appartement T3 au 1er étage offre un cadre de vie paisible, idéalement placé à proximité du cent..."
25J4SMMHKNLM,2025-08-11T17:54:00Z,Cayenne,,97300,BUY,HOUSE,255000,78.0,4,3,"Cette maison située secteur de montabo à Cayenne (97300) offre un cadre de vie idéal, alliant charme et tranquillité . Proche des commerces et bénéficiant d'un environnement calme, elle promet un quo..."
25KJNZSBX55S,2025-07-05T19:24:00Z,Matoury,,97351,BUY,HOUSE,275000,65.0,5,4,MATOURY (97351) – MAISON INDIVIDUELLE RÉNOVÉE – 5 PIÈCES – ENV. 65 M² – TERRAIN 541 M² – TERRASSE 89 M² – ABRI VOITURE – JARDIN CLÔTURÉ – PORTAIL ÉLECTRIQUE – CLIMATISATION – VOLETS ROULANTS – PLAIN-...
25IXSHRTRGWY,2025-10-08T15:00:00Z,Macouria,,97355,BUY,HOUSE,189000,85.1,4,3,"Venez découvrir en exclusivité à Soula cette jolie Villa T4 duplex clôturée comprenant : Un grand séjour, une cuisine aménagée, une buanderie, deux salles d'eau, trois WC, trois chambres dont deux av..."
25QZ8ITMNVEG,2025-05-09T22:45:00Z,Remire-Montjoly,,97354,BUY,HOUSE,484200,133.0,4,3,"Découvrez cette magnifique maison individuelle à vendre, située dans un quartier prisé de Remire-Montjoly. Construite en 2010, cette propriété de 133 m² offre un cadre de vie exceptionnel. En excelle..."
25WUI5S4MSXE,2025-08-07T15:57:00Z,Remire-Montjoly,,97354,BUY,APARTMENT,189000,62.08,3,2,Spécial investisseur ! Venez découvrir en exclusivité ce charmant T3 situé au 1er et dernier étage dans une résidence calme sur la commune de REMIRE MONTJOLY. Vous pourrez profiter de sa terrasse ven...
254TQ9PTGY16,2025-10-17T17:11:00Z,Remire-Montjoly,,97354,BUY,APARTMENT,145800,56.63,2,1,"Venez découvrir en exclusivité ce charmant T2. Idéalement situé sur le secteur de Suzini et proche de toutes les commodités, il se compose d'une grande pièce à vivre, d'une chambre climatisée avec pl..."
25AQNAMLDF1X,2025-10-03T15:42:00Z,Cayenne,,97300,BUY,APARTMENT,140400,45.85,2,1,"Venez découvrir en exclusivité ce charmant T2 situé à la la Zac Hibiscus. Au premier étage d'une résidence sécurisée avec régisseur, cet appartement se compose d'une pièce à vivre très lumineuse, une..."
25AN33AFXVP7,2025-08-09T15:06:00Z,Matoury,,97351,BUY,HOUSE,249000,90.0,3,2,"Découvrez cette maison contemporaine, construite en 2020, offrant un espace de vie agréable et lumineux. Profitez de la quiétude environnante tout en restant à proximité des commodités urbaines. Cett..."
25RUP49YNYH8,2025-06-23T23:13:00Z,Cayenne,,97300,BUY,APARTMENT,220400,90.5,4,3,"Construit en 2016, ce bien s'étend sur 90,5 m² et comprend trois chambres spacieuses et un salon lumineux. Profitez des espaces extérieurs avec un jardin privé, une terrasse parfaite pour vos moments..."
25S5T4KHHDKV,2025-10-03T05:53:00Z,Cayenne,,97300,BUY,APARTMENT,94080,35.0,1,,"Situé au cœur de Cayenne (97300), cet appartement d'une pièce offre un cadre de vie idéal dans un quartier agréable et calme. Proche des commodités telles que les bus, les écoles, le lycée et les crè..."
259DKQRHBCPG,2025-07-11T12:52:00Z,Macouria,,97355,BUY,HOUSE,215000,122.0,5,4,"Cette maison T5 mitoyenne offre un cadre de vie paisible tout en étant à proximité des commodités essentielles. La localité regorge de verdure et bénéficie d'un environnement calme, idéal pour les fa..."
257WRWXZ1BHH,2025-04-15T14:36:00Z,Cayenne,,97300,BUY,APARTMENT,143000,56.04,2,1,"Découvrez cet appartement spacieux à vendre à Cayenne. Construit en 2012, cet espace de 56 m² en bon état général offre une chambre spacieuse, un salon lumineux et une terrasse. À proximité du centre..."
