id,creationDate,city,district,zipCode,distributionType,propertyType,price,surface,nbroom,nbbedroom,description
25QDEL2T56K9,2025-06-24T22:34:00Z,Mayenne,,53100,BUY,HOUSE,149600,89.0,5,3,"Maison de plain pied avec terrain clos. Située à Mayenne côté Est, nous vous proposons à la vente une maison de plain pied à rafraichir. Cette maison vous offre une entrée, une cuisine aménagée et éq..."
25W6LLI54J2J,2025-02-14T13:18:00Z,Mayenne,,53100,BUY,HOUSE,267900,139.0,7,4,"Centre ville de Mayenne À proximité des commerces et des écoles, nous vous proposons à la vente une belle maison de T7 de 138.56 m² habitables avec une véranda et une terrasse sur un terrain de 480 m..."
25UVCE92XR6L,2025-07-18T21:36:00Z,Mayenne,,53100,BUY,HOUSE,180800,99.0,4,3,"Maison de plain pied avec garage 2 voitures. Située dans une impasse au calme à 5 minutes de Mayenne, dans un village avec école et commerce, nous vous proposons à la vente une maison de plain pied o..."
251G8PJ47HGU,2025-11-21T10:32:00Z,Mayenne,Sud Est,53100,BUY,HOUSE,178000,80.0,5,3,"En Exclusivité, Sandra Bouglé vous présente une maison sur sous sol, à Mayenne dans un quartier paisible. Cette maison de 80 m2 sur un terrain de 458 m2 se compose d'une entrée, salon séjour avec une..."
25DNIQVZG8GS,2025-10-06T14:35:00Z,Mayenne,Sud Ouest,53100,BUY,HOUSE,124500,73.0,5,2,"À vendre, maison individuelle située dans un quartier calme de Mayenne, à proximité immédiate du centre commercial Leclerc, des écoles et du centre-ville. L'emplacement est idéal pour profiter du cal..."
25Q9NNIAQBJJ,2025-11-24T21:08:00Z,Mayenne,Saint Martin,53100,BUY,HOUSE,265000,150.0,6,4,"Exceptionnel ! En exclusivité ! Ce pavillon en plain pied d'année de construction 2000 avec piscine sécurisée par un Dôme coulissant, sur un terrain de 1200 m2 avec vue sur la campagne. Vous accédere..."
252Y4T5KISN8,2025-11-24T21:08:00Z,Mayenne,Nord Ouest,53100,BUY,HOUSE,259000,110.0,5,4,"Découvrez cette charmante villa de 2003, idéalement implantée dans un quartier résidentiel très prisé, offrant calme, confort et intimité. Edifiée sur un terrain d'environ 1200 m2, cette maison se co..."
25RDNMZ5F5K5,2025-11-20T12:09:00Z,Mayenne,Sud Ouest,53100,BUY,HOUSE,126800,73.0,5,3,"Je vous présente cette maison des années 70 située à proximité immédiate des commerces. Cette maison sur sous-sol comprend au RDC : entrée, cuisine ouverte sur salon/SAM. Cette grande pièce de vie lu..."
25APVYT2PLZD,2025-11-26T12:27:00Z,Mayenne,Sud Ouest,53100,BUY,HOUSE,125500,102.0,5,3,"Une tres belle surface habitable sur une belle surface de terrain. Une renovation est à prevoir (isolation, electricité, pose cuisine, sol..) mais un potentiel interessant ! Chauffage gaz de ville, c..."
259ML6RHYIBT,2025-05-15T23:39:00Z,Mayenne,,53100,BUY,HOUSE,455000,170.0,8,4,"Réf.4585 : Beau Manoir du XIVème siècle et ses dépendances Ce ravissant manoir situé à 270 km de Paris, se cache dans une belle campagne bocagère et vallonnée, à 5 km d'une petite ville offrant les p..."
25ITU5XR55DA,2025-10-29T18:55:00Z,Mayenne,Sud Ouest,53100,BUY,HOUSE,89900,99.0,5,4,"Je vous propose en exclusivité une maison d'environ 99m2 située dans un quartier recherché proche commerces, commodités et Pôle Santé. Au RDC, vous trouverez un salon/SAM, une cuisine aménagée et équ..."
25T5J8K6BJBE,2025-11-27T10:07:00Z,Mayenne,Notre-Dame,53100,BUY,HOUSE,419900,257.0,9,5,"Pour toute question ou demande d'information, pensez à noter et nous communiquer le numéro de référence lors de votre appel : 19188 Cette maison individuelle offre une vue imprenable sur son jardin a..."
25VYEQTIU5N6,2025-11-30T20:42:00Z,Mayenne,Bras-Bretagne-Brosselette-Mauhitière,53100,BUY,HOUSE,138000,91.0,5,3,"Pavillon lumineux de 92 m² situé à Mayenne, dans un quartier calme et recherché, à proximité immédiate des écoles et des commerces. Édifiée en 1977 sur un terrain clos et arboré de 450 m², cette mais..."
25FVQXMEUX2Y,2025-11-25T13:24:00Z,Mayenne,Nord Ouest,53100,BUY,HOUSE,149700,91.0,4,3,"Maison 4 pièces 91 m2 Maison 4 pièces 91 m2 À MAYENNE (53100), je vous invite à venir découvrir cette belle maison à fort potentiel et située à proximité des commerces et des écoles. Au rez-de-chauss..."
25PYJ66FUNLF,2025-11-12T13:55:00Z,Mayenne,Notre-Dame,53100,BUY,HOUSE,269500,160.0,8,5,"Rare sur le secteur ! Située en plein cœur de Mayenne, dans un quartier prisé, cette maison de caractère offre 160 m² habitables sur un terrain clos et paysagé de 819 m², exposé sud-est. Édifiée sur ..."
257AIEYYX7ZM,2025-03-07T20:11:00Z,Mayenne,Sud Ouest,53100,BUY,HOUSE,468000,160.0,6,3,"Située à Mayenne (53100), cette maison moderne se trouve dans une zone artisanale dynamique, offrant un équilibre entre tranquillité et accessibilité. À proximité des commerces et des services essent..."
25GKRZ9ECNGU,2025-06-29T12:53:00Z,Mayenne,Notre-Dame,53100,BUY,HOUSE,147000,105.0,7,4,"Amateurs de biens anciens pleins de caractère, cette maison est faite pour vous ! Située en plein cœur de la ville de Mayenne, à deux pas des commerces, des écoles, des services et de toutes les comm..."
25BF8FGTN1V6,2025-07-25T01:21:00Z,Mayenne,,53100,BUY,HOUSE,795000,480.0,16,7,"Réf.4668 : Château de villégiature et sa maison de gardien sur 5,2 ha à vendre en Mayenne Situé à proximité de la ville de Mayenne, proche de la rivière et dans le département éponymes, se dresse ce ..."
25A1Z76U6114,2025-07-05T13:12:00Z,Mayenne,Notre-Dame,53100,BUY,APARTMENT,84500,70.0,3,2,"iad France - Audrey Mainfray vous propose: ** APPARTEMENT T3 DE 70m² environ ** CENTRE VILLE DE MAYENNE ** 1ER ETAGE ** Situé au premier étage d'une petite copropriété, cet appartement d'environ 70 m..."
24241RZX1ZIG,2024-10-15T19:09:00Z,Mayenne,,53100,BUY,HOUSE,24699,120.0,4,2,Offrez-vous une maison de 120 m² pour seulement 24 699 EUR !! Référence 422453015 Age : Homme de 73 ans / Femme de 79 ans Bouquet : 24699 EUR Rente : 400 EUR/mois Prix d'achat : 79065 EUR Nous vous r...
25ISQ8Y7U47L,2025-05-21T12:39:00Z,Mayenne,Nord Est,53100,BUY,HOUSE,264500,136.0,5,3,"Maison 5 pièces 136 m2 avec piscine. Située dans un cadre tranquille à MAYENNE (53100), cette jolie maison contemporaine avec dépendances et terrain d'environ 1200 m2 offre un espace de vie confortab..."
25AUJE72RHDL,2025-11-04T10:31:00Z,Mayenne,Nord Est,53100,BUY,HOUSE,189900,191.0,9,5,"Grande maison familiale de 191 m² avec garage Sortie de Mayenne (53100) À la sortie de Mayenne, dans un environnement calme et recherché, découvrez cette belle maison familiale de 190 m² qui allie es..."
25BNVN414KHH,2025-10-03T21:07:00Z,Mayenne,,53100,BUY,HOUSE,166300,212.0,7,5,"À seulement 2 minutes de Mayenne ! cette spacieuse maison de ville de 212 m² vous séduira par ses volumes généreux et son cadre agréable. Dès l'entrée, vous découvrirez une vaste pièce de vie, compos..."
252MADJG3EVT,2025-10-02T19:33:00Z,Mayenne,Nord Est,53100,BUY,HOUSE,99500,83.0,5,2,"Idéalement située à Mayenne, dans un secteur calme et recherché, cette maison mitoyenne de 83 m² avec son terrain de 400 m² offre un cadre de vie agréable et pratique. À proximité immédiate d'une éco..."
25IRYTFVL7A4,2025-10-17T09:31:00Z,Mayenne,Notre-Dame,53100,BUY,APARTMENT,243900,179.0,5,7,"L'ADRESSE Immobilier MAYENNE vous propose deux appartements dans le centre-ville. Rare à la vente.. Au dernier étage avec ascenseur, un premier appartement de plain-pied 125 m² habitables avec une ex..."
255Q9FL4Q9HY,2025-10-15T14:01:00Z,Mayenne,Saint Martin,53100,BUY,APARTMENT,89900,48.0,3,2,"Votre agence immobilière L'Adresse est heureuse de vous présenter cet appartement traversant situé au 3ème étage d'une résidence en bordure de Mayenne avec vue sur le Château, à proximité immédiate d..."
25UV59756Y3W,2025-05-12T16:06:00Z,Mayenne,Sud Ouest,53100,BUY,HOUSE,288900,326.0,8,5,"Amoureux de l'ancien, des grands volumes, de la hauteur sous plafond et du parquet.. cette maison de ville proche de toutes les commodités est faite pour vous ! Elle se compose d'une entrée, une tres..."
25PWQFQSEPDV,2025-09-02T09:32:00Z,Mayenne,Bras-Bretagne-Brosselette-Mauhitière,53100,BUY,HOUSE,316900,118.0,5,4,"Une pépite !! Un vrai coup de coeur pour cette maison en plein coeur de ville. Elle se compose d'une entrée, d'une piece de vie avec espace cuisine donnant sur l'extérieur, un salon fermé, wc. a l'et..."
25ZYRX7DETEX,2025-03-31T09:16:00Z,Mayenne,Saint Martin,53100,BUY,HOUSE,263500,134.0,7,1,"Maison 7 pièces 138 m2 À MAYENNE (53100) venez découvrir cette belle maison sur grand sous-sol, lumineuse et fonctionnelle elle se situe sur un emplacement privilégié rare sur le marché. _ À proximit..."
25N2VINTQMWU,2025-10-21T19:44:00Z,Mayenne,Notre-Dame,53100,BUY,HOUSE,157500,105.0,6,4,"Si vous recherchez une maison avec du parquet, des poutres, cheminée, tomettes,cette maison est faite pour vous !! Vous découvrirez une belle entrée sur tomettes, une salle à manger, un très beau sal..."
25QBNYQ2659U,2025-09-29T18:09:00Z,Mayenne,Nord Est,53100,BUY,HOUSE,259000,96.0,5,2,iad France - Samuel Coulon vous propose: - EXCLUSIF et PARTAGE -- PAVILLON RECENT ET DE PLAIN-PIED -- SANS TRAVAUX -- AU CALME -- EXTERIEUR MAGNIFIQUE AVEC PISCINE ET TERRASSE COMPOSITE - En Lotissem...
25HUDUDCK32J,2025-09-23T05:31:00Z,Mayenne,Notre-Dame,53100,BUY,HOUSE,299900,276.0,7,5,"Votre agence de proximité L'Adresse vous propose en exclusivité cette grande maison de caractère située au coeur de Mayenne, à proximité du centre-ville et de toutes les commodités. Au rez-de-chaussé..."
25X8LIXXKYYQ,2025-11-21T06:45:00Z,Mayenne,Nord Ouest,53100,BUY,HOUSE,125000,76.0,4,2,"MAYENNE, dans un environnement calme au sein d'une résidence, pavillon de plain pied offrant un séjour/salon, deux chambres dont une avec placard, une cuisine, un débarras et une salle d'eau équipée ..."
25YP14JTDGTH,2025-11-11T23:33:00Z,Mayenne,,53100,BUY,HOUSE,280800,300.0,17,16,TDM53 vous présente sur la commune de Oisseau (10' de Mayenne) cet ensemble immobilier comprenant: - Une maison d'habitation (toiture ardoises neuves) de 135 m2 composée en rez de chaussée d'un séjou...
25RS27ANGZD3,2025-11-13T10:34:00Z,Mayenne,,53100,BUY,HOUSE,260000,142.0,10,4,"Surplombant la rivière Mayenne, bâtie sur un rocher schisteux, à deux pas de l'église et au confin du village, emblématique maison d'artiste restaurée. Beaux éléments, architecture unique. La maison ..."
25JZ5TSVHNHZ,2025-11-19T15:31:00Z,Mayenne,Nord Ouest,53100,BUY,HOUSE,228120,150.0,7,5,"PARIGNE SUR BRAYE - Pavillon d'environ 150m² offrant: Au rez de chaussée une entrée, un salon séjour avec cheminée ouverte, une cuisine avec insert fonte avec accès sur terrasse. Un couloir dessert d..."
25DBXLIZ2AMH,2025-07-01T00:38:00Z,Mayenne,,53100,BUY,HOUSE,495000,300.0,11,7,"Ref.4608 : Demeure de caractère à vendre à Mayenne. C'est au cœur de la cité historique de Mayenne, dans la province historique du Maine, que ce situe cet hôtel particulier édifié en 1882. En retrait..."
25CACSMIZCJA,2025-09-29T18:28:00Z,Mayenne,Sud Ouest,53100,BUY,HOUSE,395900,191.0,8,4,"Très grande maison familiale de 191 m² en impasse, Une vraie pépite !! Située dans un environnement calme, cette maison récente construite en 2014 et couverte en ardoise offre de beaux volumes et des..."
25WQ9KTL55I8,2025-09-18T13:05:00Z,Mayenne,Notre-Dame,53100,BUY,APARTMENT,129990,75.0,4,3,"MAYENNE Centre-ville, Dans une copropriété avec ascenseur, bel appartement lumineux comprenant une spacieuse pièce de vie avec cuisine aménagée, trois chambres, une salle d'eau, cave et garage. Idéal..."
25CWN2CUGLJ8,2025-02-23T13:41:00Z,Mayenne,Notre-Dame,53100,BUY,HOUSE,221000,185.0,6,5,"Maison 6 pièces 185 m² Maison 6 pièces 185 m² À CHÂTILLON-SUR-COLMONT à 10 km de MAYENNE, découvrez cette très belle maison en pierres apparentes entièrement rénovée. Cette maison spacieuse, lumineus..."
256JX1VPY38S,2025-09-25T15:48:00Z,Mayenne,Saint Martin,53100,BUY,APARTMENT,74900,44.56,2,1,A vendre sur le boulevard paul lintier un appartement de 44.56m2 avec une cave et un garage. actuellement loué 390 euros de loyer et 30 euros de charges soit 420 euros par mois taxe foncière : 565 eu...
25NQGM319HDP,2025-09-05T13:04:00Z,Mayenne,Sud Ouest,53100,BUY,HOUSE,127800,73.0,5,2,"MAYENNE, entre le POLE SANTE et LECLERC, pavillon sur sous-sol comprenant une cuisine ouverte sur le séjour/salon avec cheminée, 3 chambres et un bureau, salle d'eau et salle de bains, le tout sur 57..."
25SSTLLBTPII,2025-09-13T08:03:00Z,Mayenne,Bras-Bretagne-Brosselette-Mauhitière,53100,BUY,HOUSE,159900,85.0,5,3,"Votre agence immobilière l'ADRESSE vous invite à venir découvrir sans tarder, cette charmante maison d'habitation des années 70 situé à MAYENNE en lotissement. Dès l'entrée, le rez-de-chaussée offre ..."
25VXQ527MX6V,2025-11-12T18:37:00Z,Mayenne,Nord Ouest,53100,BUY,HOUSE,154960,107.0,4,3,"Mayenne, dans une résidence, nous vous proposons à la vente cette maison de 107 m² vous offrant de plain pied, une cuisine aménagée et équipée, un salon séjour, trois chambres, une salle de bains. Vo..."
2541XD8PYLXX,2025-11-07T18:55:00Z,Mayenne,Sud Est,53100,BUY,HOUSE,220000,91.0,4,3,"Située à Mayenne (53100), cette belle maison de plain-pied offre un cadre de vie paisible, à deux pas des commerces et des services. Édifiée sur un terrain de 616 m², elle séduit dès l'extérieur par ..."
25EJM3E52TMH,2025-10-31T09:19:00Z,Mayenne,Notre-Dame,53100,BUY,HOUSE,136900,126.0,4,3,"A 10 kms de Mayenne, sur la commune de Champéon. Cette maison en pierres vous offre une grande pièce de vie de 62 m² avec une cheminée à foyer ouvert ainsi qu'une cuisine. A l'étage, un palier desser..."
25ZHC3VIP2M8,2025-09-22T15:15:00Z,Mayenne,Sud Ouest,53100,BUY,HOUSE,157500,81.0,3,2,"Vous pourrez rénover à votre goût se pavillon sur sous sol comprenant une entrée, une cuisine, une piece de vie, deux chambres, une salle de bain, wc. Un sous sol sur toute la surface Terrain Chauffa..."
252Z811EZA7P,2025-11-04T06:50:00Z,Mayenne,Nord Est,53100,BUY,HOUSE,162000,93.0,5,3,"Située dans la ville de Mayenne (53100), cette charmante maison ancienne entièrement rénovée bénéficie d'un emplacement paisible offrant une vue sur la campagne environnante. Dotée d'un terrain de 38..."
2545498VCNLP,2025-03-27T13:39:00Z,Mayenne,Sud Ouest,53100,BUY,HOUSE,478000,240.0,10,5,À VENDRE – Propriété de Prestige de 240 m² avec jardin Paysager de 3 200 m² – Habitable de Suite – Mayenne (53) Un véritable bijou au cœur d'un environnement privilégié ! Découvrez cette somptueuse d...
25BT6JAYKXTB,2025-08-11T12:39:00Z,Mayenne,,53100,BUY,HOUSE,164000,118.0,5,3,"TDM53 vous propose à la vente ce pavillon de 118 m2 sur la commune Saint Georges Buttavent (à 5' de Mayenne). Afin de profiter de l'été, vous aurez 2500 m2 de terrain arboré, un bassin de jardin, une..."
25ZNZ91DU6UR,2025-02-17T19:05:00Z,Mayenne,Sud Ouest,53100,BUY,HOUSE,290000,326.0,12,6,"TDM53 vous présente cette magnifique maison en pierres de 257 m2 avec son parc au coeur du centre ville de Mayenne. Une seconde maison indépendante à restaurer de 69 m2, avec une cuisine, un séjour, ..."
25TFJ5LLA6N4,2025-06-30T09:15:00Z,Mayenne,Sud Est,53100,BUY,HOUSE,126000,95.0,4,3,"- Spécial investisseur- TDM53 vous présente sur Mayenne ville cette maison en pierres actuellement louée 610 euros/mois. Elle se compose d'un appartement de 95 m2 avec une entrée, une premiere pièce ..."
25F4WJVPGEMT,2025-10-31T09:39:00Z,Mayenne,,53100,BUY,HOUSE,261850,180.0,6,4,"À 15 kms de Mayenne et 7 kms de Lassay les châteaux, nous vous proposons à la vente cette longère en pierres sans voisins. Elle vous offre sur 180 m² habitables une pièce de vie avec cuisine aménagée..."
251CVFIPDVZI,2025-07-31T04:52:00Z,Mayenne,Saint Martin,53100,BUY,PROJECT,247900,,6,4,"A MAYENNE sur un terrain de 286 m², BATI ALLIANCE vous propose de réaliser cette maison neuve, d'une surface de 127 m² habitables comprenant 4 chambres.* Caractéristiques du modèle :- Maison à étage ..."
25ZZ94R27X1K,2025-07-14T08:35:00Z,Mayenne,Notre-Dame,53100,BUY,HOUSE,199800,155.0,8,5,"TDM53 vous propose à la vente, sur Mayenne ville, cette charmante maison d'une surface de 155 m2. Elle se compose en rez de chaussée d'une entrée, d'une cuisine équipée, d'un salon avec insert bois, ..."
258ZJNDZG613,2025-10-31T10:01:00Z,Mayenne,Bras-Bretagne-Brosselette-Mauhitière,53100,BUY,HOUSE,187600,160.0,6,4,"En exclusivité, rare à la vente, maison en centre-ville en pierres avec dépendances, d'environ 130 m² habitables offrant : entrée, cuisine aménagée et équipée donnant sur véranda, salon/séjour de 45 ..."
25HHTGQ7PBJ7,2025-06-06T13:46:00Z,Mayenne,Notre-Dame,53100,BUY,HOUSE,212000,130.0,7,3,"TDM53 vous présente, au coeur du centre ville de Mayenne, cette maison en pierres de 130 m2 et recouvertes en ardoises comprenant: En rez de chaussée, un séjour, une cuisine, un salon, une arriere cu..."
25EILZJ8WSRS,2025-10-24T10:02:00Z,Mayenne,,53100,BUY,HOUSE,305750,153.0,7,5,"Situé à 6 kms de Mayenne, beau pavillon d'architecte construit en 1998. Ce bien de 153 m² vous offre au rez-de-chaussée : hall d'entrée avec placards, salon, salle à manger, cuisine aménagée et équip..."
25C1X7EZL8MS,2025-10-23T14:09:00Z,Mayenne,,53100,BUY,HOUSE,312000,180.0,9,6,"TDM53 vous propose cette magnifique maison en pierres sur la commune de Oisseau (à 5' de Mayenne), proche des commerces de proximité. Construction et rénovation avec des matériaux de qualités. Elle v..."
25JGMQNX7M89,2025-11-17T10:50:00Z,Mayenne,Saint Martin,53100,BUY,APARTMENT,63900,32.0,1,,"En exclusivité, MAYENNE, en centre ville, nous vous proposons à la vente ce studio meublé actuellement loué dans une résidence sécurisée. Ce studio vous offre une pièce de vie lumineuse, une cuisine ..."
25WNTUHXI8TQ,2025-06-18T17:49:00Z,Mayenne,Sud Ouest,53100,BUY,HOUSE,124950,76.0,6,2,"TDM53 vous présente, proche des commerces et centre ville de Mayenne, ce pavillon sur sous sol avec un bel espace de terrain clos de 570 m2. Après quelques marches, Il se compose d'une entrée, d'une ..."
247LA1EKNUHX,2024-12-20T13:20:00Z,Mayenne,,53100,BUY,HOUSE,168000,118.0,5,3,"Maison avec un beau jardin, sa tonnelle et son bassin. Proche Mayenne, nous vous proposons à la vente une maison de plain pied entièrement restaurée et décorée avec goût. Vous serz charmés par la lum..."
25XKEUYITFLP,2025-10-31T09:39:00Z,Mayenne,,53100,BUY,HOUSE,280750,143.0,6,4,"MAYENNE + 3 kms - Nous vous proposons à la vente ce beau pavillon de plus de 150 m² offrant de plain-pied une pièce de vie avec cuisine aménagée et équipée très lumineuse de plus de 67 m². Un bureau,..."
25QV5RV9TX8T,2025-10-31T09:45:00Z,Mayenne,Bras-Bretagne-Brosselette-Mauhitière,53100,BUY,HOUSE,320650,118.0,5,4,"Centre-ville de MAYENNE, venez découvrir cette maison de ville avec beaucoup de charme et ouverte sur les extérieurs. Vous offrant une pièce de vie avec une cuisine aménagée et équipée avec accès dir..."
25B1EJYP6E2E,2025-10-31T09:43:00Z,Mayenne,,53100,BUY,HOUSE,168400,105.0,4,3,"A 8 kilomètres de Mayenne, venez découvrir cette maison rénovée en pierres. Elle vous offre au rez-de-chaussée : une pièce de vie avec cuisine aménagée et équipée, une salle d'eau, un wc et un cellie..."
25S527M4XWKJ,2025-10-31T10:03:00Z,Mayenne,Bras-Bretagne-Brosselette-Mauhitière,53100,BUY,APARTMENT,115900,47.0,2,1,"En exclusivité, MAYENNE proche centre ville, nous vous proposons à la vente cet appartement libre de 47 m² vous offrant une pièce de vie avec cuisine aménagée et équipée avec balcon. Une chambre avec..."
25A83DAAFQ4X,2025-05-30T22:22:00Z,Mayenne,,53100,BUY,HOUSE,165400,103.0,6,2,"Maison avec jardin et garage 2 voitures. Située sur l'axe Mayenne- Laval et à 2 minutes des commerces, nous vous proposons à la vente une maison à rafraichir d'une surface habitable de 103 m2. Cette ..."
2524S7HM4A7I,2025-08-17T12:17:00Z,Mayenne,Notre-Dame,53100,BUY,APARTMENT,45000,60.0,4,1,"Mayenne centre ville, à vendre: Appartement duplex: Au 1er étage: un salon-séjour, demi niveau: une cuisine Au Deuxième étage: une chambre, un bureau et une salle d'eau Possibilité de faire une chamb..."
256CEITASBV6,2025-10-31T09:19:00Z,Mayenne,,53100,BUY,HOUSE,168400,214.0,8,6,"Située à seulement quelques kilomètres de Mayenne et à proximité de tous commerces, venez découvrir à la vente cette superbe maison de ville. Offrant plus de 214m² de surface habitable, ses pièces so..."
256P4VU7GLUU,2025-08-17T12:17:00Z,Mayenne,Notre-Dame,53100,BUY,APARTMENT,30000,40.0,3,1,"Mayenne centre ville, à vendre: fond de commerce d'environ 30 m² Au RDC: un local commercial (15m²) sans obligation de commerce ancien loyer de 600 euros par mois Au demi-niveau en dessus: un couloir..."
25DRSIDXAQG9,2025-10-31T09:45:00Z,Mayenne,,53100,BUY,HOUSE,315400,208.0,6,5,"Située à seulement quelques kilomètres de la ville de Mayenne, venez découvrir à la vente cette superbe maison de campagne. Offrant plus de 200m² de surface habitable sur plusieurs niveaux, elle se c..."
25ZU2AWIFZMB,2025-10-31T09:38:00Z,Mayenne,Sud Ouest,53100,BUY,HOUSE,294400,254.0,8,6,"MAYENNE - Centre-ville, nous vous proposons à la vente cet ensemble immobilier vous offrant une maison de maître de plus de 250 m² habitables avec son charme et ces grands volumes ainsi qu'une maison..."
251SBXR4ZT2L,2025-10-31T09:27:00Z,Mayenne,Notre-Dame,53100,BUY,HOUSE,367900,209.0,10,9,"En plein coeur de Mayenne, laissez-vous charmer par cette maison de maître du XIX ème à vendre. Elle vous offre de très beaux volumes et espaces sur trois niveaux avec son escalier majestueux et fonc..."
25FLELNTI6E9,2025-10-31T09:44:00Z,Mayenne,Sud Ouest,53100,BUY,HOUSE,210400,254.0,8,6,"MAYENNE - Centre-ville, nous vous proposons à la vente cette maison de maître avec beaucoup de cachet et d'âme. Elle vous offre plus de 250 m² habitables avec son charme et ces grands volumes. Ainsi ..."
25XEKN2C14A1,2025-10-31T09:26:00Z,Mayenne,Saint Martin,53100,BUY,APARTMENT,249600,97.0,5,2,"Situé dans une résidence calme et sécurisée du quartier Saint-Martin à Mayenne, cet appartement entièrement rénové de 97 m² allie confort moderne et beaux volumes. Il offre une pièce de vie lumineuse..."
25M37YHXUCWL,2025-10-31T09:26:00Z,Mayenne,Saint Martin,53100,BUY,APARTMENT,126400,50.0,2,1,"Découvrez ce bel appartement rénové de 50 m², situé au dernier étage d'une résidence calme et sécurisée avec ascenseur, dans le quartier Saint-Martin à Mayenne. Il se compose d'une pièce de vie lumin..."
25LD4QJ2PSHX,2025-10-31T09:21:00Z,Mayenne,Sud Ouest,53100,BUY,HOUSE,163150,78.0,4,2,"MAYENNE, quartier recherché, proche commerces et écoles. Venez découvrir ce pavillon vous offrant une pièce de vie avec cuisine aménagée et équipée de plus de 36 m², deux chambres, une salle d'eau. V..."
25ENXCN22N74,2025-10-31T09:18:00Z,Mayenne,,53100,BUY,HOUSE,294400,138.0,8,5,"A 2 kms de MAYENNE en campagne, venez découvrir cet ancien corps de ferme vous offrant une longère en pierres comprenant une cuisine aménagée et équipée, un salon séjour de plus de 40 m² donnant dire..."
25UPT8B6HG6X,2025-10-31T09:40:00Z,Mayenne,Sud Est,53100,BUY,HOUSE,131650,70.0,3,2,"À 5 minutes de Mayenne en campagne, sans vis-à-vis, venez découvrir cette maison de 70 m² habitables. Elle vous offre une cuisine aménagée, un salon avec poêle à granulés, une salle à manger avec acc..."
25BCRSSVRDZK,2025-10-31T09:25:00Z,Mayenne,Nord Est,53100,BUY,HOUSE,105900,69.0,4,2,"MAYENNE, dans un hameau au calme, nous vous proposons à la vente ce pavillon vous offrant un salon séjour avec cheminée, une cuisine, deux chambres et un bureau. Garage. Le tout sur un terrain de plu..."
257XLPTA4PZQ,2025-04-11T22:01:00Z,Mayenne,,53100,BUY,HOUSE,128000,126.0,6,3,"Maison à la campagne avec un beau terrain. Située à la campagne sur l'axe Mayenne - Lassay- les - Châteaux, nous vous proposons à la vente une maison construite en pierres et couverte en ardoises nat..."
25FJJ9TXFZHC,2025-05-13T12:20:00Z,Mayenne,,53100,BUY,HOUSE,44600,95.0,4,3,"Idéal Investisseur où 1ère Acquisition. Située dans un village avec école, commerces et services, nous vous proposons à la vente une maison à restaurer construite en pierres et couverte en ardoises. ..."
25BLCCUXWC19,2025-02-06T23:53:00Z,Mayenne,,53100,BUY,HOUSE,44600,,,1,Idéal pour les amoureux de la nature. Vous serez séduit par le calme et la vue imprenable sur la campagne. Beau projet pour le maraîchage où pour les passionnés de chevaux. Sur l'axe Mayenne - Gorron...
251EXBENX3RR,2025-11-27T13:14:20.8497634Z,Mayenne,Notre-Dame,53100,BUY,HOUSE,198900,115.0,5,3,"Découvrez cette maison de 115 m2, récemment rénovée en 2025, vous offrant : Un ensemble salon-séjour avec cuisine ouverte aménagée et équipée, donnant accès à une terrasse aménagée et un jardinet ent..."
