id,creationDate,city,district,zipCode,distributionType,propertyType,price,surface,nbroom,nbbedroom,description
25YW7P43NVFC,2025-09-17T16:27:00Z,Montbeugny,,03340,BUY,PROJECT,153944,,5,3,"à 10 minutes d'Yzeure, venez découvrir le dernier terrain en vente sur la commune de Montbeugny, entièrement viabilisé et bien placé. Plus de renseignements en agence. Le modèle NADIA a une superfici..."
2548RYPHKX8M,2025-09-16T12:59:00Z,Louroux-de-Bouble,,03330,BUY,HOUSE,69500,172.0,8,6,"Située à Louroux-de-Bouble (03330), cette maison double bénéficie d'un cadre paisible et authentique au cœur de la campagne Bourbonnaise. La commune offre un environnement propice à la détente et à l..."
25CEUSIAR2CF,2025-09-13T09:20:00Z,Montluçon,La Caserne-Les Guineberts,03100,BUY,APARTMENT,29500,76.0,3,2,"REF-40714 Un appartement au 3ème étage d'une résidence sécurisée, dans un quartier, il est composé d'une entrée, d'un séjour double donnant sur le balcon, d'une cuisine, d'un WC, de deux chambres une..."
25VD1FFP3B8F,2025-08-20T13:04:00Z,Brout-Vernet,,03110,BUY,HOUSE,45000,75.0,1,1,"Maison atypique à Brout-Vernet (03110) – Grand terrain, petit prix ! Exclusivité SAFTI –Thomas MARIBAS, conseillère immobilière à Vichy. Envie de nature, d'espace et d'originalité ? Cette maison atyp..."
25JAILFB7VKY,2025-07-12T09:40:00Z,Diou,,03290,BUY,HOUSE,259500,190.0,8,4,"Charmante longère bourbonnaise, 5 chambres, à environ 1,5 kms des commerces et écoles. Cette maison familiale est implantée sur un beau terrain de 1 hectare dont 4300 m² classés ''à bâtir''. Elle pro..."
25QR3UE5JKVL,2025-07-09T09:48:00Z,Lapalisse,,03120,BUY,APARTMENT,65000,65.0,4,2,"LAPALISSE - appartement T3bis 64.8m2 Bel appartement dans une copropriété calme et proche du centre de Lapalisse et de toutes ses commodités. T3bis composé d'un hall, cuisine de 9.6m2, un séjour de 1..."
25WZ96MWA1S9,2025-11-20T13:08:00Z,Domerat,Campagne,03410,BUY,HOUSE,159100,114.0,4,3,"Pavillon proche du centre de Domérat, composé de plain pieds d'une cuisine équipée ouverte sur le séjour, une buanderie, trois chambres, une salle d'eau et wc séparé. Le tout sur un jardin d'environ ..."
25MYQ23BG5EN,2025-11-21T18:10:00Z,Commentry,Ieme Zone,03600,BUY,HOUSE,151580,133.0,5,4,"Proche de toutes les commodités à Commentry, maison de caractère composée de plain pied d'une cuisine aménagée, d'un séjour salon, d'une chambre et d'un wc. A l'étage, 3 chambres, salle de bains, wc...."
25GMJK5WPACN,2025-11-17T13:09:00Z,St Sauvier,,03370,BUY,HOUSE,87920,140.0,4,3,"Maison de 3 chambres comprenant de plain-pied une cuisine avec insert, une salle à manger , un salon, une salle d'eau avec wc. Terrain à l'arrière d'environ 850m². Logement à consommation énergétique..."
25QTTYH71R87,2025-06-11T09:26:00Z,Abrest,,03200,BUY,HOUSE,263250,136.0,5,3,"A VENDRE MAISON 136m² - 3 Chambres, située aux portes de Vichy, à 5 minutes en voiture du CentreVille. La maison est située sur un axe calme et peu passant. Conçue dans une très belle architecture, c..."
2544JKLTVZSA,2025-10-07T10:38:00Z,Meaulne-Vitray,,03360,BUY,HOUSE,89000,64.0,4,3,"À vendre à Meaulne, cette maison de 64 €m² offre un fort potentiel pour un premier achat ou un projet de rénovation. Située dans un secteur calme et recherché, elle se compose d'un séjour lumineux, d..."
25U2K5MMJTYW,2025-08-05T12:47:00Z,Malicorne,,03600,BUY,HOUSE,220500,100.0,5,3,"Maison composée d'une entrée avec ne pièce à vivre pouvant servir de salon, salle à manger, trois chambres, cuisine, deuxième cuisine , salle d'eau, toilettes, magnifique grenier aménageable de 93m2,..."
25GJPLQ9C2T6,2025-09-19T11:52:00Z,Vichy,Hôtel de Ville,03200,BUY,APARTMENT,219950,101.99,4,2,"L'Agence de l'Europe vous présente ce superbe appartement bourgeois de 4 pièces principales, développant environ 102 m² habitables, situé au 3 étage d'une charmante petite copropriété bien entretenue..."
25DYFZYSTYPX,2025-08-16T12:13:00Z,Dompierre-sur-Besbre,,03290,BUY,HOUSE,134000,100.0,5,3,"Maison de plain-pied qui comprend une entrée donnant sur un séjour lumineux, une cuisine séparée, une salle de douche avec double vasque, d'un WC séparé, de trois chambres, un couloir offrant une dis..."
25IK2BPNSXCK,2025-10-28T06:54:00Z,Verneuil-en-Bourbonnais,,03500,BUY,HOUSE,230000,150.0,7,5,"A 5min de Saint-Pourçain-sur-Sioule, cette maison de 150m² s'étend sur un terrain de 1500m² et se compose de 7 pièces. De plain-pied vous trouverez une belle pièce de vie lumineuse de 37m², puis un c..."
25RHEP8Y1EBE,2025-10-26T20:10:00Z,Vichy,Les Bains-République,03200,BUY,APARTMENT,135000,74.17,4,2,"Appartement 74 m² centre ville. Situé sur la très recherchée avenue Thermale, en plein cœur de Vichy, cet appartement de 74 m² se trouve au 3 € étage sans ascenseur d'un bel immeuble de caractère, pa..."
2523XA6BBDCD,2025-09-18T01:07:00Z,Vichy,,03200,BUY,APARTMENT,180000,90.0,4,3,"Hyper centre, à proximité du parc des sources : appartement de 90 m² au rdc d'une résidence de standing, comprenant une entrée, dégagement, séjour avec cuisine ouverte donnant sur terrasse de 36 m², ..."
24FY198KP379,2024-10-28T13:34:00Z,Vichy,Hôtel de Ville,03200,BUY,HOUSE,290000,118.0,6,4,"Maison de ville entièrement rénovée de 118m² sur 2 niveaux avec terrasse, terrain, dépendance et cave. Au RDC, une belle pièce de vie salon/séjour lumineuse de 41m² avec cuisine équipée, un WC et un ..."
25ZUDZLDMZB5,2025-09-25T10:57:00Z,Magnet,,03260,BUY,HOUSE,198000,100.0,4,3,"Maison récente de 100 m² sur 740 m² de jardin située à Magnet dans l'Allier (03) ayant commerces de proximités école maternelle/primaire, garderie, cantine et bus scolaire. Fin des travaux 12/2024. E..."
25ANV8MLA4WS,2025-10-17T15:06:00Z,Vichy,,03200,BUY,HOUSE,260000,146.0,8,6,"Rare maison indépendante , avec pièces de vie de plein pied. Elle est située à proximité du centre de Cusset, avec l'accès rapide à Vichy. Composée de trois niveaux d'environ 50m2 chacun et d'un gran..."
25TZJQSE7DPH,2025-08-20T22:30:00Z,Vichy,,03200,BUY,APARTMENT,110200,50.0,3,2,"VICHY Centre à proximité des 4 Chemins Appartement F3 traversant bénéficiant d'une vue dégagée. Il se compose d'un hall d'entrée avec placard mural, deux chambres, une pièce de cuisine avec un espace..."
25EMRIXPIDK8,2025-02-04T20:13:00Z,Chantelle,,03140,BUY,HOUSE,219000,120.0,4,2,"Maison neuve 120 m² de 2024 plain pied Chantelle secteur calme Terrain plat et clôturé de 1931 m² Elle se compose d'une entrée avec placard, salon séjour avec cuisine ouverte équipéee 70 m²,2 chambre..."
256BRGIICB8L,2025-10-08T21:09:00Z,Vichy,Thermal-Vieux-Vican,03200,BUY,APARTMENT,128000,57.0,2,1,"iad France - Christel Bertrand vous propose: Idéal Investissement - Opportunité à saisir - Appartement à rénover à Vichy - Situé en plein cOEur de la cité thermale Vichy, classé Unesco, ce bien de 57..."
25NKEXY9K1CD,2025-02-12T11:47:00Z,Pierrefitte sur Loire,,03470,BUY,HOUSE,97000,124.0,6,3,"L'agence BOURBON LANCY IMMOBILIER (zéro six quatre vingt sept trente quatre cinquante sept soixante douze) vous propose ferme avec dépendances à Pierrefitte sur Loire : Réf - 2241. Rdc : cuisine, cel..."
25X9CQYS8Z4K,2025-06-06T11:10:00Z,Yzeure,,03400,BUY,HOUSE,129000,171.0,8,6,"À seulement 10 minutes de Moulins (03), cette propriété offre un emplacement idéal, proche du bourg d'Yzeure, au cœur de Bourbonnais. Avec 6 chambres et un terrain spacieux de 1400 m², cette maison a..."
24I4W1IU6NYK,2024-11-12T15:38:00Z,Huriel,,03380,BUY,HOUSE,172000,147.0,4,3,"REF 39676 Pour les amoureux du bois et de la pierre! Découvrez cette charmante fermette rénovée, construite en 1900, située à Huriel dans l'Allier. Avec une superficie de 147 m², cette propriété aux ..."
25VLR4PXIVJZ,2025-11-21T18:10:00Z,La Celle,,03600,BUY,HOUSE,139750,94.0,4,2,"30 minutes de Montluçon sur secteur campagne, corps de ferme composé d'une maison d'habitation rénovée pour une partie, et une autre petite maison rénovée entièrement avec séjour, cuisine aménagée, u..."
25VACT5GVTJB,2025-11-17T13:10:00Z,Neris les Bains,,03310,BUY,APARTMENT,155150,194.0,8,4,"Au coeur d'une ville thermale, appartement en duplex de 194m² avec jardin privatif situé à deux pas du casino, des commerces et écoles. Pièce de vie de 57m², cuisine équipée, 4 chambres dont une avec..."
2559RVPSA9ZH,2025-04-10T10:24:00Z,Bellerive sur Allier,,03700,BUY,HOUSE,426400,161.0,4,1,"Immobilier.notaires® et l'office notarial SCP François ROBELIN et Michaël MIDROUILLET, notaires associés vous proposent : Pavillon à vendre - BELLERIVE SUR ALLIER (03700) - - - - - - - - - - - Grande..."
259Q27CMLNW9,2025-09-02T04:04:00Z,Chatel Montagne,,03250,BUY,HOUSE,99990,146.0,5,3,"Votre agence CHALTON DUBANCHET vous propose à la vente en exclusivité, une maison de 146.35 m², située dans l'Allier. Découvrez cette charmante maison individuelle située dans le village paisible de ..."
24TS3EZZ1BBJ,2024-06-17T20:45:00Z,Souvigny,,03210,BUY,HOUSE,134400,130.0,4,3,"Maison d'environ 130m2 avec terrain de 1716m2 Situé à Souvigny dans un quartier calme, à 15 minutes de Moulins. cette maison offre 3 chambres, ainsi qu'un belle espace de vie sur chaque niveau, une s..."
25Z54H9PKG47,2025-05-20T12:02:00Z,Vichy,Thermal-Vieux-Vican,03200,BUY,APARTMENT,283000,172.0,5,3,"BAISSE DE PRIX - À VENDRE – VICHY OPÉRA – 170 m² – Appartement de caractère avec balcons et ascenseur - Emplacement exceptionnel, au cœur du quartier de l’Opéra : l’Agence AJYL Immo vous propose ce b..."
2521C6NPPSKB,2025-10-31T14:12:00Z,Vichy,Beausejour-Les Graves-Les Bartins,03200,BUY,HOUSE,229000,151.0,7,4,iad France - Christel Bertrand vous propose: MAISON DE VILLE avec garage Venez découvrir cette charmante maison de ville élevée sur 3 niveaux. Le premier étage se compose d'une cuisine ouverte sur le...
2544E2PGFJ9U,2025-09-15T23:43:00Z,Commentry,Ieme Zone,03600,BUY,HOUSE,109000,105.0,5,3,"TRANSAXIA COMMENTRY, Murielle (EI) vous présente :Jolie maison entretenue, située dans un quartier calme.De plain-pied, l'entrée dessert une cuisine fermée et aménagée, un séjour-salon traversant et ..."
25M9UM5NNAKE,2025-10-02T22:40:00Z,Vichy,,03200,BUY,HOUSE,229000,152.0,6,4,"L'Agence VICHY TRANSACTIONS vous propose à la vente une coquette maison des années 30. Elle se compose d'une entrée sur une pièce de vie de 40 m² avec cuisine ouverte sur séjour, une chambre, une sal..."
25V1GMY4A8F5,2025-10-21T10:56:00Z,Saint-Marcel-en-Marcillat,,03420,BUY,HOUSE,87000,145.0,7,5,"Située dans un charmant bourg des Combrailles, cette propriété profite d'un cadre idéal. Elle se compose d'une maison de 145 m² habitable, d' une grange attenante, de dépendances et d'un jardin. La m..."
25RFZ9X1JI7D,2025-09-23T17:56:00Z,Cusset,Zone Verte,03300,BUY,HOUSE,360000,322.0,9,5,"Située à Cusset (03300), cette maison se trouve dans un environnement alliant le charme de la campagne avec la proximité des écoles, lycées, collèges, crèches, et des commerces du centre-ville, elle ..."
24Q8TYZIZBAW,2024-09-21T08:48:00Z,Cusset,Centre Historique,03300,BUY,PROJECT,276268,,4,3,"À vendre, un terrain d'une superficie de 756 m², situé à Cusset, dans le département de l'Allier. Ce terrain offre une vue dégagée et un environnement arboré, idéal pour réaliser votre projet de cons..."
255T6QFM9E6V,2025-08-20T22:30:00Z,Vichy,,03200,BUY,APARTMENT,270800,105.0,4,2,"VICHY - En coeur de ville spacieux appartement F4 de 105m² dans un immeuble des années 30 doté d'un ascenseur. Il se compose d'une entrée desservant une salle à manger ouverte sur un grand salon, deu..."
254SZWACDYRV,2025-10-13T19:19:00Z,Montlucon,Ville Gozet,03100,BUY,HOUSE,58000,60.0,3,2,"Idéalement située en plein cœur de Montluçon, à proximité immédiate de toutes les commodités (commerces, transports, écoles), cette maison de ville de 60 m² offre un cadre de vie pratique et central...."
252ESP589QCG,2025-08-09T23:43:00Z,Montluçon,Cité Bretonnie-Chatelet-Favieres-Conches,03100,BUY,HOUSE,139900,99.0,4,3,"TRANSAXIA COMMENTRY, Murielle (EI) Vous présente :Cette jolie maison de plain-pied idéalement située dans un quartier calme et isolé à Montluçon elle se compose :Une cuisine aménagée, 1 séjour/salon ..."
25JARS5K6SW3,2025-02-14T20:07:00Z,Cusset,Centre Historique,03300,BUY,APARTMENT,85000,87.0,5,1,"Appartement spacieux de 87m² au 3ème étage dans une résidence sécurisée à Cusset. Ce bien se compose d'un salon/séjour d'environ 26.5m², une cuisine équipée, 3 chambres, une salle d'eau avec cabine d..."
25DR166LQ3KF,2025-01-20T13:25:00Z,Dompierre-sur-Besbre,,03290,BUY,HOUSE,60000,84.0,5,3,"Maison de 84m² à rafraîchir sur une parcelle de 318m² à Dompierre sur Besbre à quelques pas des commodités (centre ville, bibliothèque..). Ce pavillon clôturé se compose d'un garage en sous sol semi ..."
25ZKCNY23VX5,2025-09-22T14:26:00Z,Montluçon,,03100,BUY,HOUSE,124000,170.0,9,7,Proximité tous commerces maison familiale se composant d'un sous sol complet avec double garage Au premier étage palier desservant cuisine - séjour double - quatre chambres - salle de bains - wc Au d...
25ZVQH4LHE2R,2025-09-12T12:49:00Z,Moulins,Lyon Gare,03000,BUY,HOUSE,360000,209.0,12,5,"À deux pas du centre-ville, cette maison de caractère du début du XX? siècle a été entièrement rénovée avec soin. Elle offre à la fois le charme de l'ancien et le confort moderne. Au rez-de-chaussée,..."
258U2JNXYAMF,2025-07-11T11:38:00Z,Montluçon,,03100,BUY,APARTMENT,104000,110.0,4,3,"Centre ville, dans copropriété sans charges, Superbe Appartement F4 bis offrant séjour / cuisine de 55m², 3 chambres, bureau, salle de bains, terrasse Double vitrage, chauffage gaz individuel A Décou..."
25ECA3FMGA27,2025-06-14T12:42:00Z,Vichy,Thermal-Vieux-Vican,03200,BUY,APARTMENT,441000,165.17,5,2,"Exclusivité Appartement de 167 m² Vichy coeur de ville - À vendre en exclusivité Appartement de 167 m² Vichy centre Dans une résidence sécurisée en plein cœur de ville à Vichy, à proximité immédiate ..."
25UXYI513C5N,2025-05-08T00:10:00Z,Gannat,,03800,BUY,PROJECT,224300,,4,3,"Sur la commune de Gannat parcelles de 680m² à 836m² disponibles. Idéal pour une famille souhaite s'installer. Belle exposition - terrain plat et accessible. Depuis 1979, MAISONS ELAN vous accompagne ..."
25KAJ1D4T82F,2025-11-21T18:10:00Z,Desertines,,03630,BUY,APARTMENT,60000,72.66,4,2,"Secteur calme sur Désertines, dans petite copropriété, appartement composé d'un séjour salon, d'une cuisine aménagée, de deux chambres, salle d'eau et wc. Appartement actuellement loué, très bon état..."
25886CUPCKIT,2025-11-21T18:10:00Z,Montlucon,Cité Bretonnie-Chatelet-Favieres-Conches,03100,BUY,APARTMENT,122718,80.0,4,3,"Montluçon, plein centre ville, maison composée d'une cuisine ouverte sur séjour, de deux chambres, bureau, salle de bains, wc. En sous-sol, caves, cellier, buanderie. Jardin clos sur l'arrière avec a..."
255U68VZJ8C3,2025-11-12T13:10:00Z,Huriel,,03380,BUY,HOUSE,95265,76.0,3,2,"Située à Huriel, maison sur terrain d'environ 1400m² avec divers dépendances, composée d'un séjour double avec poêle à granulés, une cuisine, une salle d'eau avec wc, et à l'étage deux chambres."
253NJ3PRHCG6,2025-12-01T20:37:00Z,Escurolles,,03110,BUY,HOUSE,55000,200.0,9,7,"Maison 200 m² centre bourg d'Escurolles Terrain 788 m² plat et cloturé Elle se comose au rdc d' une cuisine de 23m ², un salon de 18 m², une salle à manger de 28 m², 2 chambres et une salle d'eau ave..."
25HLVYGMBHWL,2025-09-19T10:23:00Z,Vichy,,03200,BUY,HOUSE,540000,175.0,3,,"Immobilier.notaires® et l'office notarial SCP François ROBELIN et Michaël MIDROUILLET, notaires associés vous proposent : Maison / villa à vendre - VICHY (03200) - - - - - - - - - - - Superbe maison ..."
25FVZ12GEEXH,2025-10-27T20:48:00Z,Brout-Vernet,,03110,BUY,HOUSE,157500,240.0,11,6,"Grande maison, d'une surface totale de 240m² hab env, composée de belles surfaces et un beau terrain de 1890m² Située dans un village proche de St Pourçain sur Sioule et Vichy, dans l'Allier, en Auve..."
258X9DU5YWCP,2025-04-26T16:58:00Z,Abrest,,03200,BUY,HOUSE,242000,114.39,5,4,Votre agence Orpi les sources vous propose à la vente ce très beau pavillon de 114m² à proximité immédiate de la tour d'Abrest et à 5 min du pont de Bellerive sur Allier. Il se compose d'une grande p...
251Q6C3KXVVY,2025-10-25T21:05:00Z,Vichy,Hôtel de Ville,03200,BUY,APARTMENT,99500,52.0,2,1,"L'Agence de l'Europe vous propose à la vente cet agréable appartement deux pièces de 52 m², situé au 4 et dernier étage d'un immeuble avec ascenseur, au cœur de Vichy, à proximité immédiate des comme..."
259ZWG5PRHUM,2025-10-23T18:17:00Z,La Chapelle,,03300,BUY,HOUSE,66876,60.0,4,2,"Immobilier.notaires® et l'office notarial JONQUET NOTAIRE ASSOCIE, SELARL vous proposent : Maison rurale à vendre - LA CHAPELLE (03300) - - - - - - - - - - - UNE PROPRIETE RURALE SOIT : * UN CORPS DE..."
25K7592FYKMB,2025-06-26T17:33:00Z,Vichy,,03200,BUY,APARTMENT,810000,296.0,7,1,"?? À VENDRE – VICHY (03200) – 810 000 € ? Appartement de prestige – 300 m² – Dernier étage avec vue panoramique Au cœur de Vichy, classée au patrimoine mondial de l'UNESCO, découvrez un bien d'except..."
2542BL8FYSNJ,2025-07-18T19:31:00Z,Fleuriel,,03140,BUY,HOUSE,254200,180.0,7,3,"Cette belle maison de maître présente un cadre paisible au cœur d'un environnement calme et verdoyant, les commodités essentielles sont aisément accessibles, garantissant un quotidien pratique et con..."
258JMP52G7EI,2025-10-18T01:20:00Z,St Remy en Rollat,,03110,BUY,HOUSE,118000,124.0,7,4,"Jolie ferme à rénover sur terrain clos de 2600 m² comprenant : une maison d'habitation de 5 pièces de plain pied de 80 m² à rénover entièrement, et une dépendance attenante (sans accès entre les 2) c..."
25C7T1GU56KX,2025-10-16T21:41:00Z,Vichy,,03200,BUY,HOUSE,243000,119.0,3,2,"Vichy, Lac d'Allier, superbe emplacement pour cette villa de 119 m² habitables comprenant : Au rez-de-chaussée : hall d'entrée, une chambre (16 m²), chaufferie/buanderie, garage, A l'étage : une cuis..."
25Y6BZDXAUNY,2025-10-10T22:35:00Z,Creuzier le Vieux,,03300,BUY,HOUSE,272000,143.0,6,4,"L'Agence VICHY TRANSACTIONS vous propose à la vente une coquette maison de 140 m² en parfait état avec un jardin arboré de 1562 m². Elle se compose en rez-de-chaussée d'une entrée, une cuisine équipé..."
2596ZDSKDYPX,2025-09-16T20:41:00Z,St Remy en Rollat,,03110,BUY,HOUSE,254000,125.0,6,4,"NOUVELLE EXCLUSIVITE sur la commune de St Rémy en rollat, trés agréable maison de plain pied de 125 m² habitables, nichée au sein du village et proche de toutes commodités. Ce bien présente toutes le..."
25K3F7951FWG,2025-09-25T09:18:00Z,Montluçon,Cité Bretonnie-Chatelet-Favieres-Conches,03100,BUY,APARTMENT,39000,53.0,3,2,"Montluçon - Appartement habitable de suite, d'une superficie de 53,76 m² comprenant : entrée, cuisine, séjour, deux chambres, salle d'eau,toilettes. L'appartement dispose d'une cave et d'un garage. L..."
25VR81WW2ARC,2025-09-02T19:18:00Z,Commentry,Ieme Zone,03600,BUY,HOUSE,59000,112.0,5,3,"Mandat By Orpi N° 39340. Idéal investisseur ! Contacter l'agence Orpi Maison disposant de 112 m2 à repenser complètement. Et d'une seconde maison d'environ 37 m2 au sol. Le plus de cette maison, une ..."
25KN8HG1MLNG,2025-09-02T11:36:00Z,Montluçon,,03100,BUY,HOUSE,182000,230.0,6,3,Secteur Prisé pavillon de type F6 se composant d'une grande entrée - une cuisine d'été - une chambre - salle d'eau - wc - salon - véranda Etage composé d un séjour - de deux chambres - bureau Cuisine...
25PMP3WV3XTB,2025-09-01T21:00:00Z,Vichy,Jeanne d'Arc-Stade,03200,BUY,APARTMENT,59950,22.3,1,,"Situé dans un quartier calme et recherché de Vichy, à proximité de l'Allier, l'Agence de l'Europe vous propose ce studio de plain-pied, d'une surface habitable d'environ 22 m². Il se compose de : Une..."
253YXRUUKU2W,2025-07-08T13:25:00Z,Mazirat,,03420,BUY,HOUSE,98500,136.0,6,3,"Proche du bourg de Mazirat et du barrage de Rochebut, en pleine nature, cette maison de bonne construction est en recherche de futur prpriétaires. Elevée sur un sous sol couvrant toute la surface au ..."
25UQAXPSF47D,2025-07-07T10:22:00Z,Moulins,,03000,BUY,HOUSE,4500000,455.0,20,10,"Au coeur de l'Europe et au centre de la France, un domaine de chasse clos de 110 ha d'une exceptionnelle tenue. La propriété est éloignée de toute route et de toute habitation, protégée de toute nuis..."
257953Y934A6,2025-03-18T18:41:00Z,Néris-les-Bains,,03310,BUY,HOUSE,121000,120.0,5,4,"REF : 40126 L'agence ORPI vous présente cette Charmante maison de 120 m² située au cœur de Néris-les-Bains. Elle est composée de plain pied : d'une belle pièce de vie avec cuisine américaine, un déga..."
25TELGN8CSAJ,2025-11-23T20:21:00Z,Pierrefitte-sur-Loire,,03470,BUY,HOUSE,76000,86.0,4,2,Jolie petite maison mitoyenne rénovée située dans une impasse à seulement 500 mètres des commodités. Le bien se compose sur 2 niveaux avec un jardin et un grand garage non attenant. Le rez de chaussé...
25FFGGLIU5IS,2025-10-29T16:25:00Z,Avermes,,03000,BUY,PROJECT,212100,,5,3,"Situé dans un lotissement privilégié de seulement 12 lots, ce terrain constructible de 700 m² est une opportunité à ne pas manquer. Entièrement viabilisé, il se trouve à seulement deux minutes du cen..."
25KK6L5J6UKL,2025-09-16T08:19:00Z,Saint-Rémy-en-Rollat,,03110,BUY,PROJECT,220900,,5,3,"Une opportunité à saisir. Sur la commune de Rémy-en-Rollat, magnifique parcelle de 1107m2 en partie viabilisée en eau et tout à l'égout. Totalement plat et cloturé sur 3 côtés, ce terrain saura accue..."
25V6S1S81YRC,2025-10-10T19:21:00Z,Abrest,,03200,BUY,HOUSE,355000,235.0,8,4,Maison de type longère 235 m² Abrest rive gauche 5 mn de Vichy Elle se situe à la Tour d'Abrest dans un secteur calme et résidentiel Terrain de 4500 m² avec vue dégagée et sans vis à vis Elle se comp...
25TT8XE1PX4V,2025-04-07T21:37:00Z,Bellerive sur Allier,Centre Ville Bas,03700,BUY,HOUSE,221900,102.0,4,1,"À Bellerive-sur-Allier, cette belle maison de 4 pièces d'une superficie total de 102 m2 et de 870 m2 de terrain se compose d'une entrée, d'un grand séjour avec balcon, une cuisine ouverte, trois cham..."
25Z7G3GMVJU2,2025-11-05T10:16:00Z,Désertines,,03630,BUY,HOUSE,445200,379.0,6,5,Réf 40739 EXCLUSIVITÉ - MAISON D'ARCHITECTE En vente : venez découvrir proche de MONTLUÇON cette maison de 10 pièces de 379 m² et de 4 808 m² de terrain. Elle bénéficie d'une exposition sud. Elle off...
254CMFAKD8J7,2025-11-12T13:10:00Z,St Sauvier,,03370,BUY,HOUSE,149904,102.0,4,3,"Située à Saint-Sauvier, longère composée d'une cuisine, un séjour double, un bureau et une chambre, à l'étage deux chambres, le tout sur un terrain d'environ 5000m² avec dépendances."
2537MI6F9IRS,2025-06-19T09:47:00Z,Chantelle,,03140,BUY,HOUSE,136000,87.0,6,2,"TRANSAXIA CHANTELLE,Cathy Peronnet-Tasse (E.I) inscrit au RSAC de CUSSET sous le numéro 894599075 vous propose :A 5 minutes de Chantelle, dans un cadre agréable, belle ensemble immobilier comprenant ..."
25SKLDMCP715,2025-11-13T13:11:00Z,Domerat,Banlieue,03410,BUY,HOUSE,13000,50.0,1,1,"Dans un lieu-dit à Domérat, maison à rénover entièrement avec un potentielle d'environ 100m². courette sur l'arrière."
25P265ISNA5Q,2025-11-13T13:11:00Z,Huriel,,03380,BUY,HOUSE,197580,160.0,6,4,"Beaumont, ancienne grange d'environ 160m² sur 2 niveaux. Entièrement rénové depuis moins de 10 ans. Elle offre de plain pied une suite parentale, cuisine ouverte sur séjour et terrasse, une buanderie..."
25RT9BT7N76U,2025-06-19T09:47:00Z,Voussac,,03140,BUY,HOUSE,122500,113.0,6,3,"TRANSAXIA MONTMARAULT VOUS PROPOSE à 10 minutes de l'autoroute une maison en pierre apparentes élevée en partie sur cave, habitable de suite. L'entrée vous accueille sur un vaste salon avec sa chemin..."
25WSJIAQELXB,2025-09-27T23:42:00Z,St Hilaire,,03440,BUY,HOUSE,27500,50.0,3,2,"TRANSAXIA BOURBON L'ARCHAMBAULT vous propose à 10 minutes de Bourbon l'Archambault, en campagne de SAINT-HILAIRE sur un terrain de 279 m², une maison mitoyenne d'un côté à finir de restaurer, d'une s..."
25YZSSL56FXD,2025-09-15T07:44:00Z,Herisson,,03190,BUY,HOUSE,125350,125.0,6,4,"TRANSAXIA COSNE D'ALLIER, GARGOT Aurelie (EI) Immobilier centre France Allier : Maison familiale située à Hérisson, sur un terrain d'environ 1 000 m². Surface habitable : 125 m², 6 pièces dont 4 cham..."
25N279XB4AUX,2025-09-03T14:05:00Z,Vichy,France et Rosieres,03200,BUY,HOUSE,325000,109.0,4,3,"VICHY, QUARTIER DE FRANCE. EN BAISSE DE PRIX. L'Agence GILLET vous propose à la vente cette belle villa des années 60 en parfait état, entièrement rénovée depuis 1 an. Avec toute une partie habitable..."
25ZB6IGJHQWV,2025-07-05T10:42:00Z,Commentry,Ieme Zone,03600,BUY,HOUSE,110000,143.0,6,4,"En plein centre de COMMENTRY (03600), maison d'environ 143m² comprenant une grande salle à manger, un séjour et cuisine, à l'étage, 4 chambres et salle d'eau. Deux dépendances d'une surface totale de..."
25JSSKHUESA1,2025-06-15T12:55:00Z,Cusset,Champcourt-Zone Industrielle,03300,BUY,HOUSE,188000,137.0,6,3,"Située dans la charmante ville de Cusset (03300), cette propriété bénéficie d'un environnement paisible et familial, proche des commerces locaux et des écoles. Idéalement implantée, elle offre à ses ..."
25JX7RHSMAXQ,2025-06-04T08:18:00Z,Cusset,Champcourt-Zone Industrielle,03300,BUY,HOUSE,355000,130.0,5,,"Vivre à la campagne, proche de tout. Les propriétaires, ayant concrétisé leur projet, ont révisé le prix afin de permettre une vente rapide. Cette baisse de prix n’enlève rien à la qualité ni au pote..."
