id,creationDate,city,district,zipCode,distributionType,propertyType,price,surface,nbroom,nbbedroom,description
25IBANUTFQG2,2025-09-30T03:44:00Z,Corrèze,,19800,BUY,HOUSE,199500,105,5,3,"iad France - Franck Monforte vous propose: Magnifique Maison Traditionnelle avec Terrasse, Garage et Jardin à Corrèze Vous cherchez une charmante maison traditionnelle, prête à vous accueillir et à v..."
255S478I9LVL,2025-11-19T08:28:00Z,Corrèze,,19800,BUY,HOUSE,145000,160,8,5,"Plongez dans le charme de cette maison individuelle de 160 m², parfaitement nichée dans une impasse paisible à Corrèze. Une perle rare offrant un fort potentiel pour répondre à vos aspirations de gra..."
25BQHUVEGPGI,2025-04-14T20:23:00Z,Corrèze,,19800,BUY,HOUSE,255000,159,6,4,"iad France - Cindy Legros vous propose: Exceptionnelle maison de 159m² sur un terrain de plus de 2000m² à Corrèze ! Rare sur le marché, cette splendide maison individuelle située à Corrèze est un vér..."
25P34IILPNI1,2025-08-05T22:34:00Z,Corrèze,,19800,BUY,HOUSE,255000,160,7,4,19800 CORREZE - PAVILLON DE 160M² HABITABLE - 4 CHAMBRES -7 PIECES - AU CALME - VERANDA- PISCINE ENTERREE - DOUBLE CARPORT BOIS - TERRAIN CLÔTURE DE 2112 M² Pascale Cessac vous présente : ce charmant...
253RHQS6XQQ9,2025-06-24T03:47:00Z,Corrèze,,19800,BUY,HOUSE,85000,120,4,3,"iad France - Manon Bourrel vous propose : Maison de village avec vue dégagée Située dans un environnement paisible, cette maison de village offre deux niveaux habitables, implantés sur un terrain en ..."
25ZCNK6G1R41,2025-10-15T17:14:00Z,Corrèze,,19800,BUY,HOUSE,199500,105,4,3,"Bien rare sur le secteur ! Maison de 105 m2 de PLAIN PIED au calme et à proximité immédiate du bourg avec crèche, école et collège Disposant d'un vaste espace de vie de 58m2 avec cuisine ouverte, sal..."
25VJCSJMZY6E,2025-11-13T16:32:00Z,Correze,,19800,BUY,HOUSE,183300,130,6,4,"IMMODU19.FR/ Maison d'habitation d'environ 130 m², elle est composée d'une grande entrée, un salon, une cuisine ouverte sur salle à manger, une chambre, une salle de bain avec Wc, à l'étage trois gra..."
25IJ9K4GD36J,2025-11-13T16:26:00Z,Correze,,19800,BUY,HOUSE,183300,130,6,4,"IMMODU19.FR/ Maison d'habitation d'environ 130 m², elle est composée d'une grande entrée, un salon, une cuisine ouverte sur salle à manger, une chambre, une salle de bain avec Wc, à l'étage trois gra..."
25388PNQ4QTN,2025-11-24T05:49:00Z,Correze,,19800,BUY,HOUSE,91800,108,6,4,"Au calme, jolie maison de bourg en pierres avec 2 entrées. Au 1 er étage: agréable salon avec pierres et poutres apparentes, cuisine séparée. Au-dessus: palier, 2 chambres, un bureau. Wc. Sous comble..."
251RARCY8E2H,2025-01-29T22:04:00Z,Corrèze,,19800,BUY,APARTMENT,220000,233,3,1,"Opportunité rare, à saisir : Immeuble de rapport clé en main, idéal investisseur. Complétement rénové. Rente annuelle des loyers : 21 000 € hors charges. Chauffage gaz basse consommation et poêles à ..."
25DJEQBGEEHB,2025-08-07T14:46:00Z,Correze,,19800,BUY,HOUSE,255000,160,7,4,"/ Dans une impasse au calme, cette maison entièrement rénovée d'environ 160 m² comprend un séjour de plus de 40 m², une cuisine séparée donnant accès à une véranda chauffée, une chambre avec placard,..."
256WSIUE3MUV,2025-09-26T01:04:00Z,Correze,,19800,BUY,HOUSE,255000,160,7,4,"/ Dans une impasse au calme, cette maison entièrement rénovée d'environ 160 m² comprend un séjour de plus de 40 m², une cuisine séparée donnant accès à une véranda chauffée, une chambre avec placard,..."
25JLEVAQX7C9,2025-06-16T04:47:00Z,Corrèze,,19800,BUY,HOUSE,99000,132,8,5,"Nous vous proposons à la vente cette maison familiale dans le bourg de CORREZE. Derrière une façade en pierre en parfait état, la maison comprend : - Au rez-de-chaussée : une cuisine aménagée et équi..."
25SRB7CCR2SN,2025-10-17T21:28:00Z,Corrèze,,19800,BUY,HOUSE,145000,134,9,5,"Située dans un environnement calme, au fond d'une impasse, cette jolie maison en pierre, édifiée sur un sous-sol semi-enterré à usage de stockage, bénéficie d'un emplacement privilégié, à deux pas de..."
255QCY2GHLM5,2025-09-26T01:04:00Z,Correze,,19800,BUY,HOUSE,60500,95,6,4,"EXCLUSIVITÉ / Dans le bourg, ce bien autrefois à usage de chai à vin est entièrement à rénover. Cette maison comprend actuellement deux cuisines, un salon, quatre chambres et un wc. Sous sol complet...."
25VBST3YKNR4,2025-09-08T08:49:00Z,Corrèze,,19800,BUY,HOUSE,164000,135,8,5,"À seulement 5 minutes à pied d'un bourg dynamique avec commerces et écoles, cette belle maison familiale rénovée entre 2019 et aujourd'hui saura vous séduire par ses volumes et son potentiel. Habitab..."
25XPVW3CSSIL,2025-08-28T14:42:00Z,Correze,,19800,BUY,HOUSE,27500,150,5,3,"EXCLUSIVITÉ / Au coeur du centre bourg de Corrèze et de toutes commodités, une maison d'habitation en pierre entièrement à rénovée comprenant trois plateaux de 70 m2 environ. Cette bâtisse offrant pl..."
25BAXEWFM7D2,2025-09-25T15:25:00Z,Correze,,19800,BUY,HOUSE,27500,150,5,3,"EXCLUSIVITÉ / Au coeur du centre bourg de Corrèze et de toutes commodités, une maison d'habitation en pierre entièrement à rénovée comprenant trois plateaux de 70 m2 environ. Cette bâtisse offrant pl..."
253V4539NRYP,2025-01-23T21:18:00Z,Corrèze,,19800,BUY,HOUSE,96990,86,4,2,"iad France - Cindy Legros vous propose: Charmante maison de ville à Corrèze – Parfaite pour une première acquisition ! Située au cOEur de Corrèze, proche de toutes commodités Vous cherchez un cocon c..."
251ZXD1X7UFG,2025-08-28T14:42:00Z,Correze,,19800,BUY,HOUSE,12500,70,3,1,"EXCLUSIVITÉ / Sur les hauteurs du centre bourg de Corrèze, une maison a restauré comprenant quatre pièces, de plus sur le même niveau une partie grange attenante de 24 m² avec possibilité de faire de..."
25SIFU72TT1I,2025-09-25T15:25:00Z,Correze,,19800,BUY,HOUSE,12500,70,3,1,"EXCLUSIVITÉ / Sur les hauteurs du centre bourg de Corrèze, une maison a restauré comprenant quatre pièces, de plus sur le même niveau une partie grange attenante de 24 m² avec possibilité de faire de..."
258AVNT12G5W,2025-08-08T09:25:00Z,Correze,,19800,BUY,HOUSE,60500,95,6,4,"EXCLUSIVITÉ / Dans le bourg, ce bien autrefois à usage de chai à vin est entièrement à rénover. Cette maison comprend actuellement deux cuisines, un salon, quatre chambres et un wc. Sous sol complet...."
