id,creationDate,city,district,zipCode,distributionType,propertyType,price,surface,nbroom,nbbedroom,description
256JPIHHL317,2025-10-16T06:30:00Z,Valignat,,03330,BUY,HOUSE,275000,165.0,4,2,"EXCLUSIVITE. Dans un site occupé depuis le VIIIe siècle et bâti du XIe au XVIe siècles sur une avancée calcaire dominant la vallée, le château comprenait quatre tours rondes reliées entre elles par d..."
24Y4HRGZ31A7,2024-11-05T19:35:00Z,Saint-Pourçain-sur-Sioule,Centre Est,03500,BUY,HOUSE,269000,140.0,5,3,"Découvrez cette charmante maison individuelle à vendre à Saint-Pourçain-sur-Sioule. Véritable perle rare datant de 1800. Avec une superficie de 140 m², cette propriété en bon état offre tout le confo..."
25WMM436HJTQ,2025-07-31T03:13:00Z,Montluçon,Viviani-Dunlop,03100,BUY,HOUSE,179000,140.0,4,3,"iad France - Solene Houmadi vous propose: Découvrez cette belle maison de plein pied de 140m², située à Montluçon. Bénéficiant d'une rénovation récente et d'une décoration soignée, ce bien est un vér..."
255DTI641B4U,2025-07-18T18:13:00Z,Désertines,,03630,BUY,HOUSE,170000,188.0,8,6,"iad France - Krystèle Verhulst vous propose: À vendre : Maison écologique de plain-pied - 188 m². Ancienne crèche avec partie habitable. Découvrez cette maison écologique de plain-pied, offrant un be..."
251EDN2KSK7H,2025-09-30T10:11:00Z,Montluçon,Les Iles-Buffon,03100,BUY,HOUSE,71000,65.0,4,2,"iad France - Veronique LANDRIER vous propose: Une maison traditionnelle, située dans un quartier calme sur les hauteurs de Montluçon. Elle est composée d'un séjour, d'une cuisine, d'une chambre, d'un..."
254Q5G1M7EWL,2025-01-18T10:11:00Z,Huriel,,03380,BUY,HOUSE,49000,108.0,4,3,"Réf : 39931 Au centre du village d'HURIEL maison de bourg en pierre composée de : En RDC entrée, cuisine, séjour, salle d'eau, WC et buanderie .A l'étage 3 chambres, WC et une partie de comble aménag..."
25QX9PEUJ7J2,2025-10-03T10:23:00Z,Vichy,,03200,BUY,HOUSE,482600,139.0,5,3,"En exclusivité, Le Marché de l'Immobilier, vous propose à Vichy, idéalement situé au sein du quartier Jeanne d'Arc, à proximité immédiate des commerces, une maison de caractère, entièrement rénovée a..."
25CD4SGPST9V,2025-10-11T04:57:00Z,Vichy,Marche,03200,BUY,APARTMENT,169000,107.0,4,3,"Emplacement exceptionnel entre la Rotonde et le Marché Couvert, à proximité immédiate des thermes, commerces et restaurants. Ce bien rare, entièrement rénové et meublé avec soin, offre trois chambres..."
25JN8DCCG4RM,2025-10-04T05:59:00Z,Vichy,Deniere les Romains,03200,BUY,APARTMENT,129600,36.15,2,1,Grand Lancement - Prenez RDV avec nos conseillers pour profiter du meilleur choix ! L'ACCES A LA PROPRIETE N'A JAMAIS ETE AUSSI ACCESSIBLE ! ACHETEZ MEME SANS APPORT (1) 0 FRAIS AVANT D'EMMÉNAGER (1)...
25WPI4AQVB2C,2025-10-04T05:59:00Z,Vichy,Deniere les Romains,03200,BUY,APARTMENT,138600,36.15,2,1,Grand Lancement - Prenez RDV avec nos conseillers pour profiter du meilleur choix ! L'ACCES A LA PROPRIETE N'A JAMAIS ETE AUSSI ACCESSIBLE ! ACHETEZ MEME SANS APPORT (1) 0 FRAIS AVANT D'EMMÉNAGER (1)...
258EB9JMYVZ9,2025-09-04T15:18:00Z,Vichy,Hôtel de Ville,03200,BUY,HOUSE,246000,60.0,3,2,"Située dans la charmante ville de Vichy (03200), cette maison de 60 m² sur un terrain de 100 m² offre un cadre de vie paisible à ses habitants. À proximité des commerces locaux et des installations d..."
25T7ZMPQXQK2,2025-09-23T23:22:00Z,Vichy,France et Rosieres,03200,BUY,APARTMENT,105000,32.0,2,1,"03200 VICHY -APPARTEMENT - 2 PIÈCES - AVEC MANSARDE ET CAVE -QUARTIER DE FRANCE- 03200 VICHY - APPARTEMENT 2 PIÈCES AVEC MANSARDE ET CAVE -QUARTIER DE FRANCE- eXp Realty France, le plus grand réseau ..."
25MW44XE17E9,2025-09-16T13:23:00Z,Vichy,Beausejour-Les Graves-Les Bartins,03200,BUY,APARTMENT,78000,38.41,2,1,"Découvrez ce charmant appartement de type T2 de 38 m², idéalement situé dans une résidence sécurisée. Il se compose d'une pièce de vie lumineuse avec une kitchenette ouverte, d'une chambre séparée po..."
25P8VF44LZW5,2025-10-08T06:02:00Z,Vichy,Deniere les Romains,03200,BUY,APARTMENT,131600,37.4,2,1,Grand Lancement - Prenez RDV avec nos conseillers pour profiter du meilleur choix ! L'ACCES A LA PROPRIETE N'A JAMAIS ETE AUSSI ACCESSIBLE ! ACHETEZ MEME SANS APPORT (1) 0 FRAIS AVANT D'EMMÉNAGER (1)...
25JES69JVMTX,2025-10-08T06:02:00Z,Vichy,Deniere les Romains,03200,BUY,APARTMENT,136600,36.15,2,1,Grand Lancement - Prenez RDV avec nos conseillers pour profiter du meilleur choix ! L'ACCES A LA PROPRIETE N'A JAMAIS ETE AUSSI ACCESSIBLE ! ACHETEZ MEME SANS APPORT (1) 0 FRAIS AVANT D'EMMÉNAGER (1)...
25H393XT5IPP,2025-10-08T06:02:00Z,Vichy,Deniere les Romains,03200,BUY,APARTMENT,119600,36.2,2,1,Grand Lancement - Prenez RDV avec nos conseillers pour profiter du meilleur choix ! L'ACCES A LA PROPRIETE N'A JAMAIS ETE AUSSI ACCESSIBLE ! ACHETEZ MEME SANS APPORT (1) 0 FRAIS AVANT D'EMMÉNAGER (1)...
25QSACH8YYF5,2025-10-08T06:02:00Z,Vichy,Deniere les Romains,03200,BUY,APARTMENT,119600,36.15,2,1,Grand Lancement - Prenez RDV avec nos conseillers pour profiter du meilleur choix ! L'ACCES A LA PROPRIETE N'A JAMAIS ETE AUSSI ACCESSIBLE ! ACHETEZ MEME SANS APPORT (1) 0 FRAIS AVANT D'EMMÉNAGER (1)...
25SA6FQM21R5,2025-10-08T06:02:00Z,Vichy,Deniere les Romains,03200,BUY,APARTMENT,129600,36.05,2,1,Grand Lancement - Prenez RDV avec nos conseillers pour profiter du meilleur choix ! L'ACCES A LA PROPRIETE N'A JAMAIS ETE AUSSI ACCESSIBLE ! ACHETEZ MEME SANS APPORT (1) 0 FRAIS AVANT D'EMMÉNAGER (1)...
25TXTJMRE86Z,2025-10-08T06:02:00Z,Vichy,Deniere les Romains,03200,BUY,APARTMENT,140600,37.1,2,1,Grand Lancement - Prenez RDV avec nos conseillers pour profiter du meilleur choix ! L'ACCES A LA PROPRIETE N'A JAMAIS ETE AUSSI ACCESSIBLE ! ACHETEZ MEME SANS APPORT (1) 0 FRAIS AVANT D'EMMÉNAGER (1)...
258I6A9UBBJI,2025-10-08T06:02:00Z,Vichy,Deniere les Romains,03200,BUY,APARTMENT,143600,36.3,2,1,Grand Lancement - Prenez RDV avec nos conseillers pour profiter du meilleur choix ! L'ACCES A LA PROPRIETE N'A JAMAIS ETE AUSSI ACCESSIBLE ! ACHETEZ MEME SANS APPORT (1) 0 FRAIS AVANT D'EMMÉNAGER (1)...
25VZGEGNQPAI,2025-10-08T06:02:00Z,Vichy,Deniere les Romains,03200,BUY,APARTMENT,119600,37.4,2,1,Grand Lancement - Prenez RDV avec nos conseillers pour profiter du meilleur choix ! L'ACCES A LA PROPRIETE N'A JAMAIS ETE AUSSI ACCESSIBLE ! ACHETEZ MEME SANS APPORT (1) 0 FRAIS AVANT D'EMMÉNAGER (1)...
25HR3DB58N7Z,2025-10-08T06:02:00Z,Vichy,Deniere les Romains,03200,BUY,APARTMENT,122600,36.3,2,1,Grand Lancement - Prenez RDV avec nos conseillers pour profiter du meilleur choix ! L'ACCES A LA PROPRIETE N'A JAMAIS ETE AUSSI ACCESSIBLE ! ACHETEZ MEME SANS APPORT (1) 0 FRAIS AVANT D'EMMÉNAGER (1)...
254EKE3ZD5JX,2025-10-06T17:13:00Z,Molinet,,03510,BUY,HOUSE,99000,103.0,6,3,"Dans le village de Molinet, à 5min de Digoin, à 35min de Moulins, venez découvrir cette maison individuelle, construite en 1955 et élevée sur un terrain de 1498 m2. Au premier niveau, le pallier vous..."
25VPP3FZVGGS,2025-10-06T14:20:00Z,Montluçon,Ville Gozet,03100,BUY,APARTMENT,41500,70.5,3,2,"Réf : 40845 EXCLUSIVITÉ ! Venez découvrir ce bel appartement à vendre situé à Montluçon. Cet appartement d'environ 70,5 m², construit dans les années 1960, offre un séjour lumineux, une cuisine aména..."
25DZC43MEBEE,2025-09-10T11:12:00Z,Montluçon,Saint Jean,03100,BUY,HOUSE,215000,169.0,8,6,"Réf 40671 Maison spacieuse à vendre à Montluçon, idéale pour grande famille . Construite en 1958 et en bon état, cette demeure de 169 m² offre 6 chambres et un séjour lumineux et spacieux , avec accè..."
25LIBNK8XH3B,2025-09-03T18:29:00Z,Commentry,Ère Zone,03600,BUY,HOUSE,99000,148.0,5,4,"COMMENTRY sans vis-à-vis, à 5 minutes de tous commerces, Venez découvrir cette charmante maison de 148m² sur deux niveaux. Un premier niveau offrant deux chambres, salle d'eau, WC, cuisine, séjour et..."
25C3N47WW4L1,2025-08-05T13:49:00Z,Montvicq,,03170,BUY,HOUSE,110000,119.5,5,4,"Référence 40630 Dans un petit village calme, proche des commerces, écoles et services, venez découvrir cette jolie maison composée en rez-de-chaussée d'une entrée avec rangement, d'une cuisine aménag..."
251PZLU6U4SI,2025-07-22T15:55:00Z,Montluçon,Dienat-Forges,03100,BUY,APARTMENT,39500,71.8,4,3,"Réf 40552 - Exclusivité Orpi Découvrez cet appartement charmant à vendre dans le quartier du Diénat, à Montluçon. Avec une surface de 71,8 m², ce logement offre trois chambres confortables et une cui..."
25E2Z9339HJP,2025-07-10T07:54:00Z,Montluçon,Chantoiseau-Faucheroux,03100,BUY,HOUSE,105000,62.71,3,2,"Réf : 40419 – Exclusivité ORPI À vendre, en exclusivité chez ORPI Allin Immobilier, une maison d'habitation sur 3 niveaux, située dans un quartier calme et proche du centre-ville de Montluçon. Édifié..."
25FBLRUIEMCL,2025-05-23T17:50:00Z,Abrest,,03200,BUY,HOUSE,355000,265.0,5,4,"Votre agence Orpi les sources à le plaisir de vous proposer à la vente cette ancienne ferme entièrement rénovée et réhabilitée en grande maison familiale. Idéalement située, à 5 min de Vichy tout en ..."
25U2SZPX62YJ,2025-01-21T15:48:00Z,Vichy,,03200,BUY,HOUSE,315000,128.0,5,3,"Située à Vichy, dans une impasse à l’abri de toute nuisance, maison totalement rénovée de manière contemporaine, décoration soignée. 128m² habitables, 200m² au sol (étage mansardé) + combles de 45m² ..."
25FD8AWYRPI6,2025-01-17T17:46:00Z,Vaux,,03190,BUY,HOUSE,75000,154.0,5,4,"EXCLUSIVITÉ ORPI Réf. 39890 Découvrez cette charmante maison de 154 m², idéalement située elle allie le cachet de l'ancien et de beaux volumes : actuellement divisée en deux appartements T3 de 77 m²,..."
25QMKBD5DEGZ,2025-01-06T17:09:00Z,Saint-Étienne-de-Vicq,,03300,BUY,HOUSE,345000,197.32,8,6,"Votre agence ORPI RIVE GAUCHE vous propose cette jolie maison bourgeoise de 197m2 habitable avec ses dépendances. Vous retrouverez au rez-de-chaussée ; une belle pièce de vie de 45m2, un second salon..."
25C25X8TC1XC,2025-11-20T03:52:00Z,Vichy,Deniere les Romains,03200,BUY,APARTMENT,219900,66.25,3,,"Black friday ! du 21 au 28 novembre uniquement, bénécifiez de 4% de remise + frais de notaire offerts* ! Envie d'un pied à terre à Vichy ? Découvrez 'Hepha'. Cette jolie résidence est située au coeur..."
2558AMTIVIY9,2025-11-20T03:52:00Z,Vichy,Deniere les Romains,03200,BUY,APARTMENT,139900,41.57,2,,"Black friday ! du 21 au 28 novembre uniquement, bénécifiez de 4% de remise + frais de notaire offerts* ! Envie d'un pied à terre à Vichy ? Découvrez 'Hepha'. Cette jolie résidence est située au coeur..."
25ZG6M7ZUALX,2025-11-13T21:14:00Z,Meaulne-Vitray,,03360,BUY,HOUSE,100000,78.0,4,3,"À Meaulne, charmante commune nichée à proximité de la célèbre forêt de Tronçais, découvrez cette maison familiale exposée plein sud, située dans un environnement calme et agréable, à seulement deux m..."
2536AHYT4WXW,2025-11-27T13:11:00Z,Montlucon,Zone Industrielle Blanzat,03100,BUY,APARTMENT,66780,85.0,4,3,"Situé au premier étage d'une petite copropriété résidentielle, cet appartement comprend une entrée, un double séjour lumineux, une cuisine aménagée, trois chambres, ainsi qu'une salle de bain avec WC..."
25N9KB1NCNPR,2025-11-21T19:23:00Z,Vaux,,03190,BUY,HOUSE,220000,119.0,5,3,"Située dans un secteur calme et recherché, cette belle maison récente de 119 m² offre des prestations de qualité et un cadre de vie idéal pour une famille. Dès l’entrée, vous serez séduit par ses vol..."
25VC4H8ENKUB,2025-11-21T18:10:00Z,Neris les Bains,,03310,BUY,HOUSE,50000,81.0,4,2,"Entre Commentry et Néris, sur secteur campagne, maison d'environ 80 m² avec une possibilité de 170 m² à rénover entièrement, 2 chambres et un bureau. Le tout sur un terrain d'environ 1377 m². Logemen..."
25DABATY2DZJ,2025-11-17T17:14:00Z,Saint Loup,,03150,BUY,HOUSE,54500,100.0,5,4,"Ref 2483: Située dans la commune de SAINT-LOUP, découvrez cette maison de PLAIN PIED comprenant en rez de chaussée: cuisine, séjour, 4 chambres, salle d'eau et WC. A l'étage un grenier entièrement am..."
25SI3F2CA9DQ,2025-11-13T04:09:00Z,Montlucon,Chantoiseau-Faucheroux,03100,BUY,PROJECT,201600,,4,3,Le Prêt 0% est de retour en 2025 et finance une partie de votre projet SANS INTÉRÊT :- Jusqu'à 30% de votre projet financé - Paiement différé jusqu'à 10 ans pour alléger vos mensualitésA MONTLUCON su...
25YABQMLLR5K,2025-11-13T04:09:00Z,Domerat,Centre,03410,BUY,PROJECT,216000,,4,3,Le Prêt 0% est de retour en 2025 et finance une partie de votre projet SANS INTÉRÊT :- Jusqu'à 30% de votre projet financé - Paiement différé jusqu'à 10 ans pour alléger vos mensualitésA DOMERAT sur ...
25NKLT6L3M47,2025-11-13T04:09:00Z,Neris-les-Bains,,03310,BUY,PROJECT,195600,,4,3,Le Prêt 0% est de retour en 2025 et finance une partie de votre projet SANS INTÉRÊT :- Jusqu'à 30% de votre projet financé - Paiement différé jusqu'à 10 ans pour alléger vos mensualitésA NERIS-LES-BA...
251I126RDEYL,2025-11-13T04:09:00Z,Bourbon-l'Archambault,,03160,BUY,PROJECT,182540,,4,3,Le Prêt 0% est de retour en 2025 et finance une partie de votre projet SANS INTÉRÊT :- Jusqu'à 30% de votre projet financé - Paiement différé jusqu'à 10 ans pour alléger vos mensualitésA BOURBON-L'AR...
25EVXDTRB7BM,2025-09-30T16:38:00Z,Commentry,Ieme Zone,03600,BUY,HOUSE,55500,57.28,3,2,"Mandat By Orpi 39870 Découvrez cette charmante maison de ville à vendre, idéalement située au cœur de Commentry, Allier. Avec ses 57,28 m², elle offre deux chambres confortables et un salon accueilla..."
25KRVXX1MS27,2025-07-31T11:42:00Z,Moulins,,03000,BUY,APARTMENT,376000,166.0,4,3,"Situé au dernier étage d'un ancien Hôtel particulier sécurisé emblématique de la ville de Moulins, cet appartement haut de gamme développe 166 m2 loi Carrez . Situé en plein coeur de ville, Il bénéfi..."
25VS5IZRKVAT,2025-08-05T11:45:00Z,Bellerive-sur-Allier,Exterieur Bas,03700,BUY,HOUSE,169000,77.71,3,2,"Votre agence Orpi les sources vous propose à la vente en exclusivité cette charmante maison des années 30, d'une siperficie de 77m² avec jardin. Située à Bellerive sur allier, proche de toutes commod..."
253D1GPRU2V7,2025-06-18T08:27:00Z,Neris-les-Bains,,03310,BUY,HOUSE,190800,162.0,9,5,"Découvrez cette maison de 160 m² habitable, offrant un cadre de vie agréable sur un terrain de 661 m² arboré, à proximité du centre-ville. Cette propriété allie le charme de l'architecture atypique à..."
255XEL8NKVFI,2025-05-28T20:13:00Z,Montluçon,La Caserne-Les Guineberts,03100,BUY,APARTMENT,85000,126.0,6,3,Dans une petite copropriété de deux logements ce joli appartement de 125 m2 possède tous les avantages d'un logement de ville. Lumineux et spacieux le séjour de 40 m2 semble presque démesuré en total...
25X9ET7P7SN6,2025-10-29T13:24:00Z,Vaumas,,03220,BUY,HOUSE,66000,80.0,4,3,"Agréable maison de bourg. Mitoyenne d' un coté, celle-ci propose au rez-de-chausée un entrée abritée, une pièce de vie avec cuisine aménagée ouverte sur salon/séjour, deux chambres donnant accès à l'..."
25MVM26ZQMZ9,2025-07-04T23:44:00Z,Valigny,,03360,BUY,HOUSE,49500,57.0,2,1,"TRANSAXIA LURCY LEVIS, SCACCHETTI Julie (EI) , vous présente au Nord de l'Allier cette maison de 57 m2 de plain pied, ainsi que ses dépendances sur un terrain de 1382m2. La maison est reliée au tout ..."
24YS2B8VLWWW,2024-07-31T07:59:00Z,Vichy,,03200,BUY,APARTMENT,810000,296.0,7,4,"Situé au dernier étage du Pavillon Sévigné, bâtiment emblématique de la ville, ce vaste appartement développe 296,77 m² loi Carrez et bénéficie d’un large balcon exposé plein ouest. Il est composé d’..."
251H44MH1MF4,2025-10-27T14:29:00Z,Billy,,03260,BUY,HOUSE,76000,75.0,5,2,"REF 2513 ! Découvrez cette charmante maison de plus de 75m² habitable comprenant au rez de chaussée une véranda donnant sur une salle à manger avec son insert bois, un salon de 15.41m², une cuisine a..."
25AIQ8RME6JG,2025-10-26T11:11:00Z,Franchesse,,03160,BUY,HOUSE,143000,223.0,10,4,iad France - Laurence Desnos vous propose: Grande maison en pierre à Franchesse (Allier) Découvrez cette splendide maison de village située à 6 km de tous commerces. Une maison chaleureuse et pleine ...
25ETKVLMMNMV,2025-10-10T23:43:00Z,Cusset,,03300,BUY,APARTMENT,210000,85.0,4,2,"Cusset Appartement T3 avec vue imprenable sur la chaîne des Puys Découvrez cet appartement lumineux d'environ 85 m², situé au 4 ème et dernier étage d'une résidence calme et bien entretenue.Un bien r..."
25F61EV9GX27,2025-10-25T02:23:00Z,Vichy,,03200,BUY,APARTMENT,174000,67.0,3,2,"Vichy, à proximité du marché couvert et du centre ville : T3 de 67.5 m² au 9ème étage d'une résidence sécurisée avec ascenseur. Composé d'un entrée, séjour double avec balcon bénéficiant d'une superb..."
25AQ3TA4JYDJ,2025-10-24T19:50:00Z,Saint-Germain-des-Fosses,,03260,BUY,HOUSE,297000,141.0,6,4,"Située à Saint-Germain-des-Fossés, dans un environnement calme et agréable, à proximité des commerces, des écoles et de la gare, cette propriété comprend un jardin clos et arboré, ainsi qu'un garage ..."
25JRGDIYJJHC,2025-10-24T18:39:00Z,Domérat,Banlieue,03410,BUY,HOUSE,125000,144.0,5,3,"Optimhome, l'agence immobilière en ligne, vous présente : En exclusivité, nous vous proposons cette maison individuelle d'une surface au sol totale de 144 m² (dont 92 m² loi Carrez), édifiée sur une ..."
25JZANGW9WT1,2025-10-24T08:18:00Z,Meillard,,03500,BUY,PROJECT,204444,,5,4,"Nous vous proposons cette maison neuve, baptisée Eolia, un modèle d'habitation qui allie élégance et fonctionnalité dans un design en L distinctif. Avec une surface habitable de 102 m², cette maison ..."
25LT3B166NE2,2025-10-21T20:17:00Z,Vichy,Marche,03200,BUY,APARTMENT,298000,62.0,3,2,"iad France - Sarah Rozière vous propose : Appartement 3 pièces avec loggia – COEur de ville de Vichy – Résidence Millésime 1853 L'appartement proposé est un trois-pièces de 62,4 m² environ habitables..."
25WZTQ3L11WV,2025-10-21T19:54:00Z,Montlucon,Chatelard-La Verne-Nerdre,03100,BUY,HOUSE,139000,103.0,6,5,"Située dans la ville de Montluçon (03100), cette maison rénovée bénéficie d'un emplacement idéal, à proximité des écoles, du lycée et du collège. Les transports en commun tels que les bus et les trai..."
25W535AYCQ4L,2025-10-21T10:59:00Z,Montluçon,Ville Gozet,03100,BUY,APARTMENT,38000,89.19,3,2,"Réf : 41013 Venez découvrir cet appartement à vendre, proche d'une école et des transports en commun. Cet appartement d'environ 89 m², offre un bon potentiel avec un état général correct et des volum..."
24FSQCC2S3FP,2024-08-03T08:48:00Z,Cognat-Lyonne,,03110,BUY,PROJECT,263300,,4,3,"À saisir : superbe terrain non-viabilisé de 1 050 m², idéalement situé dans la charmante commune de Cognat-Lyonne, dans le département de l'Allier (03110). Ce bien d'exception vous offre une opportun..."
25LL9ACHWNWU,2025-01-10T08:52:00Z,Paray-sous-Briailles,,03500,BUY,PROJECT,233500,,4,3,"Découvrez ce terrain exceptionnel à vendre, offrant une surface généreuse de 750 m², idéalement situé dans un lotissement prometteur. Ce terrain viabilisé présente un véritable atout pour les acheteu..."
25PDMCDVM9D4,2025-10-18T08:28:00Z,Voussac,,03140,BUY,HOUSE,98100,81.0,3,2,"Cette maison est sous compromis de vente et n'est plus disponible Charmante maison de 81 m², construite en 1880, parfaitement entretenue et idéale pour une vie familiale paisible. Elle offre 2 chambr..."
25ZU8U8LQLXU,2025-10-18T01:18:00Z,Bellerive sur Allier,,03700,BUY,HOUSE,199000,92.0,5,3,"Bellerive, à proximité immédiate des berges de l'allier, maison de 92 m² divisée en 2 appartements. Composée au rdc d'un appartement T3 avec séjour, cuisine, 2 chambres, salle de bains et wc. A l'éta..."
25CUV3S3Z68B,2025-03-24T14:24:00Z,Lapalisse,,03120,BUY,HOUSE,97000,69.0,5,2,"Référence annonce : 2472 aux portes de Lapalisse, découvrez cet ancien corps de ferme offrant un beau potentiel. L'habitation principale, en partie sur sous-sol, propose une vie de plain-pied avec vé..."
2459CMVVAJFL,2024-12-24T08:11:00Z,Vichy,Marche,03200,BUY,APARTMENT,110210,50.29,4,2,"T3 au 4 Chemins - A une centaine de mètres des 4 Chemins, et donc des transports, commerces et écoles, dans une résidence sécurisée, nous vous proposons cet appartement au 6ème et dernier étage (asce..."
25CQADANCFGX,2025-10-16T17:06:00Z,Bézenet,,03170,BUY,HOUSE,214000,151.0,5,4,"Réf: 40882 Belle maison familiale construite en 2008, d'environ 151 m², sans travaux à prévoir ! Ce pavillon se compose en rez-de-chaussée d'un spacieux séjour avec cuisine ouverte, d'une grande sall..."
25VLFW6VCILI,2025-09-19T14:12:00Z,Le Mayet-de-Montagne,,03250,BUY,HOUSE,234000,100.43,4,3,"Maison neuve à vendre, proche d'une école et des transports en commun. Cette construction 2023 de 100,43 m² se distingue par son état impeccable et ses prestations contemporaines. Elle offre un séjou..."
257USUE4PSYY,2025-09-10T10:10:00Z,Moulins,Decize Bourgogne,03000,BUY,HOUSE,999000,900.0,32,10,"iad France - Johan JOYON vous propose: En plein cOEur de Moulins, venez découvrir ce château pouvant correspondre à de nombreux projets. Il se compose d'un bâtiment principal de 400m2, un bâtiment an..."
25I6EZMLWLEP,2025-06-05T22:13:00Z,St Bonnet Troncais,,03360,BUY,HOUSE,150000,102.0,4,2,"Situé à deux pas du village d'Ainay-le-Château et à proximité, immédiate de toutes les commodités, ce pavillon offre un cadre de vie calme et agréable. Composée d'une entrée, un vaste salon/séjour lu..."
25CZV7NUQBVZ,2025-10-14T11:14:00Z,Le Donjon,,03130,BUY,HOUSE,87000,72.0,6,3,"Réf. 2544 Sur la commune de Le Donjon, découvrez cette agréable propriété habitable immédiatement, élevée sur un sous-sol total et offrant un beau potentiel après quelques travaux de rafraîchissement..."
25TFAYDDVFHY,2025-10-13T19:19:00Z,Cusset,Centre Historique,03300,BUY,APARTMENT,115000,51.0,2,1,"Situé en plein cœur du centre-ville de Cusset, à proximité immédiate de toutes les commodités, ce charmant appartement ne nécessite aucun travaux. Implanté en fond de cour, au premier étage d'un peti..."
25BWHM9QZPJG,2025-10-13T17:54:00Z,Neris-les-Bains,,03310,BUY,HOUSE,378000,275.0,6,4,"Située dans un environnement paisible et prisé à proximité du centre ville, cette belle maison familiale des années 70, édifiée sur un sous-sol total, offre une superficie généreuse d'environ 275 m² ..."
25RJX54AB9TX,2025-10-11T16:36:00Z,Domérat,Campagne,03410,BUY,HOUSE,280000,134.0,4,3,"À vendre : Charmante maison de 134 m² entièrement de plain pied,située à Domérat, Allier, offrant un cadre de vie exceptionnel. Cette propriété en très bon état est parfaite pour une famille à la rec..."
25H9KMVQMLI6,2025-10-11T14:28:00Z,Montluçon,Marais-Villars,03100,BUY,APARTMENT,70000,59.81,3,2,"Référence : 40864 Aucun travaux de copropriété à prévoir ! Venez découvrir ce bel appartement traversant, entièrement rénové dans lequel, vous n'aurez plus qu'à poser vos valises. Dans une petite rés..."
251VLMT6W8CT,2025-10-10T09:32:00Z,Vallon-en-Sully,,03190,BUY,HOUSE,199000,82.0,4,3,"EXCLUSIVITE ORPI 40862 Bien rare sur le secteur Dans un village avec toutes les commodités, écoles de la maternelle jusqu'au collège, une gare SNCF, boutiques, restaurants, et professionnels de santé..."
2552NXDPUI5E,2025-10-09T17:06:00Z,Vichy,Deniere les Romains,03200,BUY,APARTMENT,59600,45.3,2,1,"L'Agence Orpi Vichy Les Sources vous propose en exclusivité: Dans un quartier calme, au bord du Sichon et proche du quartier Jeanne d'Arc. Dans une petite copropriété de 2 lots d'habitation, nn appar..."
25ZUC3AFZMFE,2025-10-09T12:54:00Z,Varennes-sur-Allier,,03150,BUY,HOUSE,372000,311.0,11,5,"Venez découvrir cette maison aux grands espaces de vie, au cœur de la ville de Varennes Sur Allier, proche des commerces. Au premier étage, une entrée donnant sur un couloir qui dessert une chambre d..."
25KKD424M5IX,2025-02-08T16:47:00Z,Domérat,Campagne,03410,BUY,HOUSE,280000,134.0,4,3,"À vendre : Charmante maison de 134 m² entièrement de plain pied,située à Domérat, Allier, offrant un cadre de vie exceptionnel. Cette propriété en très bon état est parfaite pour une famille à la rec..."
254LE3R6ZQB5,2025-02-12T11:47:00Z,Coulanges,,03470,BUY,HOUSE,149000,190.0,8,3,L'agence BOURBON LANCY IMMOBILIER (zéro six quatre vingt sept trente quatre cinquante sept soixante douze) vous propose à COULANGES (03470) ensemble immobilier comprenant corps de ferme mitoyen rénov...
259ZLNY3HTDB,2025-04-07T21:37:00Z,Vichy,Marche,03200,BUY,APARTMENT,132000,70.0,2,1,"Appartement 2 pièces de 70 m² à rénover dans une superbe résidence en centre-ville, avec mansarde et cave ! Situé au 5ème étage avec ascenseur d'une résidence haut de gamme et très calme, cet apparte..."
252R7TK76EFS,2025-10-06T10:59:00Z,Montlucon,La Caserne-Les Guineberts,03100,BUY,APARTMENT,34000,67.0,3,1,"Dans une résidence, proche du lycée Paul Constans, cet appartement est situé au 1er étage sans ascenseur avec accès sécurisé par digicode. Il dispose d'une entrée ouvrant sur un salon-séjour double a..."
25DXASGNR2X9,2025-10-01T11:11:00Z,Vichy,Marche,03200,BUY,APARTMENT,285000,105.11,4,2,"VICHY - Un Appartement de type 3 (lot 24) situé au 1er étage, composé de : Entrée, couloir, 1 chambre, salle d'eau + wc, salon-séjour, bureau, cuisine, buanderie, wc. Cave (lot 04) au sous-sol. Le pr..."
25ZBEV7ZYBJR,2025-09-29T13:47:00Z,Vichy,Marche,03200,BUY,APARTMENT,222600,91.08,3,2,"Bel appartement en copropriété à vendre, idéalement situé au cœur de Vichy, à proximité d'une école et des transports en commun. Construit en 2000, cet appartement de 91,08 m² offre un cadre de vie c..."
