id,creationDate,city,district,zipCode,distributionType,propertyType,price,surface,nbroom,nbbedroom,description
25QJ7UDRYIP9,2025-08-12T17:29:00Z,Dole,Zone Portuaire-Le Boichot,39100,BUY,HOUSE,180000,99.0,4,3,"Maison mitoyenne – Quartier calme à Dole Venez poser vos valises dans cette agréable maison mitoyenne sur deux niveaux, située dans un environnement paisible tout en restant proche des commodités. Au..."
25PM9ZR7EE2H,2025-06-25T09:34:00Z,Doucier,,39130,BUY,HOUSE,101600,114.0,5,3,"Beau potentiel pour cette maison à rénover située proche du Lac de Chalain. D'une superficie d'env 114 m² sur une parcelle de terrain de 875 m². Actuellement une cuisine, un salon, sanitaires, 3 cham..."
2537BX8UJQA2,2025-06-13T05:40:00Z,Chaussin,,39120,BUY,HOUSE,179000,180.0,6,4,"Bel immeuble rénové en 1997 composé de 2 lots : un cabinet médical en rez-de-chaussée avec accès PMR, accueil, salle d'attente, 2 salles de soins, 1 bureau, chaufferie, WC, laboratoire, l'ensemble po..."
253NSYBNGXAJ,2025-04-24T11:19:00Z,La Tour-du-Meix,,39270,BUY,HOUSE,300000,194.4,11,3,Une exclusivité l'immobilière Franco Suisse. Idéalement située à la Tour du Meix dans un petit village calme et à seulement 5 minutes du Lac de Vouglans et 5 minutes d'Orgelet et toutes les commodité...
2442RJ426Y66,2024-05-07T14:18:00Z,Dole,,39100,BUY,APARTMENT,37500,63.62,4,1,Immobilier.notaires® et l'office notarial BARTHEN et associés vous proposent : Appartement à vendre en viager - DOLE (39100) - - - - - - - - - - - Commune : DOLE (39100)quartier Azans Vente en viager...
255YC2S4I4GY,2025-11-08T17:14:00Z,Le Deschaux,,39120,BUY,APARTMENT,198000,103.0,4,3,"Situé sur la commune du Deschaux, dans une copropriété entièrement rénovée du sol jusqu'au toit, cet appartement offre un cadre de vie agréable, moderne et sans aucun travaux à prévoir. D'une surface..."
25RRIFBHY6E3,2025-11-03T19:07:00Z,La Chailleuse,,39270,BUY,HOUSE,675000,216.0,9,4,"À vendre , Havre de paix en pleine nature : maison en pierre et bois de caractère Laissez-vous séduire par cette maison d'exception de 218 m2 nichée au coeur d'une forêt préservée, dans un environnem..."
25IARBS1UTWY,2025-11-29T11:58:00Z,Clairvaux-les-Lacs,,39130,BUY,HOUSE,175000,148.0,7,3,REF 2410- Située dans un village prisé de la région des lacs à 5 mm de toutes commodités commerces et écoles et à 5 mm du lac de Vouglans cette ferme mitoyenne en pierre apparente en partie rénovée s...
25FL79M5SAWM,2025-11-17T09:22:00Z,Lons le Saunier,Préfecture,39000,BUY,APARTMENT,190000,79.0,3,2,"A Lons-Le-Saunier, situé dans une petite copropriété de standing entre le centre ville et la gare, cet appartement traversant et lumineux, se situe au 4ème étage avec ascenseur il comprend : entrée a..."
25D523V9UXGE,2025-02-07T23:12:00Z,Lons le Saunier,,39000,BUY,HOUSE,398000,160.0,7,6,"Maison Individuelle de Plain-Pied - 6 Chambres - Proche Lons-le-Saunier À seulement 5 km de Lons-le-Saunier, découvrez cette magnifique maison individuelle de plain-pied offrant des prestations haut ..."
257RD5HBQ1R5,2025-06-13T23:55:00Z,Bletterans,,39140,BUY,HOUSE,220000,153.0,6,3,"Découvrez ce joli pavillon de 153m² construit en 2003, situé dans un environnement paisible tout en étant à 7 mins de Bletterans ! Cette maison offre une belle entrée avec un grand placard, une grand..."
25E8E2RFLBNQ,2025-11-05T11:19:00Z,Saint-Germain-en-Montagne,,39300,BUY,HOUSE,185000,116.0,7,4,iad France - Xavier Verriere vous propose:
25R8LR8ZTWID,2025-10-30T16:06:00Z,Beaufort,,39190,BUY,HOUSE,147000,113.0,5,4,"Laforêt Cousance vous propose cette villa sur sous sol, située sur la commune de Beaufort, proche de toutes commodités. Elle comprend: Entrée, cuisine intégrée, salon d'env 30 m², 3 chambres, Salle d..."
25YX1228EY1K,2025-10-02T09:43:00Z,Bletterans,,39140,BUY,HOUSE,129000,160.0,5,3,Ref 2205CSAV : Venez découvrir cette maison au fort potentiel sur le secteur de Bletterans. Caractéristiques Principales : Cuisine : Une spacieuse cuisine Salle de Bain : Fonctionnelle et pratique Gr...
25575CP4QFVT,2025-10-24T13:10:00Z,Champagnole,,39300,BUY,HOUSE,320000,143.0,6,4,"Située à seulement 10 minutes de Champagnole, cette belle maison familiale de 143m2 offre un cadre de vie idéal, au calme, avec de beaux volumes et de nombreuses prestations. Espace de vie et chambre..."
25AQELAW4F2I,2025-10-22T06:34:00Z,Pont de Poitte,,39130,BUY,HOUSE,270000,309.0,4,5,Fiche Id-SLG178136 : Située sur la commune de Pont-de-Poitte (39130) à seulement 15min du lac de Clairvaux - du lac de Vouglans et du Port de La Saisse. Cette propriété de 309m² - construite en 1968 ...
25N2BQCWVZQ8,2025-07-07T15:59:00Z,Dole,Zone Portuaire-Le Boichot,39100,BUY,APARTMENT,170000,124.0,4,2,"Votre agence Bersot immobilier vous propose ce bel appartement T4 rénové de 124 m² situé au calme, à Brevans proche du canal et aux portes de Dole. Au rez-de-chaussée d'une petite copropriété, cet ap..."
25I91TA9Y56E,2025-04-14T11:55:00Z,Val Suran,,39320,BUY,HOUSE,110000,90.0,2,1,"Maison à rénover avec terrasse, garage et parking et terrain à proximité Fort potentiel ! Maison mitoyenne des deux côtés offre un très beau potentiel après rénovation. Elle se compose en rez-de-chau..."
25CJE9ZW6B11,2025-10-17T13:27:00Z,Salins-les-Bains,,39110,BUY,HOUSE,211000,96.0,4,2,"Située dans le charmant village de Pont-d'Héry , cette maison en pierre plain-pied offre un cadre de vie agréable, idéal pour les amoureux de la campagne. Son emplacement permet de profiter d'un envi..."
25GPYKX6R8EC,2025-10-14T12:58:00Z,Cernon,,39240,BUY,HOUSE,233000,132.0,4,3,"Cernon (39240) est une charmante commune de 230 habitants, située à proximité du célèbre barrage de Vouglans, à seulement 14 km d'Arinthod et 16 km de Moirans-en-Montagne. Je vous invite à découvrir ..."
25PP6JBVV7Z9,2025-10-08T13:18:00Z,Saint-Claude,Les Avignonnets,39200,BUY,APARTMENT,125500,117.0,7,3,"Situé à Saint-Claude (39200), cet appartement bénéficie d'un cadre de vie paisible et agréable, propice à la tranquillité. La ville offre un environnement calme avec des espaces verts à proximité, id..."
25CTPQT7AQIJ,2025-09-27T11:06:00Z,Dole,Faubourg de Chalon,39100,BUY,HOUSE,697000,233.0,6,4,"DOLE - Maison de charme rénovée avec vue imprenable sur le Doubs À seulement quelques pas des rives du Doubs, cette élégante maison de charme de 250 m² allie avec finesse le cachet de l'ancien et le ..."
256WJJUX2B24,2025-06-25T02:03:00Z,Plainoiseau,,39210,BUY,HOUSE,398000,160.0,7,6,"Maison contemporaine de 160m² avec piscine. Plainoiseau (Jura) A seulement 5 minutes de Lons-le-Saunier, dans un environnement paisible, découvrez cette maison neuve de 2023 offrant des prestations h..."
25LMXG7Y8TS1,2025-06-16T15:30:00Z,Mont-sous-Vaudrey,,39380,BUY,HOUSE,199000,130.0,2,1,"À VENDRE – HAVRE DE PAIX AU CŒUR DE LA NATURE JURASSIENNE Vous rêvez de calme, de verdure et d'un cadre de vie ressourçant ? Cette propriété est faite pour vous ! Située dans un écrin de nature, idéa..."
25G2E6PQQ1HR,2025-06-12T12:58:00Z,Champagnole,Valentenouze,39300,BUY,HOUSE,230000,137.0,6,4,"Située à Champagnole (39300), cette propriété est installée dans un quartier calme, proche des écoles, services et commodités. La ville offre un cadre de vie agréable tout en restant bien desservie. ..."
25ANBRZJGKEM,2025-05-21T12:18:00Z,Marnoz,,39110,BUY,HOUSE,179000,109.0,9,6,"Située à Marnoz (JURA), à 10 minutes d'ARBOIS et de SALINS LES BAINS, cette maison bénéficie d'un cadre paisible et verdoyant, idéal pour les amoureux de la nature. Proche des commodités locales, ell..."
2534ZSGS5ET7,2025-11-22T14:15:00Z,Montholier,,39800,BUY,HOUSE,405000,244.0,8,6,"Nichée au coeur d'un environnement verdoyant, cette élégante maison d'architecte des années 1960 déploie tout son charme sur 244 m² habitables, au sein d'un magnifique terrain clos et arboré de 1 564..."
25T5IYZWBW8L,2025-11-19T17:24:00Z,Foncine le Haut,,39460,BUY,APARTMENT,212000,302.0,12,6,"Secteur Foncine le Haut, opportunité investisseurs pour cet immeuble de rapport à rafraîchir , très bien situé proche frontière, disposant de 3 appartements avec greniers, caves et 3 garages, compren..."
2533HIZ29PN9,2025-11-18T21:41:00Z,Lamoura,,39310,BUY,HOUSE,540000,200.0,5,10,"Idéalement situé à La Serra dans un cadre naturel, proche des stations de skis, découvrez ce beau chalet bois sur 775m2 de terrain. La maison principale dispose d'une pièce de vie ouverte sur le balc..."
257B73FSEHVG,2025-11-20T20:14:00Z,Cousance,,39190,BUY,HOUSE,299000,181.0,7,5,"// EXCLUSIVITÉ SAFTI // Secteur Cousance. Maison individuelle d'architecte, de 181 m² habitables, sur un terrain de 1505 m², située dans un environnement calme, proche de toutes commodités, dont les ..."
259LTH7I62XU,2025-11-20T12:59:00Z,Valempoulières,,39300,BUY,HOUSE,180000,223.0,8,5,"Idéalement située en pleine campagne, proche des chemins de randonnée, et à seulement 10 min Champagnole, Cette propriété au cadre verdoyant comprend une vaste maison d'habitation, des granges, écuri..."
25F1D6MQDIUL,2025-11-14T14:29:00Z,La Chailleuse,,39570,BUY,HOUSE,159000,120.0,6,4,"Située à La Chailleuse, cette maison en pierres, mitoyenne d'un côté, bénéficie d'un environnement paisible avec vue imprenable. Son exposition sud-est assure une luminosité optimale tout au long de ..."
25SUJH3QE3VY,2025-11-03T14:07:00Z,Champagnole,Centre Ville-Zone Industrielle,39300,BUY,HOUSE,295000,212.0,10,5,"Située à Champagnole, cette maison installée sur un terrain clos de 412 m² dispose d'une cour avec places de parking, un abri pour 2 voitures et une dépendance. Proche du centre ville, l'habitation d..."
25D3CB2JLVQ3,2025-10-24T10:04:00Z,Hauts de Bienne,Villedieu-Le Puits,39400,BUY,HOUSE,325000,129.0,5,4,"iad France - Laure Rochaix vous propose: MAISON individuelle d'environ 140 m², située à Hauts de Bienne ( Morez) , quartier calme et très ensoleillé. À vendre à Morez, charmante maison d'habitation i..."
25HJ1XHU5DCL,2025-11-04T19:00:00Z,Dole,Azans-La Bedugue,39100,BUY,HOUSE,295000,124.0,6,3,"Maison en pierre rénovée Quartier prisé d'Azans STEPHANE PLAZA IMMOBILIER DOLE vous présente cette superbe maison en pierres de 150 m² au sol , parfait compromis entre appartement et maison, entièrem..."
25FU48PPY3FE,2025-11-17T15:08:00Z,Lons-le-Saunier,Val du Solvan,39000,BUY,HOUSE,235000,121.85,5,3,"Réf: 2403AUC – Secteur Lons Nord – Maison individuelle avec grand terrain ! Découvrez cette maison individuelle de 1974, implantée sur un magnifique terrain de 1 360 m², offrant de beaux volumes et u..."
25AWFUWZX1XQ,2025-08-01T12:58:00Z,Cousance,,39190,BUY,HOUSE,150000,131.0,4,3,"Située à Cousance (39190), non loin de la région des Lacs du Jura, cette maison offre un cadre paisible et sans vis-à-vis, idéal pour les amoureux de la nature et de la tranquillité. Nichée dans un e..."
258PMFEXYLPF,2025-09-02T13:08:00Z,Mont-sous-Vaudrey,,39380,BUY,HOUSE,294000,100.0,5,3,"A 5 min de MONT-SOUS-VAUDREY, dans un village calme avec commerces, venez découvrir cet ensemble immobilier composé d'une maison d'habitation, une maison en pierres et des dépendances. Maison d'habit..."
25KS7VNXRPMF,2025-09-12T06:04:00Z,Les Rousses,,39220,BUY,APARTMENT,428000,80.0,4,,"""LES CASCADES"" Nouvelle résidence de 41 logements aux Rousses Au lotissement Les Crétêts, un emplacement choisi pour vous offrir un cadre de vie idéal. Vous recherchez un logement à l’architecture mo..."
25P58N9ILR5W,2025-11-19T17:19:00Z,Montmorot,,39570,BUY,APARTMENT,139900,82.0,3,2,"A 5 minutes à pied du centre-ville, cet appartement se situe au rez-de-chaussée surélevé d'une résidence calme et bien entretenue. Bien exposé et lumineux vous disposerez d'un salon séjour avec balco..."
255X5VAGHQ56,2025-11-12T09:21:00Z,Sirod,,39300,BUY,HOUSE,520000,188.0,6,1,"Une exclusivité de L'Immobilière Franco-Suisse Sur la commune de SIROD là où la ville s'efface doucement au profit des arbres et de la rivière de l'Ain et du silence, cette maison des années 1880 ref..."
25YIKRCBH564,2025-11-27T15:31:00Z,Domblans,,39210,BUY,HOUSE,268000,100.0,5,3,"Réf 2340AC: Située dans un charmant village offrant toutes les commodités et des écoles à proximité, cette maison individuelle propose un cadre de vie agréable et fonctionnel, idéal pour une famille...."
25QSYCYGU58N,2025-11-04T22:38:00Z,Chevigny,,39290,BUY,HOUSE,140000,110.0,5,4,"Maison à rénover pleine de charme – beaux volumes, dépendances et fort potentiel ! Vous rêvez d'un lieu à façonner à votre image ? Cette maison pleine de caractère, nichée dans un environnement calme..."
25TSPFXURCEW,2025-07-16T12:34:00Z,Authume,,39100,BUY,HOUSE,429000,130.0,6,4,Emmanuel PAILLOT vous propose cette propriété entièrement de plain-pied qui bénéficie d'un emplacement privilégié offrant un cadre de vie paisible et convivial. Authume se distingue non seulement par...
25UYGDPAVSFM,2025-07-10T16:22:00Z,Dole,,39100,BUY,HOUSE,250000,140.0,5,1,"Maison de village avec 2,6 hectares de prés Réf 69905AH : Le Villey Située dans un petit village au calme, cette maison en pierre de 140 m² est divisée en deux logements avec une dépendance en pierre..."
25BVF4QTAP37,2025-10-10T12:22:00Z,Lamoura,,39310,BUY,HOUSE,410000,98.81,5,4,"Maison familiale à Lamoura avec 4 chambres Réf 70007MBB : LAMOURA Découvrez cette charmante maison, idéale pour accueillir votre famille. Avec ses quatre chambres, elle offre un cadre de vie conforta..."
253PQH1326UI,2025-10-31T09:24:00Z,Martigna,,39260,BUY,HOUSE,330000,300.0,8,1,"Martigna, Hameau de Chanon, propriété rurale à rénover. Le bien est composé d'une partie gîte avec location saisonnière et une partie ferme à rénover. terrain attenant de 3 hectares Contact : Sadrija..."
258ZB2JLKN6W,2025-10-22T10:27:00Z,Chaussin,,39120,BUY,HOUSE,245000,168.0,8,5,"Située à 5 mn à pied du centre de CHAUSSIN, venez découvrir cette grande maison d'architecte d'environ 168 m² qui comprend de plain-pied une grande entrée, une cuisine aménagée, un grand séjour/salon..."
25Q3D49IKBYG,2025-07-04T08:48:00Z,Les Hays,,39120,BUY,PROJECT,235130,,5,4,"Sur ce terrain, nous vous proposons cette maison neuve, la Sauvetière, conçue par Babeau-Seguin, constructeur offrant le meilleur rapport qualité/prix du marché. Cette maison de 107 m², à classer san..."
254WVDWSCSXT,2025-07-01T08:34:00Z,Crotenay,,39300,BUY,PROJECT,286130,,5,4,"Sur ce terrain, nous vous proposons cette maison neuve, la Sauvetière, conçue par Babeau-Seguin, constructeur offrant le meilleur rapport qualité/prix du marché. Cette maison de 107 m², à classer san..."
252AJTH2ATTW,2025-07-09T00:38:00Z,Cramans,,39600,BUY,PROJECT,240130,,5,4,"Sur ce terrain, nous vous proposons cette maison neuve, la Sauvetière, conçue par Babeau-Seguin, constructeur offrant le meilleur rapport qualité/prix du marché. Cette maison de 107 m², à classer san..."
25BRE8M9BL3C,2025-07-04T08:48:00Z,Auxange,,39700,BUY,PROJECT,166474,,4,3,"Sur ce terrain, nous vous proposons cette maison neuve : la Focus Tiny, un modèle idéal pour les familles à la recherche d'un logement confortable et économique. Conçue par Babeau-Seguin, constructeu..."
259AQ2IXCGEH,2025-09-17T15:06:00Z,Tavaux,,39500,BUY,HOUSE,168000,98.0,5,3,"Sur la commune de TAVAUX Maison de année 70 sur sous-sol complet comprenant une spacieuse entrée, un salon/séjour avec cheminée et accès sur le jardin, une cuisine indépendante, trois chambres, une s..."
25XFHA51U3L5,2025-10-17T23:18:00Z,Conliège,,39570,BUY,HOUSE,199000,136.0,6,3,"A quelques minutes de Lons le Saunier, venez découvrir cette maison de village en pierre avec beaucoup de cachet composée au rez de chaussée, d'un séjour salon avec son plafond à la française et sa g..."
25YNX2U67DX6,2025-10-07T08:44:00Z,Montrond,,39300,BUY,HOUSE,210000,185.0,5,3,Dans la commune de Montrond à 15 minutes de Poligny et 10 minutes de Champagnole vous trouverez cette maison dans un cadre de vie sain. Cette maison écologique en paille permet une excellente isolati...
259DSPH1LT2X,2025-01-16T17:07:00Z,Sarrogna,,39270,BUY,HOUSE,130000,117.6,5,3,"Idéalement située sur la commune de Sarrogna (Nermier), dans un village calme et paisible et à seulement 10 minutes des commodités (écoles, médecins, commerces) et du lac de Vouglans. Venez découvrir..."
24148A3BDFWI,2024-10-24T12:23:00Z,Grande Riviere Chateau,,39150,BUY,HOUSE,180000,170.0,8,4,"IMMEUBLE à vendre 170m² sur un terrain de 840m² à Grande-Rivière-Château A Grande-Rivière-Château, commune du Haut-Jura, à deux pas du lac de l'abbaye, au milieu des près et des fermes environnantes ..."
25YY2CIN2A5G,2025-08-19T08:43:00Z,Équevillon,,39300,BUY,PROJECT,203474,,4,3,"Sur ce terrain, nous vous proposons cette maison neuve : la Focus Tiny, un modèle idéal pour les familles à la recherche d'un logement confortable et économique. Conçue par Babeau-Seguin, constructeu..."
25RT2SB7FCQV,2025-08-05T10:29:00Z,Chapelle Voland,,39140,BUY,HOUSE,475000,207.0,7,4,"Nichée au coeur de la Bresse, cette magnifique propriété allie charme authentique et confort moderne. Implantée sur un terrain de 14244m2 libre, elle offre un cadre paisible avec pré, mare et puits, ..."
25JP47JBCG6N,2025-07-04T17:08:00Z,Saint-Laurent-en-Grandvaux,,39150,BUY,HOUSE,230000,129.0,8,5,"Une exclusivité l'immobilière Franco Suisse. Idéalement située à 2 minutes à pied du centre ville de Saint Laurent en Grandvaux et des commodités (écoles, médecins, commerces). Maison individuelle de..."
25A16WY1IDHA,2025-06-13T19:43:00Z,Tavaux,,39500,BUY,HOUSE,249000,148.0,7,4,"Belle maison familiale idéalement placée proche bois des vernaux, accès collège par piste cyclable et écoles primaire et maternelle à quelques minutes à pied, tout comme les commerces. Elle possède 4..."
25D9ZEIF75ME,2025-11-19T16:31:00Z,Lons le Saunier,Centre,39000,BUY,APARTMENT,295000,168.0,7,2,"Bien d'exception à ne pas manquer ! Situé au coeur de Lons-le-Saunier cet appartement de style haussmannien, allie tout le charme de l'ancien avec ses hauteurs sous plafond, ses grands volumes, moulu..."
258G9HN3QDLQ,2025-11-07T13:52:00Z,Pillemoine,,39300,BUY,HOUSE,195000,113.0,5,3,"Située à Pillemoine, cette propriété de 2 880 m² bénéficie d'un emplacement paisible et verdoyant, idéal pour les amateurs de tranquillité. L'habitation de 113 m² dispose d'un sous-sol total. Elle s'..."
25PGQ664SX2S,2025-11-17T15:08:00Z,Orgelet,,39270,BUY,HOUSE,280000,240.0,12,7,"Réf:2364/2365AUCAV Maison familiale de 12 pièces avec dépendances. Dans un environnement privilégié, calme et verdoyant, découvrez cette spacieuse maison individuelle offrant un confort rare et de no..."
25BZHUVFD8SR,2025-11-14T17:22:00Z,Morbier,,39400,BUY,HOUSE,280000,115.87,4,2,"Maison à Morbier : 115m², 2 chambres Réf. 70250MBB Découvrez cette maison située à Morbier, offrant un cadre de vie agréable avec une superficie de 115,87 m². Idéale pour une famille, ce bien dispose..."
254APRKWIJLI,2025-10-27T15:19:00Z,Dole,,39100,BUY,HOUSE,300000,127.0,6,4,"Immobilier.notaires® et l'office notarial BARTHEN et associés vous proposent : Maison / villa à vendre - DOLE (39100) - - - - - - - - - - - DOLE 39100 Une maison d'habitation d'une surface de 127 m²,..."
25ZXX68MVHVB,2025-10-29T14:18:00Z,Lajoux,,39310,BUY,HOUSE,320000,130.0,5,,"Au cœur du village, découvrez cette maison au fort potentiel, édifiée sur 824 m² de terrain constructible. Ses 130 m² habitables, complétés par des combles aménageables, offrent de belles possibilité..."
25U75NRUUNGK,2025-11-06T07:41:00Z,Arlay,,39140,BUY,HOUSE,149000,75.0,4,2,"Ref 2373CR : Maison de village pleine de charme à Arlay, offrant une surface habitable de 75 m² dans une rue paisible du village. Cette maison coup de cœur ne nécessite aucun travaux et séduit par so..."
2521SXCDPPUL,2025-11-24T15:28:00Z,Lons-le-Saunier,,39000,BUY,HOUSE,210000,158.0,6,3,"Ref 2369PHD Dans un village dynamique à proximité de lons le saunier, offrant plusieurs commodités, avec école maternelle et primaire à proximité, découvrez cette charmante maison alliant authenticit..."
25ILLBVZ29EH,2025-10-03T13:12:00Z,La Mouille,,39400,BUY,HOUSE,130000,133.0,5,3,"BIEN SOUS OFFRE A La Mouille, commune idéalement située entre Hauts de Bienne et Longchaumois, à 20 min de la frontière Suisse. Venez découvrir sur un terrain de 194m² cette maison mitoyenne composée..."
2582C2B46TP6,2025-09-17T16:33:00Z,Saint Maur,,39570,BUY,HOUSE,199000,113.0,7,5,"Laforêt Lons-le-Saunier vous propose en exclusivité cette charmante maison de plain-pied de 113m² env. située au calme, à Saint-Maur. Elle se compose de : 5 chambres, un salon-séjour de 27m² env., un..."
256DBPP24VF3,2025-10-27T13:56:00Z,Saint-Laurent-en-Grandvaux,,39150,BUY,HOUSE,480000,196.0,7,4,"Découvrez cette spacieuse maison rénovée de 196m² habitables, idéalement située dans un quartier calme à deux pas de toutes les commodités à St-Laurent-en-Grandvaux, au coeur du Haut-Jura. Parfaiteme..."
2511LX5RE5BP,2025-09-24T04:49:00Z,Dole,,39100,BUY,HOUSE,364000,234.0,7,4,"DOLE, belle adresse et emplacement de choix pour cette maison de ville comprenant deux niveaux : Au rez-de-chaussée un hall d'entrée , 4 pièces , vaste dégagement , chaufferie accès sur cour intérieu..."
25YBH9U7WQZ1,2025-06-24T09:38:00Z,Champagnole,Gratteloup-Louataux,39300,BUY,APARTMENT,95000,57.0,2,1,dans un quartier calme et proche de toutes commodités - 10mn du centre ville - Cet appartement est situé au 3-ème étage d'une copropriété gérée par un syndic - idéal pour investissement locatif ou pr...
25A5LACUKJ45,2025-10-14T03:39:00Z,Hauts de Bienne,Haut et Dessus,39400,BUY,APARTMENT,95000,139.0,8,4,"iad France - Sandrine Falce vous propose: Opportunité de Rénovation - Appartement Familial de 139m² Situé au cOEur des Hauts de Bienne, cet appartement spacieux de 139m² offre un potentiel exceptionn..."
25VHHRRYMY5H,2025-07-21T00:52:00Z,Dole,Centre Ville,39100,BUY,HOUSE,995000,420.0,15,8,"À seulement 2h de Paris et 30 mn de Dijon, belle propriété avec dépendance sur parc clos joliment arboré de 9 hectares . Sa situation privilégiée et son bon état général en font un lieu propice à une..."
25DK6GITLTR4,2025-10-09T19:22:00Z,Salins-les-Bains,,39110,BUY,HOUSE,265000,121.0,8,4,"En exclusivité, venez découvrir ce charmant pavillon sur sous-sol complet, rénové, construit en 1974, idéalement situé à Salins-les-Bains, à proximité de toutes commodités et dans un environnement ca..."
251EZUT6ALUE,2025-10-02T18:34:00Z,Dole,Faubourg de Chalon,39100,BUY,HOUSE,275000,127.0,5,4,"À deux pas du centre ville! Vous rêvez d'une maison pleine de charme et d'histoire ? Construite dans les années 1800, cette demeure en pierre apparente allie authenticité et confort. Les atouts : Emp..."
25TI6GHTKTP1,2025-09-18T03:20:00Z,St Aubin,,39410,BUY,HOUSE,250000,90.0,4,3,"Immobilier.notaires® et l'office notarial BARTHEN et associés vous proposent : Maison / villa à vendre - ST AUBIN (39410) - - - - - - - - - - - Commune SAINT-AUBIN (39) Une maison d'habitation neuve,..."
24TFFH56BDTF,2024-12-30T12:59:00Z,Uxelles,,39130,BUY,HOUSE,165000,122.0,7,5,"Située à Uxelles , cette maison sur un terrain de 491 m² offre un cadre paisible au cœur de la nature jurassienne. Les amateurs de randonnées seront enchantés par les nombreux sentiers offerts par le..."
254ACEUIKP5G,2025-11-13T10:47:00Z,Saint-Germain-Lès-Arlay,,39210,BUY,HOUSE,235000,123.0,6,3,"Vous cherchez une maison à 10 mn de Lons le Saunier, tout en étant à la campagne; vous l'avez peut-être trouvé. Cette jolie maison de 1974 d'une surface de 120m2 habitable située dans un quartier trè..."
25CP9Q6EBN7G,2025-11-08T08:19:00Z,Courlaoux,,39570,BUY,HOUSE,299000,107.0,4,3,"Entre Lons-Le-Saunier et Beaurepaire, dans un village avec école et commerces à 8 km à l'ouest de Lons-le-Saunier, cette maison individuelle récente (2009) de plain-pied se situe dans un quartier cal..."
25846YKGBGDZ,2025-11-05T10:35:00Z,Choux,,39370,BUY,HOUSE,159000,97.0,5,3,"Idéalement située dans un cadre privilégié, au cœur du parc naturel du Haut Jura. Venez découvrir cette maison de 1861, mitoyenne d'un coté disposant d'une belle parcelle close de 1090m2. Elle se com..."
25BGYJTX8X8C,2025-11-29T11:58:00Z,Mantry,,39230,BUY,HOUSE,80000,147.0,7,3,"HN2392 - Située à MANTRY village au coeur du vignoble jurassien et proche de toutes commodités cette maison A RENOVER ENTIEREMENT se compose au rdc : 1 cuisine, 1 cellier, 1 salle à manger avec chemi..."
254DL5JRCCDU,2025-06-24T20:48:00Z,Foncine le Haut,,39460,BUY,APARTMENT,178000,142.0,5,3,Foncine-Le-Haut - Appartement de 93m² en Duplex - 3 Chs dont 2 au RDC - Cuisine / Séjour de 29m² - Grenier isolé avec possibilité d'aménagement (chambre ou autre) - Chauffage individuel - Syndic béné...
25SYWQW7BRFJ,2025-11-06T17:23:00Z,Les Rousses,,39220,BUY,APARTMENT,180000,39.06,2,1,"Appartement idéalement situé au centre du village Réf. 70210MBB - LES ROUSSES Découvrez cet appartement charmant et bien aménagé au centre du village. Avec une superficie de 39,06 m², il comprenant u..."
25E53X98HF6M,2025-10-30T13:47:00Z,Salins-les-Bains,,39110,BUY,APARTMENT,69000,52.0,3,1,"Situé à Salins-les-Bains, cet appartement de 52 m² offre un cadre de vie exceptionnel au cœur de cette charmante ville thermale réputée pour son patrimoine historique et sa tranquillité. Bénéficiant ..."
25YZ1TXCSGKN,2025-10-29T04:17:00Z,Crissey,,39100,BUY,HOUSE,390000,179.0,7,5,Immobilier.notaires® et l'office notarial BARTHEN et associés vous proposent : Maison / villa à vendre - CRISSEY (39100) - - - - - - - - - - - CRISSEY Un ensemble immobilier comprenant 2 lots. 1er lo...
