id,creationDate,city,district,zipCode,distributionType,propertyType,price,surface,nbroom,nbbedroom,description
25D835RJNZ7Y,2025-10-30T11:53:00Z,Le Donjon,,03130,BUY,HOUSE,88500,73.0,4,2,"Référence annonce : 2547 À Montaiguët-en-Forez, agréable maison de village avec dépendance et un terrain arboré. Dès l'entrée, le rez-de-chaussée séduit par sa cuisine aménagée et équipée, pratique e..."
25V2CYS8BRTQ,2025-10-24T14:46:00Z,Vichy,,03200,BUY,APARTMENT,1090000,315.0,13,8,L'agence RESIDENCE vous présente en EXCLUSIVITE un remarquable hôtel particulier de 315 m² habitables édifié en 1897 par l'architecte Antoine PERCILLY. Emplacement privilégié dans le périmètre du bie...
25Z47LXYHK2F,2025-09-09T15:26:00Z,Montluçon,Zone Industrielle Blanzat,03100,BUY,HOUSE,104000,132.0,3,2,"Montluçon – Secteur Blanzat, proche zone Saint-Jacques Idéal investisseur ! Immeuble de rapport composé de 3 lots : Un appartement F3 avec jardin et dépendances, loué 450 €/mois, Un appartement F1, l..."
25LEAKV6VX6T,2025-10-24T03:44:00Z,Mazirat,,03420,BUY,HOUSE,144000,140.0,7,5,"iad France - Julien Desmaillier vous propose: Charmante Maison de 140 m² avec Grand Jardin Arboré et Garage 70 m² – Mazirat Découvrez cette belle maison pleine de charme, située à Mazirat, dans un se..."
25EMLGU3TW6X,2025-10-18T12:10:00Z,Jaligny sur Besbre,,03220,BUY,HOUSE,187000,119.0,5,3,"Référence : 2548 EXCLUSIVITÉ. Situé au calme, à quelques minutes du centre de Jaligny-sur-Besbre, cet ensemble immobilier rare à la vente se compose de deux maisons, de nombreuses dépendances et de t..."
25FB3II37CCR,2025-10-17T21:04:00Z,Vallon-en-Sully,,03190,BUY,HOUSE,169000,113.0,4,3,03190 - VALLON-EN-SULLY – MAISON FAMILIALE + MAISONNETTE INDÉPENDANTE – TERRAIN 4000 m² – IDÉAL ARTISAN OU INVESTISSEUR Quartier résidentiel prisé – Accès PMR – Fort potentiel locatif – Dépendance 76...
251IJMQEUGI2,2025-06-25T20:27:00Z,Moulins,Sud Zone,03000,BUY,APARTMENT,78840,82.0,4,2,"iad France - Sandrine Berger vous propose: Résidence de 4 pièces, composé d'une salle lumineuse ouvrant sur un salon (bureau ou 3ème chambre, selon vos besoins). Ce bien comprend également 2 chambres..."
259SYI1EKJ9J,2025-07-23T18:17:00Z,Courçais,,03370,BUY,HOUSE,310000,130.0,6,4,"iad France - Anthony Moiny vous propose: A seulement 20 minutes de Montluçon propriété de 5 hectares, composée d'une maison récente de plain-pied de 6 pièces d'une surface de 130 m² et d'une ferme av..."
25FQSKBZ1J2I,2025-08-21T18:12:00Z,Yzeure,Centre Ville,03400,BUY,HOUSE,217000,101.0,5,4,"iad France - Nathalie Boulot vous propose: Charmante Maison Traditionnelle Rénovée - 4 Chambres - Yzeure Laissez-vous séduire par cette maison traditionnelle située dans la paisible ville d'Yzeure, à..."
25W5RLKV5XH7,2025-09-04T10:57:00Z,Saint-Prix,,03120,BUY,HOUSE,224000,104.0,5,4,"iad France - Richard Honorat vous propose: Propriété de caractère – Ensemble de 3 maisons à la campagne situé à Saint-Prix. Dans un cadre naturel d'exception, à l'abri des regards et à seulement quel..."
25FBVA4QYCJU,2025-06-01T18:20:00Z,Molinet,,03510,BUY,HOUSE,85000,74.0,3,2,"iad France - Jean-Luc Prieur vous propose: En plein coeur du village de Molinet, dans une rue calme et peu passante, à proximité de l'école primaire et l'arrêt de bus pour collège et lycée, cette cha..."
251ZLAWJCQJ2,2025-06-10T20:01:00Z,Bourbon-l'Archambault,,03160,BUY,HOUSE,113000,203.0,7,6,"iad France - Quentin Rayer vous propose : Maison à vendre à Bourbon-l'Archambault Emplacement idéal – Centre-ville et thermes à pied Située au cOEur de Bourbon-l'Archambault, cette grande maison de c..."
25J1YJ45K9JU,2025-09-30T20:54:00Z,Meaulne-Vitray,,03360,BUY,HOUSE,100000,116.0,4,3,"Située à Meaulne-Vitray, tout près de la forêt de Tronçais, cette maison bénéficie d'un environnement paisible et agréable, avec les commerces du bourg accessibles en quelques coups de pédales. Élevé..."
25ZES4L2SKAY,2025-10-14T10:38:00Z,Avermes,,03000,BUY,HOUSE,193000,153.0,6,4,iad France - Anne Michoux vous propose: Charmante Maison Familiale avec Jardin à Avermes - Potentiel Incroyable ! Vous recherchez un lieu chaleureux pour accueillir votre famille dans un cadre paisib...
253R7J2SNVHQ,2025-10-12T10:10:00Z,Yzeure,Bellevue les Ozieres,03400,BUY,HOUSE,195000,130.0,6,4,"iad France - Anne Michoux vous propose: Découvrez cette spacieuse maison élevée sur sous sol construite en 1984 d'une superficie de 130m², sur un terrain clos de 775m², située dans un quartier réside..."
2537NDG9SWAU,2025-05-15T21:12:00Z,Vichy,,03200,BUY,HOUSE,299000,145.0,5,4,"EXCLUSIVITE SI GLOBE! Maison de ville d'environ 145 m², 112 m² carrez située en plein centre de Vichy, dans une rue calme, entièrement rénovée avec prestations haut de gamme, composée, au rez-de-chau..."
25BDL9S3SN1R,2025-09-02T10:04:00Z,Saint-Victor,,03410,BUY,HOUSE,325000,152.0,7,5,"iad France - Sylvain Bertin vous propose: Pavillon Moderne de 5 Chambres à Bel-Air Bienvenue dans cette résidence d'exception située à Saint-Victor dans un quartier prisé, à quelques minutes de la N1..."
25EVJ8WIJ51F,2025-07-11T19:47:00Z,Bellerive-sur-Allier,Exterieur Haut,03700,BUY,HOUSE,280000,108.0,5,4,"Maison ossature bois à Bellerive-sur-Allier Lumineuse, au calme et sans vis-à-vis Située dans un environnement paisible, à deux pas des commodités, cette maison ossature bois (fondation en béton banc..."
25MCZU53YVGJ,2025-09-30T13:48:00Z,Huriel,,03380,BUY,HOUSE,99000,86.0,3,2,"Huriel, secteur Beaumont, maison d'habitation d'une superficie de 86 m² comprenant : entrée, cuisine aménagée, séjour, salon, toilettes. À l'étage : dégagement, deux chambres mansardées. La maison bé..."
25B67UGLNJHA,2025-08-29T10:35:00Z,Trézelles,,03220,BUY,HOUSE,283000,150.0,6,4,"Martine DUGAT et Philippe MOGIER vous proposent en EXCLUSIVITE cette grande propriété agricole dans l'Allier (03). Située au cœur du bocage bourbonnais, cette propriété agricole d'une superficie tota..."
258KRZREHY9M,2025-07-30T13:25:00Z,Montluçon,Saint Jean,03100,BUY,APARTMENT,69300,87.0,4,3,"Montluçon, quartier Saint Jean, situé au 1er étage d'un petit immeuble de seulement 2 logements, venez découvrir cet appartement à rafraichir de type 4 de 87,5 m² comprenant entrée, cuisine, séjour d..."
25M5GS9RCC2H,2025-07-21T11:43:00Z,Saint-Hilaire,,03440,BUY,HOUSE,624000,588.0,12,8,"A vendre, splendide propriété située dans un cadre idyllique à saint hilaire au cœur du bocage bourbonnais à seulement 7 km de l'autoroute, idéale pour les amateurs de nature et de tranquillité; La p..."
2515H2VZBK2G,2025-06-21T19:47:00Z,Vichy,Hôtel de Ville,03200,BUY,APARTMENT,132290,68.0,3,2,"Vichy, a 100m de la mairie et et de la gare SNCF, Philippe Laboudigue vous propose en exclusivité ce bien au 3eme étage dans une petite copropriété sécurisée et tres tranquile de 3 lots habitables!! ..."
25C3KW62BMP1,2025-02-14T08:49:00Z,Hauterive,,03270,BUY,HOUSE,525000,349.0,11,7,"Dans le centre bourg de la commune de Hauterive, ensemble immobilier composé d’une maison principale de 245 habitables et d’une annexe récente composée de deux appartements et d’un garage. Les deux b..."
248ISJ1GZ1HZ,2023-11-10T15:09:00Z,Urçay,,03360,BUY,HOUSE,169000,93.4,3,2,"référence: 1321 MAISON 3 PIÈCES AVEC JARDIN - EN EXCELLENT ÉTAT GÉNÉRAL En vente : venez découvrir cette maison de 3 pièces de 93,4 m² et de 4 370 m² de terrain à URCAY (03360). La maison inclut un g..."
25GM2HZ7ER34,2025-11-22T08:35:00Z,Montluçon,Cité Bretonnie-Chatelet-Favieres-Conches,03100,BUY,HOUSE,52000,48.27,3,2,"ORPI MONTLUCON Référence : 40919 Au cœur du vieux Montluçon, dans le centre historique, charmante maison de ville atypique, idéale pour de la location de courte durée. Elle se compose d'un séjour lum..."
25CP6UFMWCY4,2025-11-09T20:28:00Z,Ebreuil,,03450,BUY,HOUSE,55000,77.0,3,2,"Située dans la charmante ville d'Ébreuil (03450), cette maison bénéficie d'un cadre paisible et agréable. Proche des commodités locales, des commerces et offrant un accès facile aux transports en com..."
25ILAQTFW4XP,2025-11-05T09:58:00Z,Domérat,Banlieue,03410,BUY,HOUSE,116000,120.0,5,4,"À Domérat (03410), proche des commerces, des écoles et à quelques minutes de Montluçon, découvrez cette maison pleine de charme implantée sur un terrain arboré de près de 1 000 m². Le rez-de-chaussée..."
25D8SZSGLFX9,2025-11-30T13:53:00Z,Vichy,Marche,03200,BUY,APARTMENT,120600,36.0,2,1,Votre nouveau chez vous ! T2 de 36m² avec extérieur(s) Caractéristiques attrayantes : Type : Appartement T2 tout confort Surface : 36m² de pur bonheur Extérieur(s) : Oui Description : Cet appartement...
25GQUDC1HRBL,2025-11-12T08:10:00Z,Vichy,Les Bains-République,03200,BUY,APARTMENT,149000,70.0,3,2,"Découvrez cet appartement spacieux situé au premier étage d'un bâtiment bien entretenu. Avec ses 3 pièces, comprenant 2 chambres, un salon lumineux, ainsi qu'une mansarde, cet espace de 70 m² offre u..."
25G4SL7P6LZG,2025-12-01T18:53:00Z,Le Vernet,,03200,BUY,HOUSE,325000,148.0,7,4,"Villa de 148 m² habitables, 5 chambres, proche de VICHY sur la commune Le VERNET ayant les commerces de proximités. Cuisine ouverte sur salon/séjour et véranda représentant 70 m². Salle de bain avec ..."
256PVIHMPT8F,2025-11-13T14:26:00Z,Vichy,,03200,BUY,APARTMENT,123000,27.0,1,,"Dans une résidence de standing le long du parc des Sources, l'agence Résidence, vous propose un studio de 27.93m². L'appartement est entièrement rénové (menuiserie double vitrage, électricité, cuisin..."
25R8BG356H68,2025-11-26T11:39:00Z,Treteau,,03220,BUY,HOUSE,980000,440.0,13,3,Ce domaine agricole de 69ha env. comprend un château construit au XVIIIème siècle et agrandi et modernisé début XXeme. et des dépendances dans un parc de 1.1ha env. Le reste de la propriété est en te...
25AM98IJ7RGV,2025-11-26T11:39:00Z,Ébreuil,,03450,BUY,HOUSE,790000,350.0,14,7,"Cette propriété pleine de charme, à taille humaine, se distingue par l'authenticité de ses éléments architecturaux et son emplacement d'exception. Situé dans un environnement préservé, sans nuisances..."
2589WKP1UU29,2025-11-19T18:04:00Z,Le Donjon,,03130,BUY,HOUSE,35000,108.0,4,1,"REF 2550, Au coeur du Donjon, proche de toutes commodités, cette maison mitoyenne en partie édifiée sur cave voutée, à rénover, se compose : en rez de chaussée : d'une cuisine ouverte sur séjour, une..."
251MLNU43YWU,2025-11-14T13:52:00Z,Cérilly,,03350,BUY,HOUSE,35000,104.0,5,3,"Charmante Maison de Bourg à proximité de la forêt de Tronçais. La maison de 104 m2, comprenant 3 chambres, une cuisine, une pièce de vie, une salle de bain, WC indépendants, un grenier ainsi que deux..."
256AKTJDKDWJ,2025-11-07T20:50:00Z,Charroux,,03140,BUY,HOUSE,169000,96.0,3,2,"Si vous rêvez d'une belle longère en plein cœur d'un des plus beaux villages de France: Charroux ALLIER, ce bien vous tend les bras. Cerise sur le gâteau cette propriété possède un terrain de 3000 M2..."
253REMH43RNC,2025-11-27T13:36:00Z,Le Donjon,,03130,BUY,HOUSE,49000,80.0,4,2,Fiche Id-SLG176837 : EXCLUSIVITE - Entre Loire et Allier - Le Donjon : Vrai village vivant - offrant services et commodités- Commerces de proximité - crèche et collège - maison de santé et pharmacie ...
25M52DNMRIUP,2025-11-26T16:07:00Z,Vichy,Deniere les Romains,03200,BUY,APARTMENT,299900,81.0,4,3,"Situé à proximité de la gare et du centre ville dans une résidence de bon standing, bel appartement familial 4 pièces avec 2 TERRASSES comprenant : séjour, cuisine, 3 chambres, salle de bains, toilet..."
25Z65YWYFDGJ,2025-11-26T16:07:00Z,Vichy,Deniere les Romains,03200,BUY,APARTMENT,174000,58.0,3,2,"NOUVEAUTÉ. Dans une résidence de standing sécurisée, découvrez ce bel appartement 3 pièces avec BALCON exposé SUD-EST. Il se compose d'un séjour, d'une cuisine, de deux chambres, d'une salle de bains..."
25U834J8UBEZ,2025-11-26T16:07:00Z,Vichy,Deniere les Romains,03200,BUY,APARTMENT,218000,73.0,4,3,"NOUVEAUTÉ. Dans une résidence de standing sécurisée, découvrez cet bel appartement familial 4 pièces avec BALCON exposé SUD-OUEST. Il se compose d'un séjour, d'une cuisine, de trois chambres, d'une s..."
25X9T4PAWRB9,2025-11-02T19:07:00Z,Saint-Ennemond,,03400,BUY,HOUSE,108000,129.0,6,4,"SAINT ENNEMOND (03400) Patrice RACOEUR vous présente cette jolie maison bourbonnaise à 10 minutes de Moulins 129 m² hab. De plain pied une belle pièce de vie de 26 m² communiquant sur salon de 14 m²,..."
25LH4L497R4Z,2025-11-28T15:42:00Z,Désertines,,03630,BUY,HOUSE,172000,94.0,5,4,"Référence : 41022 Bienvenue à Désertines, dans cette maison de 5 pièces, rénovée avec goût, où vous n'aurez plus qu'à poser vos valises. Profitez d'une cuisine équipée, ouverte sur séjour, d'une suit..."
25L27FY479RK,2025-11-22T08:33:00Z,Vallon-en-Sully,,03190,BUY,HOUSE,18000,,1,1,"Réf : 40469 Laissez libre cours à vos projets dans cet ensemble immobilier à rénover entièrement, possédant un fort potentiel. Situé dans le bourg d'un village disposant de toutes les commodités, à 1..."
25JT6APE6XLD,2025-11-15T21:13:00Z,Tronget,,03240,BUY,HOUSE,139000,300.0,10,7,"iad France - Vincent Dubois vous propose: Longère atypique de 300 m² offrant un énorme potentiel, comprenant un sous-sol avec espace de stockage et écurie. Au premier étage, une première partie habit..."
2592T7V4QS8L,2025-11-29T04:15:00Z,Cognat-Lyonne,,03110,BUY,PROJECT,207128,,4,3,Le Prêt 0% est de retour en 2025 et finance une partie de votre projet SANS INTÉRÊT : - Jusqu'à 30% de votre projet financé - Paiement différé jusqu'à 10 ans pour alléger vos mensualités A COGNAT-LYO...
25R8P8GX3IQ3,2025-11-05T04:44:00Z,Montluçon,Chantoiseau-Faucheroux,03100,BUY,HOUSE,138000,127.0,5,3,"iad France - Floriane André vous propose: Charmante Maison Familiale de 127m² avec Jardin à Montluçon Cette charmante maison individuelle de type familial, d'une surface de 127m², est une belle oppor..."
25BNJMXY4HN6,2025-11-06T14:07:00Z,Saint-Angel,,03170,BUY,HOUSE,174500,170.0,8,6,"iad France - Veronique LANDRIER vous propose: Pavillon sur sous-sol complet, idéalement située à Saint-Angel, à la limite de Désertines, dans un environnement calme et recherché. Cette maison spacieu..."
258QIF3S7M4E,2025-12-01T16:29:00Z,Bellerive-sur-Allier,Centre Ville Haut,03700,BUY,PROJECT,248422,,4,3,"Dans un environnement calme et verdoyant, proche de toutes les commodités (commerces, services, écoles et arrêts de bus) dans un quartier résidentiel prisé le terrain entièrement viabilisés possède u..."
25I5QLNWZ1ET,2025-12-01T16:29:00Z,Charmeil,,03110,BUY,PROJECT,294725,,4,3,Aux portes de Vichy terrain constructible d'une surface 880m² avec réseaux en bordure de terrain Maisons Clair Logis est désormais une filiale du Groupe Duval sous la marque Maisons Clair Logis ! Ori...
25AN8JMZ8T52,2025-01-18T13:25:00Z,Yzeure,Centre Ville,03400,BUY,HOUSE,448000,228.0,6,4,"ENDIE IMMOBILIER-YZEURE-MAISON ARCHITHEQUE QUARTIER CALME - VUE DÉGAGÉE SUD En vente : proche des commodités, nous sommes heureux de vous présenter cette maison de 7 pièces de 228 m² à YZEURE (03400)..."
255HQ36F31MP,2025-11-25T08:37:00Z,Bouce,,03150,BUY,HOUSE,239000,210.0,7,5,"Amateurs d'espace et de nature, Venez découvrir cette magnifique et atypique maison à seulement 15 min Saint Pourçain sur Sioule disposant jusqu'à 23.000 m² de terrain sans voisins ni vis -à- vis, al..."
25V8CFS5R6V8,2025-09-24T14:24:00Z,Montluçon,Dienat-Forges,03100,BUY,HOUSE,159000,159.0,6,4,"Maison de ville d'une superficie de 159 m², comprenant : une entrée, un séjour double de 53 m², une cuisine aménagée et équipée avec accès à la terrasse, quatre chambres, une salle de bains avec douc..."
25NJXK2FZMWA,2025-11-19T12:02:00Z,Montluçon,Les Iles-Buffon,03100,BUY,HOUSE,162000,206.1,6,4,"Réf 40905 Maison à vendre à Montluçon, proche des commerces — Superficie 206 m², bâtie en 1957. Cette maison offre un séjour spacieux et lumineux , une cuisine ouverte sur une deuxième salle à manger..."
25G6NYYQUHCH,2025-11-19T09:54:00Z,Domérat,Banlieue,03410,BUY,HOUSE,163000,91.24,4,3,"REF : 40927 Bienvenue dans cette charmante maison de 91 m² qui offre 3 chambres confortables, un séjour chaleureux, une cuisine lumineuse, une salle d'eau, un sous sol et un garage intérieur pratique..."
25SYSNZRKMUQ,2025-11-18T21:48:00Z,Montlucon,,03100,BUY,APARTMENT,55000,63.0,3,2,"MONTLUCON proche des berges du Cher dans une petite copropriété de seulement 7 lots , appartement avec balcon situé au troisième étage sur 3 au calme comprenant cuisine équipée et meublée, séjour , 2..."
25PQNZL8Z2ZH,2025-11-18T19:39:00Z,Vichy,France et Rosieres,03200,BUY,HOUSE,225000,81.0,3,2,"Venez découvrir cette charmante maison de 81 m2, idéale pour une petite famille ou un couple à la recherche de confort et de convivialité. Vous serez déduit par sa spacieuse pièce à vivre d'envrion 3..."
25YANHRAL51L,2025-09-24T13:52:00Z,Huriel,,03380,BUY,HOUSE,103550,70.0,3,2,"Charmante maison rénovée d'une superficie de 70 m², comprenant : une entrée, une cuisine aménagée, un séjour, deux chambres, deux salles de bains et des toilettes. Le bien dispose d'un agréable jardi..."
25JDY6I5G5JV,2025-09-05T16:33:00Z,Moulins,,03000,BUY,APARTMENT,232000,147.0,4,3,"Idéalement situé, découvrez ce spacieux appartement de 147 m² habitables au 1er étage, avec de beaux volumes et une luminosité naturelle exceptionnelle. Un agencement fonctionnel et familial : Grande..."
25S5S5BQUG1S,2025-05-23T20:53:00Z,Bellenaves,,03330,BUY,HOUSE,390000,360.0,9,5,"03330 - MAISON DE CAMPAGNE RÉNOVÉE - 9 PIÈCES - 5 CHAMBRES - SURFACE 360.0 M² - VUE EXCEPTIONNELLE efficity, l'agence qui estime votre bien en ligne, vous propose cette magnifique maison de campagne ..."
25GCLGSE4M5K,2025-05-20T13:42:00Z,Moulins,,03000,BUY,APARTMENT,173000,98.0,4,2,"COUP DE CŒUR EN EXCLUSIVITÉ ! Posez vos valises dans ce spacieux appartement de 98,7 m² (Loi Carrez), entièrement rénové avec goût en 2022, situé au 1er étage d'une petite copropriété intimiste de se..."
251K6BI63SGH,2025-10-30T19:05:00Z,Vichy,Hôtel de Ville,03200,BUY,APARTMENT,96000,27.0,2,1,"iad France - Hugues Neury vous propose: À vendre dans une résidence fermée, située dans un bâtiment emblématique de VICHY CŒUR DE VILLE, face au parc, ce joli petit appartement. Situé au troisième ét..."
25GRDNMYFIK3,2025-10-22T22:08:00Z,Teillet-Argenty,,03410,BUY,HOUSE,145000,122.0,5,3,"iad France - Vanessa Telbois vous propose: Charmante Maison de Caractère - 3 Chambres - Jardin Arboré - Garage Au cOEur du paisible village de Teillet-Argenty, nichée sur un terrain de 1288m², cette ..."
259Q4KU1JCI1,2025-10-21T10:28:00Z,Limoise,,03320,BUY,HOUSE,99500,116.0,5,3,"iad France - Anne Brulet vous propose: Maison de village située dans le bourg de Limoise, à 10 minutes de Bourbon l'Archambault, et à 20 minutes de Moulins. Grâce à ces 116m² répartis sur deux niveau..."
257Y1SYDUD9B,2025-08-05T13:21:00Z,Vichy,,03200,BUY,APARTMENT,459000,89.0,3,2,"Situé en étage élevé, en hyper centre, dans un immeuble de grand standing avec ascenseur, l'agence RESIDENCE vous présente un superbe appartement entièrement rénové de 89,16 m². L'ensemble offre une ..."
25V15VW3LB5Z,2025-09-03T13:04:00Z,Le Vilhain,,03350,BUY,HOUSE,115000,108.0,3,2,"Située à 10 minutes de Cosne d'allier ou de Cérilly, cette maison d'environ 115m² s'inscrit dans un cadre champêtre offrant tranquillité et authenticité, appréciée pour sa structure saine et ses poss..."
25PSMYLA5FCN,2025-10-17T05:48:00Z,Châtel-Montagne,,03250,BUY,HOUSE,121000,112.0,5,3,Je vous présente ce bien situé dans un hameau charmant et convivial de Châtel-Montagne. Il offre un environnement paisible et verdoyant grâce à son jardin clos en totalité d'environ 230m² à l'arrière...
25E5VLF94D83,2025-10-15T18:41:00Z,Creuzier-le-Vieux,,03300,BUY,HOUSE,119000,107.0,2,1,"Martine DUGAT et Philippe MOGIER vous proposent en EXCLUSIVITE cette maison à fort potentiel. À seulement 10 minutes de Vichy et 7 minutes des commerces et écoles, découvrez cette maison à rénover, o..."
2557WB756I43,2025-10-15T13:16:00Z,Vichy,Marche,03200,BUY,HOUSE,295000,112.0,4,3,"iad France - Christel Bertrand vous propose : NOUVEAUTE CHARMANTE MAISON EN COEUR DE VILLE Venez découvrir cette charmante maison située dans une rue calme, en plein centre ville de Vichy. Au RDC, le..."
25DFQRDPISR5,2025-06-15T03:46:00Z,Neuilly-le-Réal,,03340,BUY,HOUSE,279000,180.0,7,4,"iad France - Vincent Dubois vous propose: MAGNIFIQUE maison à étage de 180m2 au sol composée au rez de chaussée d'une entrée qui dessert une AGREABLE cuisine équipée et aménagée, un SPACIEUX salon sé..."
254J79M7FXC7,2025-05-15T13:13:00Z,Chevagnes,,03230,BUY,HOUSE,153000,217.0,6,5,iad France - Vincent Dubois vous propose: BELLE maison atypique de 217m2 avec beaucoup de charme et de potentiels située en plein coeur de Chevagnes ! Idéal pour un investissement avec le Pal à proxi...
25VWAT3CN9XB,2025-07-15T20:12:00Z,Yzeure,Bellevue les Ozieres,03400,BUY,HOUSE,249000,124.0,4,3,"iad France - Vincent Dubois vous propose: BELLE maison sur sous sol de 124m2 composée au rez de chaussée d'un GRAND garage, d'une chaufferie, d'un atelier, d'une salle d'eau, d'un WC et d'une chambre..."
25L6IKM6X7E2,2025-09-08T18:14:00Z,Saint-Sauvier,,03370,BUY,HOUSE,150000,214.0,8,5,"iad France - Valérie Larue vous propose: Située dans un cadre verdoyant et paisible, cette magnifique maison de 214m² est un véritable havre de paix pour une famille recherchant espace et tranquillit..."
25C6ZMXJRRWY,2025-05-13T18:07:00Z,Molinet,,03510,BUY,HOUSE,294500,156.0,7,4,"iad France - Justine Radenne vous propose: Charmante et lumineuse maison construite en 2005 avec piscine située dans un petit village, à 5 minutes de Digoin. Dès l'entrée, vous ne pourrez qu'être cha..."
255KDWQWEWTW,2025-09-04T10:49:00Z,Montluçon,Montgacher-Cordeliers,03100,BUY,HOUSE,174900,132.0,6,4,"iad France - Jean-Philippe Barck vous propose: Maison rénovée – 4 chambres – sous-sol complet – Montluçon Charmante maison entièrement rénovée (sol, murs, plafonds et installations) par des artisans ..."
259LSF1E8K5Q,2025-10-15T11:20:00Z,Moulins,Centre Historique,03000,BUY,APARTMENT,139000,79.0,3,2,"iad France - Johan JOYON vous propose: Moulins Centre, sur les cours, le cachet de ce duplex ne pourra que vous séduire. Situé au second étage d'un immeuble du milieu du 19e, composé de 3 appartement..."
25KVZUNT9DFS,2025-06-30T20:04:00Z,Saint-Germain-des-Fossés,,03260,BUY,HOUSE,132000,93.0,5,4,"iad France - Philippe Grenot vous propose: *Maison de Ville Rénovée - Saint-Germain-des-Fossés** Investisseur: cette maison de ville alliant charme, modernité et confort à Saint-Germain-des-Fossés es..."
25P7MZ5DDDE1,2025-08-21T12:48:00Z,Commentry,Ieme Zone,03600,BUY,HOUSE,55900,68.0,3,2,"COMMENTRY centre-ville, à proximité immédiate de tous commerces, maison sans travaux de 68m² sur deux niveaux, avec 2 chambres, un bureau, salle de bain WC, une cuisine et séjour et une véranda. À l'..."
25T8E12GUAJ5,2025-10-09T11:57:00Z,Vichy,,03200,BUY,APARTMENT,78600,41.17,2,1,"En exclusivité - Dans une résidence arborée dans une copropriété de 98 logements principaux, à proximité de l'école de kiné et d'infirmières, de la gare et des commerces. Venez découvrir ce bel appar..."
25EYVX41QEQX,2025-10-04T13:42:00Z,Audes,,03190,BUY,HOUSE,117000,152.0,5,3,"01190 Audes – Maison de charme avec dépendances & potentiel locatif, Vous rêvez de vivre au calme, dans un cadre verdoyant, tout en restant proche des commodités ? Située à seulement 12 minutes de Mo..."
25UAIQF1FMFW,2025-09-28T07:19:00Z,La Guillermie,,03250,BUY,HOUSE,138000,178.0,9,6,"Très beau potentiel pour cette maison avec une exposition traversante est-ouest, basée sur un terrain de 1611m² et située dans un lieu-dit entre Ferrieres sur Sichon et La Guillermie, en Montagne Bou..."
25YPK91ECKA2,2025-07-25T00:35:00Z,Domérat,Banlieue,03410,BUY,HOUSE,112000,115.0,5,4,"03410 - DOMERAT - QUARTIER CALME - 5 PIÈCES - 4 CHAMBRES - 115M² - MAISON AVEC JARDIN ARBORÉ ET SOUS-SOL efficity, l'agence qui estime votre bien en ligne, et Stéphane Maubrou vous propose cette char..."
25B7WY5RVPPC,2025-11-26T04:06:00Z,Saint-Victor,,03410,BUY,PROJECT,171570,,3,2,Le Prêt 0% est de retour en 2025 et finance une partie de votre projet SANS INTÉRÊT :- Jusqu'à 30% de votre projet financé - Paiement différé jusqu'à 10 ans pour alléger vos mensualitésA SAINT-VICTOR...
25BDALG7MBKF,2025-11-26T04:06:00Z,Durdat-Larequille,,03310,BUY,PROJECT,162500,,3,2,Le Prêt 0% est de retour en 2025 et finance une partie de votre projet SANS INTÉRÊT :- Jusqu'à 30% de votre projet financé - Paiement différé jusqu'à 10 ans pour alléger vos mensualitésA DURDAT-LAREQ...
25ISW6PQ3KL2,2025-11-08T13:53:00Z,Vichy,Marche,03200,BUY,APARTMENT,290000,117.0,5,3,"Vente Appartement T5 – 117 m² – Vichy centre – 290 000 euros avec garage Dans un bel immeuble bourgeois des années 1920, découvrez ce magnifique appartement de 117 m², entièrement rénové avec goût, s..."
25R9NZXYGSC5,2025-11-26T16:07:00Z,Vichy,Deniere les Romains,03200,BUY,APARTMENT,165000,56.0,3,2,"NOUVEAUTÉ. Dans une résidence de standing sécurisée, découvrez cet agréable appartement 3 pièces avec LOGGIA. Il se compose d'un séjour, d'une cuisine, de deux chambres, d'une salle de bains et de to..."
25FX3YXC7GNV,2025-11-28T13:37:00Z,Le Donjon,,03130,BUY,HOUSE,173000,106.0,5,2,Fiche Id-SLG176614 : Entre Loire et Allier: Hameau de BERT - A 15 mn de Lapalisse - Sur 2200 m² de terrain clos et aménagé avec dépendance - Charmante réalisation des années 30 offrant 106 m² habitab...
